source_sequence,project_name,normalized_project_name,source_operation_mode,operation_strategy,operation_strategy_label,source_file,source_received_date
177,潼南支行东安分理处营业网点主体装修工程项目,潼南支行东安分理处营业网点主体装修工程项目,公司联营,joint,联营项目,副本项目名称统计表直营41条，联营693条(1).xlsx,2026-05-20
178,界石围栏采购项目,界石围栏采购项目,公司联营,joint,联营项目,副本项目名称统计表直营41条，联营693条(1).xlsx,2026-05-20
179,2024年中江县永兴镇七郎村集体经济扶持村项目,2024年中江县永兴镇七郎村集体经济扶持村项目,公司联营,joint,联营项目,副本项目名称统计表直营41条，联营693条(1).xlsx,2026-05-20
180,大唐甘肃发电有限公司碧口水力发电厂碧口水电站右岸泄洪洞护坦防护结构改造施工,大唐甘肃发电有限公司碧口水力发电厂碧口水电站右岸泄洪洞护坦防护结构改造施工,公司联营,joint,联营项目,副本项目名称统计表直营41条，联营693条(1).xlsx,2026-05-20
181,阆中水城项目唐家山片区一期酒店热水及地暖改造工程,阆中水城项目唐家山片区一期酒店热水及地暖改造工程,公司联营,joint,联营项目,副本项目名称统计表直营41条，联营693条(1).xlsx,2026-05-20
182,建工五建——科发泰升人和——装饰装修2专业分包,建工五建--科发泰升人和--装饰装修2专业分包,公司联营,joint,联营项目,副本项目名称统计表直营41条，联营693条(1).xlsx,2026-05-20
183,喀什地区检察院办案与专业技术用房外立面改造项目,喀什地区检察院办案与专业技术用房外立面改造项目,公司联营,joint,联营项目,副本项目名称统计表直营41条，联营693条(1).xlsx,2026-05-20
184,绵阳市涪城区教工幼儿园维修装饰工程,绵阳市涪城区教工幼儿园维修装饰工程,公司联营,joint,联营项目,副本项目名称统计表直营41条，联营693条(1).xlsx,2026-05-20
185,四川省广汉高封橡塑有限公司地上建(构)筑物附着物拆除工程及残值处置项目,四川省广汉高封橡塑有限公司地上建(构)筑物附着物拆除工程及残值处置项目,公司联营,joint,联营项目,副本项目名称统计表直营41条，联营693条(1).xlsx,2026-05-20
186,绵阳市公安局高新技术产业开发区分局磨家派出所改造工程,绵阳市公安局高新技术产业开发区分局磨家派出所改造工程,公司联营,joint,联营项目,副本项目名称统计表直营41条，联营693条(1).xlsx,2026-05-20
187,银鑫五洲广场二期 1#楼 A、D 座楼栋间交界处防水施工,银鑫五洲广场二期1#楼A、D座楼栋间交界处防水施工,公司联营,joint,联营项目,副本项目名称统计表直营41条，联营693条(1).xlsx,2026-05-20
188,中铁八局集团有限公司德阳经开区市政道路工程项目(齐湖路、黔江街)土石方工程,中铁八局集团有限公司德阳经开区市政道路工程项目(齐湖路、黔江街)土石方工程,公司联营,joint,联营项目,副本项目名称统计表直营41条，联营693条(1).xlsx,2026-05-20
189,德阳站综合交通枢纽改造项目（德阳站、S11 线连通工程等 4 个子项）漓江一、二西路特殊地基处理工程,德阳站综合交通枢纽改造项目(德阳站、S11线连通工程等4个子项)漓江一、二西路特殊地基处理工程,公司联营,joint,联营项目,副本项目名称统计表直营41条，联营693条(1).xlsx,2026-05-20
190,重庆市璧山区青杠街道山洪沟整治项目,重庆市璧山区青杠街道山洪沟整治项目,公司联营,joint,联营项目,副本项目名称统计表直营41条，联营693条(1).xlsx,2026-05-20
191,德阳市罗江区综合行政执法局2024年罗江区零星市政维修工程（苍海D区、潺亭中学旁等7座公厕维修改造）,德阳市罗江区综合行政执法局2024年罗江区零星市政维修工程(苍海D区、潺亭中学旁等7座公厕维修改造),公司联营,joint,联营项目,副本项目名称统计表直营41条，联营693条(1).xlsx,2026-05-20
192,洛碛餐厨污水处理厂基础设施修复及零星工程项目,洛碛餐厨污水处理厂基础设施修复及零星工程项目,公司联营,joint,联营项目,副本项目名称统计表直营41条，联营693条(1).xlsx,2026-05-20
193,喀什西克尔水库架空线路和配电工程专业分包,喀什西克尔水库架空线路和配电工程专业分包,公司联营,joint,联营项目,副本项目名称统计表直营41条，联营693条(1).xlsx,2026-05-20
194,杰阳排水有限公司采购零星修缮服务,杰阳排水有限公司采购零星修缮服务,公司联营,joint,联营项目,副本项目名称统计表直营41条，联营693条(1).xlsx,2026-05-20
195,德阳市罗江区鄢家镇高垭村山坪塘整治项目,德阳市罗江区鄢家镇高垭村山坪塘整治项目,公司联营,joint,联营项目,副本项目名称统计表直营41条，联营693条(1).xlsx,2026-05-20
196,德阳市青少年宫舞蹈、钢琴、美术教室改造（二次）,德阳市青少年宫舞蹈、钢琴、美术教室改造(二次),公司联营,joint,联营项目,副本项目名称统计表直营41条，联营693条(1).xlsx,2026-05-20
197,重庆轨道交通15号线一期土建工程01标金童路站2B出入口 DN500 给水管道迁改工程,重庆轨道交通15号线一期土建工程01标金童路站2B出入口DN500给水管道迁改工程,公司联营,joint,联营项目,副本项目名称统计表直营41条，联营693条(1).xlsx,2026-05-20
198,绵竹市高新区科技服务中心项目消防工程,绵竹市高新区科技服务中心项目消防工程,公司联营,joint,联营项目,副本项目名称统计表直营41条，联营693条(1).xlsx,2026-05-20
199,四川省德阳市2012-2013年中小河流水文监测系统新建水文站-站房工程,四川省德阳市2012-2013年中小河流水文监测系统新建水文站-站房工程,公司联营,joint,联营项目,副本项目名称统计表直营41条，联营693条(1).xlsx,2026-05-20
200,中国电信泸州分公司2024-2026年房屋装修、维修服务项目,中国电信泸州分公司2024-2026年房屋装修、维修服务项目,公司联营,joint,联营项目,副本项目名称统计表直营41条，联营693条(1).xlsx,2026-05-20
201,西藏军区工程建设项目临时器材库和装备库建设项目（2302项目）,西藏军区工程建设项目临时器材库和装备库建设项目(2302项目),公司联营,joint,联营项目,副本项目名称统计表直营41条，联营693条(1).xlsx,2026-05-20
202,东水门大桥、朝天门大桥（南北）公园、停车场、电梯等新增附属设施工程,东水门大桥、朝天门大桥(南北)公园、停车场、电梯等新增附属设施工程,公司联营,joint,联营项目,副本项目名称统计表直营41条，联营693条(1).xlsx,2026-05-20
203,旌阳印象森林餐厅零星维修工程,旌阳印象森林餐厅零星维修工程,公司联营,joint,联营项目,副本项目名称统计表直营41条，联营693条(1).xlsx,2026-05-20
204,旌南大厦12楼办公场所装修项目,旌南大厦12楼办公场所装修项目,公司联营,joint,联营项目,副本项目名称统计表直营41条，联营693条(1).xlsx,2026-05-20
205,2023年渝中区绿管处冬季行道树修剪,2023年渝中区绿管处冬季行道树修剪,公司联营,joint,联营项目,副本项目名称统计表直营41条，联营693条(1).xlsx,2026-05-20
206,西藏方向军事设施建设项目施工总承包合同90项目工程工序劳务作业,西藏方向军事设施建设项目施工总承包合同90项目工程工序劳务作业,公司联营,joint,联营项目,副本项目名称统计表直营41条，联营693条(1).xlsx,2026-05-20
207,临空经济总部大楼A栋9层装修装饰工程,临空经济总部大楼A栋9层装修装饰工程,公司联营,joint,联营项目,副本项目名称统计表直营41条，联营693条(1).xlsx,2026-05-20
208,巴中恩阳临港产业园建设项目-制造业组团项目21-22号厂房消防工程,巴中恩阳临港产业园建设项目-制造业组团项目21-22号厂房消防工程,公司联营,joint,联营项目,副本项目名称统计表直营41条，联营693条(1).xlsx,2026-05-20
209,集团五楼男卫生间渗水修缮项目,集团五楼男卫生间渗水修缮项目,公司联营,joint,联营项目,副本项目名称统计表直营41条，联营693条(1).xlsx,2026-05-20
210,旌阳区涪江苑小区等2个城镇老旧小区改造及配套基础设施改造项目（孝感街道二期）-涪江苑小区周边道路改造,旌阳区涪江苑小区等2个城镇老旧小区改造及配套基础设施改造项目(孝感街道二期)-涪江苑小区周边道路改造,公司联营,joint,联营项目,副本项目名称统计表直营41条，联营693条(1).xlsx,2026-05-20
211,德阳市主城区园林绿化及市政设施提档升级项目（庐山路及长江路示范段）,德阳市主城区园林绿化及市政设施提档升级项目(庐山路及长江路示范段),公司联营,joint,联营项目,副本项目名称统计表直营41条，联营693条(1).xlsx,2026-05-20
212,伽师县工业园区空气源供热建设项目（二次）二标段,伽师县工业园区空气源供热建设项目(二次)二标段,公司联营,joint,联营项目,副本项目名称统计表直营41条，联营693条(1).xlsx,2026-05-20
213,东河农贸市场场内厕所改造,东河农贸市场场内厕所改造,公司联营,joint,联营项目,副本项目名称统计表直营41条，联营693条(1).xlsx,2026-05-20
214,凯州新城城乡一体化项目配套建设工程保温工程专业分包,凯州新城城乡一体化项目配套建设工程保温工程专业分包,公司联营,joint,联营项目,副本项目名称统计表直营41条，联营693条(1).xlsx,2026-05-20
215,旌阳区综合管廊项目泰山路段支护及防水工程二标,旌阳区综合管廊项目泰山路段支护及防水工程二标,公司联营,joint,联营项目,副本项目名称统计表直营41条，联营693条(1).xlsx,2026-05-20
216,旌阳区综合管廊项目泰山路段支护及防水工程一标,旌阳区综合管廊项目泰山路段支护及防水工程一标,公司联营,joint,联营项目,副本项目名称统计表直营41条，联营693条(1).xlsx,2026-05-20
217,重庆机场护宾楼二层办公室改造项目,重庆机场护宾楼二层办公室改造项目,公司联营,joint,联营项目,副本项目名称统计表直营41条，联营693条(1).xlsx,2026-05-20
218,德阳市旌阳区东湖-和新（崴和路）道路改建工程（K4+140-K4+790边坡滑坡治理）,德阳市旌阳区东湖-和新(崴和路)道路改建工程(K4+140-K4+790边坡滑坡治理),公司联营,joint,联营项目,副本项目名称统计表直营41条，联营693条(1).xlsx,2026-05-20
219,新疆维吾尔自治区喀什地区大数据局电力机房维修维护项目,新疆维吾尔自治区喀什地区大数据局电力机房维修维护项目,公司联营,joint,联营项目,副本项目名称统计表直营41条，联营693条(1).xlsx,2026-05-20
220,中国电信股份有限公司德阳分公司2023-2024年房屋零星维修服务,中国电信股份有限公司德阳分公司2023-2024年房屋零星维修服务,公司联营,joint,联营项目,副本项目名称统计表直营41条，联营693条(1).xlsx,2026-05-20
221,中建七局天府大道北延线（德阳段）项目桥面防水工程,中建七局天府大道北延线(德阳段)项目桥面防水工程,公司联营,joint,联营项目,副本项目名称统计表直营41条，联营693条(1).xlsx,2026-05-20
222,德阳市漓江路大桥-穿绵远河给水管道工程,德阳市漓江路大桥-穿绵远河给水管道工程,公司联营,joint,联营项目,副本项目名称统计表直营41条，联营693条(1).xlsx,2026-05-20
223,德阳站综合交通枢纽改造项目（旌阳区长江流域可持续发展（沱江上游-绵远河段）综合治理项目-河西段）工程,德阳站综合交通枢纽改造项目(旌阳区长江流域可持续发展(沱江上游-绵远河段)综合治理项目-河西段)工程,公司联营,joint,联营项目,副本项目名称统计表直营41条，联营693条(1).xlsx,2026-05-20
224,德阳市天府旌城石亭江河段堤防改建给水迁改工程,德阳市天府旌城石亭江河段堤防改建给水迁改工程,公司联营,joint,联营项目,副本项目名称统计表直营41条，联营693条(1).xlsx,2026-05-20
225,合川高新区南溪组团用地整治项目,合川高新区南溪组团用地整治项目,公司联营,joint,联营项目,副本项目名称统计表直营41条，联营693条(1).xlsx,2026-05-20
226,重庆轨道交通15号线一期土建工程03标绣湖路DN400给水管道迁改工程,重庆轨道交通15号线一期土建工程03标绣湖路DN400给水管道迁改工程,公司联营,joint,联营项目,副本项目名称统计表直营41条，联营693条(1).xlsx,2026-05-20
227,喀什地区塔什库尔干县曲什曼检查站至垃圾处理厂道路路灯采购项目（二次）,喀什地区塔什库尔干县曲什曼检查站至垃圾处理厂道路路灯采购项目(二次),公司联营,joint,联营项目,副本项目名称统计表直营41条，联营693条(1).xlsx,2026-05-20
228,绵阳市游仙区魏城镇竹柳村（原柳塔村3组）通组道路硬化工程项目,绵阳市游仙区魏城镇竹柳村(原柳塔村3组)通组道路硬化工程项目,公司联营,joint,联营项目,副本项目名称统计表直营41条，联营693条(1).xlsx,2026-05-20
229,2023年德阳经开区保障性安居工程城镇老旧小区主体改造项目劳务分包第十二标段,2023年德阳经开区保障性安居工程城镇老旧小区主体改造项目劳务分包第十二标段,公司联营,joint,联营项目,副本项目名称统计表直营41条，联营693条(1).xlsx,2026-05-20
230,五里坪站场发停车区域调整综合改造工程,五里坪站场发停车区域调整综合改造工程,公司联营,joint,联营项目,副本项目名称统计表直营41条，联营693条(1).xlsx,2026-05-20
231,喀什地区英吉沙县2022年停车场建设项目工程总承包,喀什地区英吉沙县2022年停车场建设项目工程总承包,公司联营,joint,联营项目,副本项目名称统计表直营41条，联营693条(1).xlsx,2026-05-20
232,德阳市中心城区照明改造工程-10KV配电工程,德阳市中心城区照明改造工程-10KV配电工程,公司联营,joint,联营项目,副本项目名称统计表直营41条，联营693条(1).xlsx,2026-05-20
233,喀什地区一市四县带动农户养殖喀什黑鸡基础设施建设项目-喀什市一期电力,喀什地区一市四县带动农户养殖喀什黑鸡基础设施建设项目-喀什市一期电力,公司联营,joint,联营项目,副本项目名称统计表直营41条，联营693条(1).xlsx,2026-05-20
234,李家沱战场入口地面修复工程,李家沱战场入口地面修复工程,公司联营,joint,联营项目,副本项目名称统计表直营41条，联营693条(1).xlsx,2026-05-20
235,中国农业发展银行什邡市支行雨、污管道改造项目,中国农业发展银行什邡市支行雨、污管道改造项目,公司联营,joint,联营项目,副本项目名称统计表直营41条，联营693条(1).xlsx,2026-05-20
236,二重厂西路（华山路-衡山路）等4条路砂石工程专业分包,二重厂西路(华山路-衡山路)等4条路砂石工程专业分包,公司联营,joint,联营项目,副本项目名称统计表直营41条，联营693条(1).xlsx,2026-05-20
237,德阳高新区万福棚改二期大门改造工程机电安装专业分包,德阳高新区万福棚改二期大门改造工程机电安装专业分包,公司联营,joint,联营项目,副本项目名称统计表直营41条，联营693条(1).xlsx,2026-05-20
238,2023年南岸区城市桥隧设施病害整治工程,2023年南岸区城市桥隧设施病害整治工程,公司联营,joint,联营项目,副本项目名称统计表直营41条，联营693条(1).xlsx,2026-05-20
239,伽师县工业园区空气源供热建设项目（二次）,伽师县工业园区空气源供热建设项目(二次),公司联营,joint,联营项目,副本项目名称统计表直营41条，联营693条(1).xlsx,2026-05-20
240,龙洲湾公交站场排水沟沟盖板维修,龙洲湾公交站场排水沟沟盖板维修,公司联营,joint,联营项目,副本项目名称统计表直营41条，联营693条(1).xlsx,2026-05-20
241,南木林县拉布普乡皮布岔口东娘村公路工程项目,南木林县拉布普乡皮布岔口东娘村公路工程项目,公司联营,joint,联营项目,副本项目名称统计表直营41条，联营693条(1).xlsx,2026-05-20
242,某部车库建设项目,某部车库建设项目,公司联营,joint,联营项目,副本项目名称统计表直营41条，联营693条(1).xlsx,2026-05-20
243,汉源县生态农副产品产业园区基础配套设施建设项目-孵化园一标段,汉源县生态农副产品产业园区基础配套设施建设项目-孵化园一标段,公司联营,joint,联营项目,副本项目名称统计表直营41条，联营693条(1).xlsx,2026-05-20
244,北新国际冷链商贸物流项目E地块E3#-1、E4#-1综合项目,北新国际冷链商贸物流项目E地块E3#-1、E4#-1综合项目,公司联营,joint,联营项目,副本项目名称统计表直营41条，联营693条(1).xlsx,2026-05-20
245,何东中石油煤层气公司新疆后峡项目,何东中石油煤层气公司新疆后峡项目,公司联营,joint,联营项目,副本项目名称统计表直营41条，联营693条(1).xlsx,2026-05-20
246,40万吨高强包装纸扩建项目余土/渣土外运专业分包工程,40万吨高强包装纸扩建项目余土/渣土外运专业分包工程,公司联营,joint,联营项目,副本项目名称统计表直营41条，联营693条(1).xlsx,2026-05-20
247,欧麓花园入口地面维修,欧麓花园入口地面维修,公司联营,joint,联营项目,副本项目名称统计表直营41条，联营693条(1).xlsx,2026-05-20
248,德阳市旌阳区八角井镇卫生院-各类设施零星维护管理,德阳市旌阳区八角井镇卫生院-各类设施零星维护管理,公司联营,joint,联营项目,副本项目名称统计表直营41条，联营693条(1).xlsx,2026-05-20
249,德阳市旌阳区涪江路小学校校舍维修工程,德阳市旌阳区涪江路小学校校舍维修工程,公司联营,joint,联营项目,副本项目名称统计表直营41条，联营693条(1).xlsx,2026-05-20
250,松垭商业城保障性住房提升改造项目--装修施工项目,松垭商业城保障性住房提升改造项目--装修施工项目,公司联营,joint,联营项目,副本项目名称统计表直营41条，联营693条(1).xlsx,2026-05-20
251,中国航发公司郝小成零星工程,中国航发公司郝小成零星工程,公司联营,joint,联营项目,副本项目名称统计表直营41条，联营693条(1).xlsx,2026-05-20
252,四川保盛贵州茅台酒采购平台,四川保盛贵州茅台酒采购平台,公司联营,joint,联营项目,副本项目名称统计表直营41条，联营693条(1).xlsx,2026-05-20
253,城口县明通镇中心小学改扩建及幼儿园建设项目,城口县明通镇中心小学改扩建及幼儿园建设项目,公司联营,joint,联营项目,副本项目名称统计表直营41条，联营693条(1).xlsx,2026-05-20
254,建筑工程实训基地室外改造提升,建筑工程实训基地室外改造提升,公司联营,joint,联营项目,副本项目名称统计表直营41条，联营693条(1).xlsx,2026-05-20
255,西南大数据创新应用中心项目-深潜土石方工程,西南大数据创新应用中心项目-深潜土石方工程,公司联营,joint,联营项目,副本项目名称统计表直营41条，联营693条(1).xlsx,2026-05-20
256,龙江大酒店装修改造项目,龙江大酒店装修改造项目,公司联营,joint,联营项目,副本项目名称统计表直营41条，联营693条(1).xlsx,2026-05-20
257,莎车县低压电力设施改造项目施工第二标段,莎车县低压电力设施改造项目施工第二标段,公司联营,joint,联营项目,副本项目名称统计表直营41条，联营693条(1).xlsx,2026-05-20
258,莎车县低压电力设施改造项目施工第一标段,莎车县低压电力设施改造项目施工第一标段,公司联营,joint,联营项目,副本项目名称统计表直营41条，联营693条(1).xlsx,2026-05-20
259,绵竹何高春项目,绵竹何高春项目,公司联营,joint,联营项目,副本项目名称统计表直营41条，联营693条(1).xlsx,2026-05-20
260,重庆轨道交通15号线一期土建工程果塘路站二期给水管线迁改工程,重庆轨道交通15号线一期土建工程果塘路站二期给水管线迁改工程,公司联营,joint,联营项目,副本项目名称统计表直营41条，联营693条(1).xlsx,2026-05-20
261,阿克陶县人民医院医技楼配电安装工程项目,阿克陶县人民医院医技楼配电安装工程项目,公司联营,joint,联营项目,副本项目名称统计表直营41条，联营693条(1).xlsx,2026-05-20
262,建筑工程实训管改造提升采购项目,建筑工程实训管改造提升采购项目,公司联营,joint,联营项目,副本项目名称统计表直营41条，联营693条(1).xlsx,2026-05-20
263,长虹金嶺1号项目二期高层外墙装饰工程（二标段）,长虹金嶺1号项目二期高层外墙装饰工程(二标段),公司联营,joint,联营项目,副本项目名称统计表直营41条，联营693条(1).xlsx,2026-05-20
264,四川省区域应急救援雅安基地项目综合业务大楼外墙铝格栅专业分包工程,四川省区域应急救援雅安基地项目综合业务大楼外墙铝格栅专业分包工程,公司联营,joint,联营项目,副本项目名称统计表直营41条，联营693条(1).xlsx,2026-05-20
265,三标段旌湖路（秦岭山路至峨眉山南路）10kv下地改造工程,三标段旌湖路(秦岭山路至峨眉山南路)10kv下地改造工程,公司联营,joint,联营项目,副本项目名称统计表直营41条，联营693条(1).xlsx,2026-05-20
266,石柱县沿溪镇滨江社区居住环境改善工程,石柱县沿溪镇滨江社区居住环境改善工程,公司联营,joint,联营项目,副本项目名称统计表直营41条，联营693条(1).xlsx,2026-05-20
267,渝数科技公司重庆数字大厦第6层办公用房装修改造项目,渝数科技公司重庆数字大厦第6层办公用房装修改造项目,公司联营,joint,联营项目,副本项目名称统计表直营41条，联营693条(1).xlsx,2026-05-20
268,江陵路快速化改造一期工程PB0+560-PB1+180庞北恢复及拆除残桥工程,江陵路快速化改造一期工程PB0+560-PB1+180庞北恢复及拆除残桥工程,公司联营,joint,联营项目,副本项目名称统计表直营41条，联营693条(1).xlsx,2026-05-20
269,梧桐·骊府土方专业分包项目,梧桐·骊府土方专业分包项目,公司联营,joint,联营项目,副本项目名称统计表直营41条，联营693条(1).xlsx,2026-05-20
270,杨永田项目,杨永田项目,公司联营,joint,联营项目,副本项目名称统计表直营41条，联营693条(1).xlsx,2026-05-20
271,引入社会资金共同打造游泳高水平运动员后备人才培养项目,引入社会资金共同打造游泳高水平运动员后备人才培养项目,公司联营,joint,联营项目,副本项目名称统计表直营41条，联营693条(1).xlsx,2026-05-20
272,三星堆旅游环线工业游基地基础设施改造项目（一期）设计施工总承包项目,三星堆旅游环线工业游基地基础设施改造项目(一期)设计施工总承包项目,公司联营,joint,联营项目,副本项目名称统计表直营41条，联营693条(1).xlsx,2026-05-20
273,德阳市什邡市社会福利救助中心护理能力提档升级项目,德阳市什邡市社会福利救助中心护理能力提档升级项目,公司联营,joint,联营项目,副本项目名称统计表直营41条，联营693条(1).xlsx,2026-05-20
274,开挖修复359机位消防主管道爆管项目,开挖修复359机位消防主管道爆管项目,公司联营,joint,联营项目,副本项目名称统计表直营41条，联营693条(1).xlsx,2026-05-20
275,重庆轨道交通15号线一期工程01标合同段供水管道迁改工程,重庆轨道交通15号线一期工程01标合同段供水管道迁改工程,公司联营,joint,联营项目,副本项目名称统计表直营41条，联营693条(1).xlsx,2026-05-20
276,百合公园维修工程,百合公园维修工程,公司联营,joint,联营项目,副本项目名称统计表直营41条，联营693条(1).xlsx,2026-05-20
277,四川建筑职业技术学院德阳校区综合办公楼西侧会议室等维修改造项目,四川建筑职业技术学院德阳校区综合办公楼西侧会议室等维修改造项目,公司联营,joint,联营项目,副本项目名称统计表直营41条，联营693条(1).xlsx,2026-05-20
278,德阳智茂润亚电子科技有限公司3C配件及终端制造项目厂房装修工程,德阳智茂润亚电子科技有限公司3C配件及终端制造项目厂房装修工程,公司联营,joint,联营项目,副本项目名称统计表直营41条，联营693条(1).xlsx,2026-05-20
279,二重厂西路（华山路-衡山路）市政道路工程、衡山路（二重厂西路-韩江路）市政道路工程、琴江路、武江路（华山路-规划路）市政道路工程 沥青路面、水稳基层专业分包,二重厂西路(华山路-衡山路)市政道路工程、衡山路(二重厂西路-韩江路)市政道路工程、琴江路、武江路(华山路-规划路)市政道路工程沥青路面、水稳基层专业分包,公司联营,joint,联营项目,副本项目名称统计表直营41条，联营693条(1).xlsx,2026-05-20
