source_sequence,project_name,normalized_project_name,source_operation_mode,operation_strategy,operation_strategy_label,source_file,source_received_date
1,天山路（黄河路-凯江路）改造项目,天山路(黄河路-凯江路)改造项目,公司直营,direct,公司直营,副本项目名称统计表直营41条，联营693条(1).xlsx,2026-05-20
2,崴和路滑坡整治工程,崴和路滑坡整治工程,公司直营,direct,公司直营,副本项目名称统计表直营41条，联营693条(1).xlsx,2026-05-20
3,高地搅拌站,高地搅拌站,公司直营,direct,公司直营,副本项目名称统计表直营41条，联营693条(1).xlsx,2026-05-20
4,德阳凹街办公室,德阳凹街办公室,公司直营,direct,公司直营,副本项目名称统计表直营41条，联营693条(1).xlsx,2026-05-20
5,齐家堰流域（高槐村-桂花村）河段水生态修复项目,齐家堰流域(高槐村-桂花村)河段水生态修复项目,公司直营,direct,公司直营,副本项目名称统计表直营41条，联营693条(1).xlsx,2026-05-20
6,三星堆环线基础设施改造,三星堆环线基础设施改造,公司直营,direct,公司直营,副本项目名称统计表直营41条，联营693条(1).xlsx,2026-05-20
7,城市花园等老旧小区改造,城市花园等老旧小区改造,公司直营,direct,公司直营,副本项目名称统计表直营41条，联营693条(1).xlsx,2026-05-20
8,中江驾考校,中江驾考校,公司直营,direct,公司直营,副本项目名称统计表直营41条，联营693条(1).xlsx,2026-05-20
9,太行山路（钱塘江路-信江路）道路工程,太行山路(钱塘江路-信江路)道路工程,公司直营,direct,公司直营,副本项目名称统计表直营41条，联营693条(1).xlsx,2026-05-20
10,一公司项目,一公司项目,公司直营,direct,公司直营,副本项目名称统计表直营41条，联营693条(1).xlsx,2026-05-20
11,蓥华山路道路工程-包3,蓥华山路道路工程-包3,公司直营,direct,公司直营,副本项目名称统计表直营41条，联营693条(1).xlsx,2026-05-20
12,澜沧江西路（苗山街-蓥华山路）,澜沧江西路(苗山街-蓥华山路),公司直营,direct,公司直营,副本项目名称统计表直营41条，联营693条(1).xlsx,2026-05-20
13,旌北新区（龙泉山路）雨水管网项目,旌北新区(龙泉山路)雨水管网项目,公司直营,direct,公司直营,副本项目名称统计表直营41条，联营693条(1).xlsx,2026-05-20
14,崴和路二标段,崴和路二标段,公司直营,direct,公司直营,副本项目名称统计表直营41条，联营693条(1).xlsx,2026-05-20
15,面粉厂等小区改造项目,面粉厂等小区改造项目,公司直营,direct,公司直营,副本项目名称统计表直营41条，联营693条(1).xlsx,2026-05-20
16,二重厂西路等4条道路工程,二重厂西路等4条道路工程,公司直营,direct,公司直营,副本项目名称统计表直营41条，联营693条(1).xlsx,2026-05-20
17,2024高标准农田建设项目-龙泉村,2024高标准农田建设项目-龙泉村,公司直营,direct,公司直营,副本项目名称统计表直营41条，联营693条(1).xlsx,2026-05-20
18,高新产业园配套项目（包2）,高新产业园配套项目(包2),公司直营,direct,公司直营,副本项目名称统计表直营41条，联营693条(1).xlsx,2026-05-20
19,蓥华山路道路工程-包2,蓥华山路道路工程-包2,公司直营,direct,公司直营,副本项目名称统计表直营41条，联营693条(1).xlsx,2026-05-20
20,旌阳区2025年老旧小区改造-包1,旌阳区2025年老旧小区改造-包1,公司直营,direct,公司直营,副本项目名称统计表直营41条，联营693条(1).xlsx,2026-05-20
21,马鞍村库房,马鞍村库房,公司直营,direct,公司直营,副本项目名称统计表直营41条，联营693条(1).xlsx,2026-05-20
22,崴和路一标段,崴和路一标段,公司直营,direct,公司直营,副本项目名称统计表直营41条，联营693条(1).xlsx,2026-05-20
23,凯江大回湾景区融合提升项目,凯江大回湾景区融合提升项目,公司直营,direct,公司直营,副本项目名称统计表直营41条，联营693条(1).xlsx,2026-05-20
24,万润苑改造,万润苑改造,公司直营,direct,公司直营,副本项目名称统计表直营41条，联营693条(1).xlsx,2026-05-20
25,旌阳区2025年老旧小区改造-包5,旌阳区2025年老旧小区改造-包5,公司直营,direct,公司直营,副本项目名称统计表直营41条，联营693条(1).xlsx,2026-05-20
26,柏隆粮油园区项目,柏隆粮油园区项目,公司直营,direct,公司直营,副本项目名称统计表直营41条，联营693条(1).xlsx,2026-05-20
27,东一环北延线,东一环北延线,公司直营,direct,公司直营,副本项目名称统计表直营41条，联营693条(1).xlsx,2026-05-20
28,崴和路道路工程（综合）,崴和路道路工程(综合),公司直营,direct,公司直营,副本项目名称统计表直营41条，联营693条(1).xlsx,2026-05-20
29,嘉陵江路库房,嘉陵江路库房,公司直营,direct,公司直营,副本项目名称统计表直营41条，联营693条(1).xlsx,2026-05-20
30,高新产业园配套项目（包3）,高新产业园配套项目(包3),公司直营,direct,公司直营,副本项目名称统计表直营41条，联营693条(1).xlsx,2026-05-20
31,寿崴路,寿崴路,公司直营,direct,公司直营,副本项目名称统计表直营41条，联营693条(1).xlsx,2026-05-20
32,德阳市烈士陵园建设项目,德阳市烈士陵园建设项目,公司直营,direct,公司直营,副本项目名称统计表直营41条，联营693条(1).xlsx,2026-05-20
33,烈士陵园装修项目,烈士陵园装修项目,公司直营,direct,公司直营,副本项目名称统计表直营41条，联营693条(1).xlsx,2026-05-20
34,王谊村总平,王谊村总平,公司直营,direct,公司直营,副本项目名称统计表直营41条，联营693条(1).xlsx,2026-05-20
35,孝感翠竹街西路改造,孝感翠竹街西路改造,公司直营,direct,公司直营,副本项目名称统计表直营41条，联营693条(1).xlsx,2026-05-20
36,旌阳区供水项目——柏隆净水厂,旌阳区供水项目--柏隆净水厂,公司直营,direct,公司直营,副本项目名称统计表直营41条，联营693条(1).xlsx,2026-05-20
37,玉山街道路工程,玉山街道路工程,公司直营,direct,公司直营,副本项目名称统计表直营41条，联营693条(1).xlsx,2026-05-20
38,宋家堰景观工程,宋家堰景观工程,公司直营,direct,公司直营,副本项目名称统计表直营41条，联营693条(1).xlsx,2026-05-20
39,2023年高标准农田改造提升-东美村,2023年高标准农田改造提升-东美村,公司直营,direct,公司直营,副本项目名称统计表直营41条，联营693条(1).xlsx,2026-05-20
40,龙泉山路二段(赣江路-信江路),龙泉山路二段(赣江路-信江路),公司直营,direct,公司直营,副本项目名称统计表直营41条，联营693条(1).xlsx,2026-05-20
41,旌阳区供水项目——柏隆供水管网,旌阳区供水项目--柏隆供水管网,公司直营,direct,公司直营,副本项目名称统计表直营41条，联营693条(1).xlsx,2026-05-20
1,绵竹光函数光电智能检测设备研发制造基地项目(消防工程),绵竹光函数光电智能检测设备研发制造基地项目(消防工程),公司联营,joint,联营项目,副本项目名称统计表直营41条，联营693条(1).xlsx,2026-05-20
2,园林基础设施零星维修,园林基础设施零星维修,公司联营,joint,联营项目,副本项目名称统计表直营41条，联营693条(1).xlsx,2026-05-20
3,2026年春季乔木补植项目劳务分包合同,2026年春季乔木补植项目劳务分包合同,公司联营,joint,联营项目,副本项目名称统计表直营41条，联营693条(1).xlsx,2026-05-20
4,旌兴·和悦雲岸1#-11#楼项目采购室外园林景观工程,旌兴·和悦雲岸1#-11#楼项目采购室外园林景观工程,公司联营,joint,联营项目,副本项目名称统计表直营41条，联营693条(1).xlsx,2026-05-20
5,中国移动通信集团四川有限公司甘孜分公司2026年渠道维修采购项目,中国移动通信集团四川有限公司甘孜分公司2026年渠道维修采购项目,公司联营,joint,联营项目,副本项目名称统计表直营41条，联营693条(1).xlsx,2026-05-20
6,远达环保工程公司合川2×1000MW脱硫系统建筑施工分包采购,远达环保工程公司合川2×1000MW脱硫系统建筑施工分包采购,公司联营,joint,联营项目,副本项目名称统计表直营41条，联营693条(1).xlsx,2026-05-20
7,2026年度西南油气分公司钻前主体工程劳务分包项目（1-9标段）,2026年度西南油气分公司钻前主体工程劳务分包项目(1-9标段),公司联营,joint,联营项目,副本项目名称统计表直营41条，联营693条(1).xlsx,2026-05-20
8,绵竹新材料化工园区污水处理厂改扩建工程一期(930外)--地基处理专业分包,绵竹新材料化工园区污水处理厂改扩建工程一期(930外)--地基处理专业分包,公司联营,joint,联营项目,副本项目名称统计表直营41条，联营693条(1).xlsx,2026-05-20
9,2024年大邑县S216水晶(平武)-邛崃  K433+900-K434+300段道路水毁抢险救灾工程,2024年大邑县S216水晶(平武)-邛崃K433+900-K434+300段道路水毁抢险救灾工程,公司联营,joint,联营项目,副本项目名称统计表直营41条，联营693条(1).xlsx,2026-05-20
10,四川致远锂业有限公司氯化锂车间地基加固工程,四川致远锂业有限公司氯化锂车间地基加固工程,公司联营,joint,联营项目,副本项目名称统计表直营41条，联营693条(1).xlsx,2026-05-20
11,深圳市捷顺科技实业股份有限公司年度外包合同,深圳市捷顺科技实业股份有限公司年度外包合同,公司联营,joint,联营项目,副本项目名称统计表直营41条，联营693条(1).xlsx,2026-05-20
12,重庆市沙坪坝区土主街道桐子林黄金湾C1栋 二层,重庆市沙坪坝区土主街道桐子林黄金湾C1栋二层,公司联营,joint,联营项目,副本项目名称统计表直营41条，联营693条(1).xlsx,2026-05-20
13,旌阳区德新镇国家农业产业强镇建设二期稻谷产地初加工提升项目,旌阳区德新镇国家农业产业强镇建设二期稻谷产地初加工提升项目,公司联营,joint,联营项目,副本项目名称统计表直营41条，联营693条(1).xlsx,2026-05-20
14,重庆丰都龙城华府（三期）二组团10#、11#住宅屋顶分布式光伏项目,重庆丰都龙城华府(三期)二组团10#、11#住宅屋顶分布式光伏项目,公司联营,joint,联营项目,副本项目名称统计表直营41条，联营693条(1).xlsx,2026-05-20
15,深圳友唱技术有限公司万达零星维修工程,深圳友唱技术有限公司万达零星维修工程,公司联营,joint,联营项目,副本项目名称统计表直营41条，联营693条(1).xlsx,2026-05-20
16,中建四局-杜秀佳项目,中建四局-杜秀佳项目,公司联营,joint,联营项目,副本项目名称统计表直营41条，联营693条(1).xlsx,2026-05-20
17,渭河路邻里中心2-2-1、2-2-2铺位装修,渭河路邻里中心2-2-1、2-2-2铺位装修,公司联营,joint,联营项目,副本项目名称统计表直营41条，联营693条(1).xlsx,2026-05-20
18,细磨车间、碳酸锂车间防水补漏项目工程,细磨车间、碳酸锂车间防水补漏项目工程,公司联营,joint,联营项目,副本项目名称统计表直营41条，联营693条(1).xlsx,2026-05-20
19,信息中心图书馆安全整治及服务能力提升项目,信息中心图书馆安全整治及服务能力提升项目,公司联营,joint,联营项目,副本项目名称统计表直营41条，联营693条(1).xlsx,2026-05-20
20,四川司法产教融合实训基地二期项目（运动场及附属设施）土石方工程,四川司法产教融合实训基地二期项目(运动场及附属设施)土石方工程,公司联营,joint,联营项目,副本项目名称统计表直营41条，联营693条(1).xlsx,2026-05-20
21,渭河路市场夜市市集项目,渭河路市场夜市市集项目,公司联营,joint,联营项目,副本项目名称统计表直营41条，联营693条(1).xlsx,2026-05-20
22,上海二十冶西南公司四川省广汉市职业中专学校迁建项目土石方专业分包工程,上海二十冶西南公司四川省广汉市职业中专学校迁建项目土石方专业分包工程,公司联营,joint,联营项目,副本项目名称统计表直营41条，联营693条(1).xlsx,2026-05-20
23,峨边彝族自治县人工智能实践基地建设项目,峨边彝族自治县人工智能实践基地建设项目,公司联营,joint,联营项目,副本项目名称统计表直营41条，联营693条(1).xlsx,2026-05-20
24,岳普湖县防沙治沙电力配套设施建设项目,岳普湖县防沙治沙电力配套设施建设项目,公司联营,joint,联营项目,副本项目名称统计表直营41条，联营693条(1).xlsx,2026-05-20
25,林芝区域办事处办公用房装修工程施工专业分包,林芝区域办事处办公用房装修工程施工专业分包,公司联营,joint,联营项目,副本项目名称统计表直营41条，联营693条(1).xlsx,2026-05-20
26,德阳站综合交通枢纽改造项目桥梁地下室主体结构工程,德阳站综合交通枢纽改造项目桥梁地下室主体结构工程,公司联营,joint,联营项目,副本项目名称统计表直营41条，联营693条(1).xlsx,2026-05-20
27,广汉市城市更新城西片区城中村改造项目地基基础工程专业分包,广汉市城市更新城西片区城中村改造项目地基基础工程专业分包,公司联营,joint,联营项目,副本项目名称统计表直营41条，联营693条(1).xlsx,2026-05-20
28,广汉市城市更新天府旌城南片区城中村改造项目地基基础工程专业分包,广汉市城市更新天府旌城南片区城中村改造项目地基基础工程专业分包,公司联营,joint,联营项目,副本项目名称统计表直营41条，联营693条(1).xlsx,2026-05-20
29,阿合奇县劳保局棚户区（城市危旧房屋）改造项目（一标段）防水专业分包工程,阿合奇县劳保局棚户区(城市危旧房屋)改造项目(一标段)防水专业分包工程,公司联营,joint,联营项目,副本项目名称统计表直营41条，联营693条(1).xlsx,2026-05-20
30,合阳城街道2024年老旧小区改造工程(二期),合阳城街道2024年老旧小区改造工程(二期),公司联营,joint,联营项目,副本项目名称统计表直营41条，联营693条(1).xlsx,2026-05-20
31,绵竹市农业科技碳循环双创产业融合示范园项目(二期)一标段-大棚B区劳务、机械采购项目(第二次),绵竹市农业科技碳循环双创产业融合示范园项目(二期)一标段-大棚B区劳务、机械采购项目(第二次),公司联营,joint,联营项目,副本项目名称统计表直营41条，联营693条(1).xlsx,2026-05-20
32,广汉市城市更新城西片区城中村改造项目--配套道路路面工程专业分包,广汉市城市更新城西片区城中村改造项目--配套道路路面工程专业分包,公司联营,joint,联营项目,副本项目名称统计表直营41条，联营693条(1).xlsx,2026-05-20
33,阿坝-成都东线路工程14标,阿坝-成都东线路工程14标,公司联营,joint,联营项目,副本项目名称统计表直营41条，联营693条(1).xlsx,2026-05-20
34,中建四局-刘兴宇项目,中建四局-刘兴宇项目,公司联营,joint,联营项目,副本项目名称统计表直营41条，联营693条(1).xlsx,2026-05-20
35,垫江县城区污水处理厂提标改造项目（中水管网建设工程A段）--玉鼎桥至明月大道段（第二次）,垫江县城区污水处理厂提标改造项目(中水管网建设工程A段)--玉鼎桥至明月大道段(第二次),公司联营,joint,联营项目,副本项目名称统计表直营41条，联营693条(1).xlsx,2026-05-20
36,旌兴·和悦雲岸1#-11#楼项目公区精装修工程专业分包,旌兴·和悦雲岸1#-11#楼项目公区精装修工程专业分包,公司联营,joint,联营项目,副本项目名称统计表直营41条，联营693条(1).xlsx,2026-05-20
37,雅安市雨城区生活垃圾资源化利用项目劳务班组采购项目包件2钢结构,雅安市雨城区生活垃圾资源化利用项目劳务班组采购项目包件2钢结构,公司联营,joint,联营项目,副本项目名称统计表直营41条，联营693条(1).xlsx,2026-05-20
38,PET-CT安装工程,PET-CT安装工程,公司联营,joint,联营项目,副本项目名称统计表直营41条，联营693条(1).xlsx,2026-05-20
39,医院商业服务配套安装工程,医院商业服务配套安装工程,公司联营,joint,联营项目,副本项目名称统计表直营41条，联营693条(1).xlsx,2026-05-20
40,德阳市旌阳区供水建设项目（柏隆净水厂）,德阳市旌阳区供水建设项目(柏隆净水厂),公司联营,joint,联营项目,副本项目名称统计表直营41条，联营693条(1).xlsx,2026-05-20
41,陈小刚零星劳务工程,陈小刚零星劳务工程,公司联营,joint,联营项目,副本项目名称统计表直营41条，联营693条(1).xlsx,2026-05-20
42,绵竹市城乡供水一体化项目(高柏、红旗)劳务、机械协作单位.,绵竹市城乡供水一体化项目(高柏、红旗)劳务、机械协作单位,公司联营,joint,联营项目,副本项目名称统计表直营41条，联营693条(1).xlsx,2026-05-20
43,重庆2025年度零星维修服务项目,重庆2025年度零星维修服务项目,公司联营,joint,联营项目,副本项目名称统计表直营41条，联营693条(1).xlsx,2026-05-20
44,绵阳市安州区高级职业中学空调电力改造安装工程,绵阳市安州区高级职业中学空调电力改造安装工程,公司联营,joint,联营项目,副本项目名称统计表直营41条，联营693条(1).xlsx,2026-05-20
45,工程部油料化工组后油库油罐防腐层检修合同,工程部油料化工组后油库油罐防腐层检修合同,公司联营,joint,联营项目,副本项目名称统计表直营41条，联营693条(1).xlsx,2026-05-20
46,东湖街道老旧街区改造城市更新项目（一期）-秦岭山路（黄河路-玉泉路）提升改造工程,东湖街道老旧街区改造城市更新项目(一期)-秦岭山路(黄河路-玉泉路)提升改造工程,公司联营,joint,联营项目,副本项目名称统计表直营41条，联营693条(1).xlsx,2026-05-20
47,A项目-建筑幕墙专业分包,A项目-建筑幕墙专业分包,公司联营,joint,联营项目,副本项目名称统计表直营41条，联营693条(1).xlsx,2026-05-20
48,沸水小学空调电力改造安装工程,沸水小学空调电力改造安装工程,公司联营,joint,联营项目,副本项目名称统计表直营41条，联营693条(1).xlsx,2026-05-20
49,绵阳市安州区公办学校空调电力改造安装工程(桑枣小学),绵阳市安州区公办学校空调电力改造安装工程(桑枣小学),公司联营,joint,联营项目,副本项目名称统计表直营41条，联营693条(1).xlsx,2026-05-20
50,某部队年度零星工程建设项目,某部队年度零星工程建设项目,公司联营,joint,联营项目,副本项目名称统计表直营41条，联营693条(1).xlsx,2026-05-20
51,喀什某单位锅炉房锅炉扩容改造项目,喀什某单位锅炉房锅炉扩容改造项目,公司联营,joint,联营项目,副本项目名称统计表直营41条，联营693条(1).xlsx,2026-05-20
52,修剪田坝村、中南村、西铁村社区老旧小区存量违法建筑周边树木,修剪田坝村、中南村、西铁村社区老旧小区存量违法建筑周边树木,公司联营,joint,联营项目,副本项目名称统计表直营41条，联营693条(1).xlsx,2026-05-20
53,安州高新区数字经济产业园基础设施补短板项目--地块二专业分包招标,安州高新区数字经济产业园基础设施补短板项目--地块二专业分包招标,公司联营,joint,联营项目,副本项目名称统计表直营41条，联营693条(1).xlsx,2026-05-20
54,C4-3-1、C4-3-2等3宗地块整治工程水泥稳定碎石层铺筑,C4-3-1、C4-3-2等3宗地块整治工程水泥稳定碎石层铺筑,公司联营,joint,联营项目,副本项目名称统计表直营41条，联营693条(1).xlsx,2026-05-20
55,德阳市旌合建设工程有限公司3#、4#、5#、6#楼幕墙工程专业分包,德阳市旌合建设工程有限公司3#、4#、5#、6#楼幕墙工程专业分包,公司联营,joint,联营项目,副本项目名称统计表直营41条，联营693条(1).xlsx,2026-05-20
56,中核城建德阿项目(EPC)工程27#地块钢结构厂房屋面光伏安装施工专业分包,中核城建德阿项目(EPC)工程27#地块钢结构厂房屋面光伏安装施工专业分包,公司联营,joint,联营项目,副本项目名称统计表直营41条，联营693条(1).xlsx,2026-05-20
57,德阳市罗江区公路建设养护所2025农村公路维修,德阳市罗江区公路建设养护所2025农村公路维修,公司联营,joint,联营项目,副本项目名称统计表直营41条，联营693条(1).xlsx,2026-05-20
58,绵阳市安州区2025年制种大县项目-生产基地设施建设工程,绵阳市安州区2025年制种大县项目-生产基地设施建设工程,公司联营,joint,联营项目,副本项目名称统计表直营41条，联营693条(1).xlsx,2026-05-20
59,驻渝某单位废油罐拆装工程（第三次）,驻渝某单位废油罐拆装工程(第三次),公司联营,joint,联营项目,副本项目名称统计表直营41条，联营693条(1).xlsx,2026-05-20
60,长虹技佳重庆分公司彩钢棚搭建项目,长虹技佳重庆分公司彩钢棚搭建项目,公司联营,joint,联营项目,副本项目名称统计表直营41条，联营693条(1).xlsx,2026-05-20
61,潼南支行双江分理处营业网点主体装修工程项目,潼南支行双江分理处营业网点主体装修工程项目,公司联营,joint,联营项目,副本项目名称统计表直营41条，联营693条(1).xlsx,2026-05-20
62,渝北区石船镇龙胆路石船段公交站新建工程,渝北区石船镇龙胆路石船段公交站新建工程,公司联营,joint,联营项目,副本项目名称统计表直营41条，联营693条(1).xlsx,2026-05-20
63,国网新疆电力有限公司阿勒泰供电公司省管产业单位2024年第一次服务类区域联合授权框架招标采购,国网新疆电力有限公司阿勒泰供电公司省管产业单位2024年第一次服务类区域联合授权框架招标采购,公司联营,joint,联营项目,副本项目名称统计表直营41条，联营693条(1).xlsx,2026-05-20
64,区级机关综合办公大楼车库地坪整治项目,区级机关综合办公大楼车库地坪整治项目,公司联营,joint,联营项目,副本项目名称统计表直营41条，联营693条(1).xlsx,2026-05-20
65,塔什库尔干县塔什库尔干乡托格伦夏村村容村貌整治提升项目,塔什库尔干县塔什库尔干乡托格伦夏村村容村貌整治提升项目,公司联营,joint,联营项目,副本项目名称统计表直营41条，联营693条(1).xlsx,2026-05-20
66,中国移动四川公司市州分公司2025年—2028年管理用房及生产枢纽楼公共区域零星维修项目的标包7 泸州,中国移动四川公司市州分公司2025年-2028年管理用房及生产枢纽楼公共区域零星维修项目的标包7泸州,公司联营,joint,联营项目,副本项目名称统计表直营41条，联营693条(1).xlsx,2026-05-20
67,中国移动四川公司市州分公司2025年—2028年管理用房及生产枢纽楼公共区域零星维修项目的标包22 天府,中国移动四川公司市州分公司2025年-2028年管理用房及生产枢纽楼公共区域零星维修项目的标包22天府,公司联营,joint,联营项目,副本项目名称统计表直营41条，联营693条(1).xlsx,2026-05-20
68,中国移动四川公司市州分公司2025年—2028年管理用房及生产枢纽楼公共区域零星维修项目的标包13 南充,中国移动四川公司市州分公司2025年-2028年管理用房及生产枢纽楼公共区域零星维修项目的标包13南充,公司联营,joint,联营项目,副本项目名称统计表直营41条，联营693条(1).xlsx,2026-05-20
69,德阳市罗江区乡村水务供水建设项目钢筋、模板、混凝土、管道及阀门安装劳务分包二标段,德阳市罗江区乡村水务供水建设项目钢筋、模板、混凝土、管道及阀门安装劳务分包二标段,公司联营,joint,联营项目,副本项目名称统计表直营41条，联营693条(1).xlsx,2026-05-20
70,中国移动四川公司市州分公司2025年—2028年管理用房及生产枢纽楼公共区域零星维修项目的标包1 成都,中国移动四川公司市州分公司2025年-2028年管理用房及生产枢纽楼公共区域零星维修项目的标包1成都,公司联营,joint,联营项目,副本项目名称统计表直营41条，联营693条(1).xlsx,2026-05-20
71,中国移动四川公司2025-2027年全省汇聚机房土建工程施工集中采购项目（标包4-乐山分公司）框架协议,中国移动四川公司2025-2027年全省汇聚机房土建工程施工集中采购项目(标包4-乐山分公司)框架协议,公司联营,joint,联营项目,副本项目名称统计表直营41条，联营693条(1).xlsx,2026-05-20
72,石船镇农村公路（关兴村）井环路堡坎修复工程,石船镇农村公路(关兴村)井环路堡坎修复工程,公司联营,joint,联营项目,副本项目名称统计表直营41条，联营693条(1).xlsx,2026-05-20
73,某部家属楼暖气更换项目,某部家属楼暖气更换项目,公司联营,joint,联营项目,副本项目名称统计表直营41条，联营693条(1).xlsx,2026-05-20
74,四川致远锂业有限公司生产厂房土建零星及维修工程,四川致远锂业有限公司生产厂房土建零星及维修工程,公司联营,joint,联营项目,副本项目名称统计表直营41条，联营693条(1).xlsx,2026-05-20
