source_sequence,project_name,normalized_project_name,source_operation_mode,operation_strategy,operation_strategy_label,source_file,source_received_date
280,安宁新能源磷铁项目,安宁新能源磷铁项目,公司联营,joint,联营项目,副本项目名称统计表直营41条，联营693条(1).xlsx,2026-05-20
281,塔什库尔干县达布达尔乡农业灌溉管道建设项目,塔什库尔干县达布达尔乡农业灌溉管道建设项目,公司联营,joint,联营项目,副本项目名称统计表直营41条，联营693条(1).xlsx,2026-05-20
282,绵阳高新区普明街道古泉社区居民委员会普明街道古泉社区农业灌溉水利设施整治提升项目,绵阳高新区普明街道古泉社区居民委员会普明街道古泉社区农业灌溉水利设施整治提升项目,公司联营,joint,联营项目,副本项目名称统计表直营41条，联营693条(1).xlsx,2026-05-20
283,中建四局集团-唐颖刚项目,中建四局集团-唐颖刚项目,公司联营,joint,联营项目,副本项目名称统计表直营41条，联营693条(1).xlsx,2026-05-20
284,米易东站屋顶花园项目,米易东站屋顶花园项目,公司联营,joint,联营项目,副本项目名称统计表直营41条，联营693条(1).xlsx,2026-05-20
285,2023年中江县普兴镇村社道路建设项目,2023年中江县普兴镇村社道路建设项目,公司联营,joint,联营项目,副本项目名称统计表直营41条，联营693条(1).xlsx,2026-05-20
286,马尔康市卓克基水厂挡墙恢复工程,马尔康市卓克基水厂挡墙恢复工程,公司联营,joint,联营项目,副本项目名称统计表直营41条，联营693条(1).xlsx,2026-05-20
287,德阳凯州新城检验检测创新产业园建设项目-实验室装修项目,德阳凯州新城检验检测创新产业园建设项目-实验室装修项目,公司联营,joint,联营项目,副本项目名称统计表直营41条，联营693条(1).xlsx,2026-05-20
288,旌阳区综合管廊项目庐山路段支护及防水3标,旌阳区综合管廊项目庐山路段支护及防水3标,公司联营,joint,联营项目,副本项目名称统计表直营41条，联营693条(1).xlsx,2026-05-20
289,生态岛智能智造成果转化空间工程钢结构专业分包,生态岛智能智造成果转化空间工程钢结构专业分包,公司联营,joint,联营项目,副本项目名称统计表直营41条，联营693条(1).xlsx,2026-05-20
290,青龙工业园区污水管网改造项目（第二期） 劳务分包,青龙工业园区污水管网改造项目(第二期)劳务分包,公司联营,joint,联营项目,副本项目名称统计表直营41条，联营693条(1).xlsx,2026-05-20
291,德阳市寿丰河截污干管工程、中江县城 镇污水处理设施及配套管网项目等四个项目厂站及管网维修、服务单位的采购项目,德阳市寿丰河截污干管工程、中江县城镇污水处理设施及配套管网项目等四个项目厂站及管网维修、服务单位的采购项目,公司联营,joint,联营项目,副本项目名称统计表直营41条，联营693条(1).xlsx,2026-05-20
292,德阳市旌阳区中医院门诊综合大楼项目及住院综合大楼项目,德阳市旌阳区中医院门诊综合大楼项目及住院综合大楼项目,公司联营,joint,联营项目,副本项目名称统计表直营41条，联营693条(1).xlsx,2026-05-20
293,美林康城售楼部绿化改造,美林康城售楼部绿化改造,公司联营,joint,联营项目,副本项目名称统计表直营41条，联营693条(1).xlsx,2026-05-20
294,青衣江小学东侧绿化带整治,青衣江小学东侧绿化带整治,公司联营,joint,联营项目,副本项目名称统计表直营41条，联营693条(1).xlsx,2026-05-20
295,凯州新城城乡一体化项目配套建设工程钢结构工程专业分包（第二次）,凯州新城城乡一体化项目配套建设工程钢结构工程专业分包(第二次),公司联营,joint,联营项目,副本项目名称统计表直营41条，联营693条(1).xlsx,2026-05-20
296,德阳市罗江区万安南塔社区多功能运动场建设项目,德阳市罗江区万安南塔社区多功能运动场建设项目,公司联营,joint,联营项目,副本项目名称统计表直营41条，联营693条(1).xlsx,2026-05-20
297,马踏洞安置房停车场相关基础设施项目,马踏洞安置房停车场相关基础设施项目,公司联营,joint,联营项目,副本项目名称统计表直营41条，联营693条(1).xlsx,2026-05-20
298,德阳文德湖屿树花园项目总承包工程大区土方开挖分包合同,德阳文德湖屿树花园项目总承包工程大区土方开挖分包合同,公司联营,joint,联营项目,副本项目名称统计表直营41条，联营693条(1).xlsx,2026-05-20
299,绵竹应急周转房项目3#点位,绵竹应急周转房项目3#点位,公司联营,joint,联营项目,副本项目名称统计表直营41条，联营693条(1).xlsx,2026-05-20
300,郫都区安德街道崇德沟黑臭水体整治项目,郫都区安德街道崇德沟黑臭水体整治项目,公司联营,joint,联营项目,副本项目名称统计表直营41条，联营693条(1).xlsx,2026-05-20
301,德阳市委党校整体迁建工程区域工程-给排水专业分包(第二次),德阳市委党校整体迁建工程区域工程-给排水专业分包(第二次),公司联营,joint,联营项目,副本项目名称统计表直营41条，联营693条(1).xlsx,2026-05-20
302,广东南华工商职业学院清远校区二期建设工程 （学生生活区、教学行政区）,广东南华工商职业学院清远校区二期建设工程(学生生活区、教学行政区),公司联营,joint,联营项目,副本项目名称统计表直营41条，联营693条(1).xlsx,2026-05-20
303,50万吨年食品级PET高分子新材料项目,50万吨年食品级PET高分子新材料项目,公司联营,joint,联营项目,副本项目名称统计表直营41条，联营693条(1).xlsx,2026-05-20
304,渭河路（庐山北路至秦岭山北路）道路改造工程道路沥青砼路面专业分包施工,渭河路(庐山北路至秦岭山北路)道路改造工程道路沥青砼路面专业分包施工,公司联营,joint,联营项目,副本项目名称统计表直营41条，联营693条(1).xlsx,2026-05-20
305,渭河路（庐山北路至秦岭山北路）道路改造工程道路水稳层材料供应和施工项目,渭河路(庐山北路至秦岭山北路)道路改造工程道路水稳层材料供应和施工项目,公司联营,joint,联营项目,副本项目名称统计表直营41条，联营693条(1).xlsx,2026-05-20
306,重庆机场航空口岸综合指定监管场地增设防护解除区项目,重庆机场航空口岸综合指定监管场地增设防护解除区项目,公司联营,joint,联营项目,副本项目名称统计表直营41条，联营693条(1).xlsx,2026-05-20
307,巴中恩阳临港产业园建设项目-制造业组团项目 21、22 号厂房防水保温工程,巴中恩阳临港产业园建设项目-制造业组团项目21、22号厂房防水保温工程,公司联营,joint,联营项目,副本项目名称统计表直营41条，联营693条(1).xlsx,2026-05-20
308,明源电力公寓小区路灯维修改造,明源电力公寓小区路灯维修改造,公司联营,joint,联营项目,副本项目名称统计表直营41条，联营693条(1).xlsx,2026-05-20
309,璧山区 2022 年广普镇丘陵山区高标准农田改造提升示范工程试点项目五标段,璧山区2022年广普镇丘陵山区高标准农田改造提升示范工程试点项目五标段,公司联营,joint,联营项目,副本项目名称统计表直营41条，联营693条(1).xlsx,2026-05-20
310,德阳经济技术开发区产城融合示范园区基础设施建设 旌湖路 、 太湖路道路改造工程,德阳经济技术开发区产城融合示范园区基础设施建设旌湖路、太湖路道路改造工程,公司联营,joint,联营项目,副本项目名称统计表直营41条，联营693条(1).xlsx,2026-05-20
311,绵阳市游仙区盐泉镇道碑观索桥危桥改造工程项目,绵阳市游仙区盐泉镇道碑观索桥危桥改造工程项目,公司联营,joint,联营项目,副本项目名称统计表直营41条，联营693条(1).xlsx,2026-05-20
312,经开区应急周转房项目（2#）工程,经开区应急周转房项目(2#)工程,公司联营,joint,联营项目,副本项目名称统计表直营41条，联营693条(1).xlsx,2026-05-20
313,德阳市旌阳区乡镇通组道路工程(双东镇),德阳市旌阳区乡镇通组道路工程(双东镇),公司联营,joint,联营项目,副本项目名称统计表直营41条，联营693条(1).xlsx,2026-05-20
314,西南大数据创新应用中心项目土石方,西南大数据创新应用中心项目土石方,公司联营,joint,联营项目,副本项目名称统计表直营41条，联营693条(1).xlsx,2026-05-20
315,米易县南部新城市政道路及生态湿地公园PPP项目-绿化工程补充协议,米易县南部新城市政道路及生态湿地公园PPP项目-绿化工程补充协议,公司联营,joint,联营项目,副本项目名称统计表直营41条，联营693条(1).xlsx,2026-05-20
316,德阳市罗江区老旧小区改造项目四标段（二期）,德阳市罗江区老旧小区改造项目四标段(二期),公司联营,joint,联营项目,副本项目名称统计表直营41条，联营693条(1).xlsx,2026-05-20
317,白鹤花园棚户区改造项目一期工程,白鹤花园棚户区改造项目一期工程,公司联营,joint,联营项目,副本项目名称统计表直营41条，联营693条(1).xlsx,2026-05-20
318,模锻厂45MN泵站降温改造,模锻厂45MN泵站降温改造,公司联营,joint,联营项目,副本项目名称统计表直营41条，联营693条(1).xlsx,2026-05-20
319,中核中原建设 2022-2023 年度华北、西北区域脚手架专业分包框架协议,中核中原建设2022-2023年度华北、西北区域脚手架专业分包框架协议,公司联营,joint,联营项目,副本项目名称统计表直营41条，联营693条(1).xlsx,2026-05-20
320,旌城印象更换单元门,旌城印象更换单元门,公司联营,joint,联营项目,副本项目名称统计表直营41条，联营693条(1).xlsx,2026-05-20
321,绵阳市游仙区魏城镇竹柳村（原柳塔村二组）通组路建设工程项目,绵阳市游仙区魏城镇竹柳村(原柳塔村二组)通组路建设工程项目,公司联营,joint,联营项目,副本项目名称统计表直营41条，联营693条(1).xlsx,2026-05-20
322,棉县高层安置小区消防系统维修项目（向阳小区）消防专业分包,棉县高层安置小区消防系统维修项目(向阳小区)消防专业分包,公司联营,joint,联营项目,副本项目名称统计表直营41条，联营693条(1).xlsx,2026-05-20
323,德阳高新区万福棚户区改造工程一期一标段“8.11”特大暴雨灾后修复工程,德阳高新区万福棚户区改造工程一期一标段“8.11”特大暴雨灾后修复工程,公司联营,joint,联营项目,副本项目名称统计表直营41条，联营693条(1).xlsx,2026-05-20
324,环壁南路至环湖北路（青白江河）DN800管安装工程,环壁南路至环湖北路(青白江河)DN800管安装工程,公司联营,joint,联营项目,副本项目名称统计表直营41条，联营693条(1).xlsx,2026-05-20
325,什邡市方亭街道老旧小区改造项目六标段,什邡市方亭街道老旧小区改造项目六标段,公司联营,joint,联营项目,副本项目名称统计表直营41条，联营693条(1).xlsx,2026-05-20
326,德阳市人民医院门诊大楼装饰工程,德阳市人民医院门诊大楼装饰工程,公司联营,joint,联营项目,副本项目名称统计表直营41条，联营693条(1).xlsx,2026-05-20
327,中江县御河中学校新建学生宿舍、附属工程及设备购置建设项目,中江县御河中学校新建学生宿舍、附属工程及设备购置建设项目,公司联营,joint,联营项目,副本项目名称统计表直营41条，联营693条(1).xlsx,2026-05-20
328,德阳市烈士陵园建设项目专业分包（总平）,德阳市烈士陵园建设项目专业分包(总平),公司联营,joint,联营项目,副本项目名称统计表直营41条，联营693条(1).xlsx,2026-05-20
329,蓬莱镇城乡一体化建设项目四标段项目模板脚手架专业分包,蓬莱镇城乡一体化建设项目四标段项目模板脚手架专业分包,公司联营,joint,联营项目,副本项目名称统计表直营41条，联营693条(1).xlsx,2026-05-20
330,德阳市旌阳区医养结合中心及精神病院区建设项目新增电缆及给排水管工程,德阳市旌阳区医养结合中心及精神病院区建设项目新增电缆及给排水管工程,公司联营,joint,联营项目,副本项目名称统计表直营41条，联营693条(1).xlsx,2026-05-20
331,四川建筑职业技术学院成都校区迁建工程（二期）室内外消防工程,四川建筑职业技术学院成都校区迁建工程(二期)室内外消防工程,公司联营,joint,联营项目,副本项目名称统计表直营41条，联营693条(1).xlsx,2026-05-20
332,重庆机场集团有限公司李俭锋零星综合项目,重庆机场集团有限公司李俭锋零星综合项目,公司联营,joint,联营项目,副本项目名称统计表直营41条，联营693条(1).xlsx,2026-05-20
333,米易中心城一二期架空层及入户大堂软装采购工程,米易中心城一二期架空层及入户大堂软装采购工程,公司联营,joint,联营项目,副本项目名称统计表直营41条，联营693条(1).xlsx,2026-05-20
334,荣昌区盘龙镇黄桷滩水库库区集体经济产业基础设施配套,荣昌区盘龙镇黄桷滩水库库区集体经济产业基础设施配套,公司联营,joint,联营项目,副本项目名称统计表直营41条，联营693条(1).xlsx,2026-05-20
335,伽师县综合物流园建设项目-新建10KV配电工程,伽师县综合物流园建设项目-新建10KV配电工程,公司联营,joint,联营项目,副本项目名称统计表直营41条，联营693条(1).xlsx,2026-05-20
336,博雅学校小学部1号楼屋面装饰改造功能用房采购项目施工合同,博雅学校小学部1号楼屋面装饰改造功能用房采购项目施工合同,公司联营,joint,联营项目,副本项目名称统计表直营41条，联营693条(1).xlsx,2026-05-20
337,德阳市罗江区一根松应急抢险工程,德阳市罗江区一根松应急抢险工程,公司联营,joint,联营项目,副本项目名称统计表直营41条，联营693条(1).xlsx,2026-05-20
338,【广清城际轨道交通项目（花都段）安置区工程 （狮岭镇军田安置区一期工程）施工总承包】项目 【挡土墙】工程专业分包合同,【广清城际轨道交通项目(花都段)安置区工程(狮岭镇军田安置区一期工程)施工总承包】项目【挡土墙】工程专业分包合同,公司联营,joint,联营项目,副本项目名称统计表直营41条，联营693条(1).xlsx,2026-05-20
339,罗江区城镇污水垃圾治理-城区垃圾中转站改造项目,罗江区城镇污水垃圾治理-城区垃圾中转站改造项目,公司联营,joint,联营项目,副本项目名称统计表直营41条，联营693条(1).xlsx,2026-05-20
340,巴中临港产业园项目13#-16#楼标准厂房室内消防（BZS2022-73）,巴中临港产业园项目13#-16#楼标准厂房室内消防(BZS2022-73),公司联营,joint,联营项目,副本项目名称统计表直营41条，联营693条(1).xlsx,2026-05-20
341,绵阳高新医院（肺病医院）建设项目之办公室装饰装修分包合同,绵阳高新医院(肺病医院)建设项目之办公室装饰装修分包合同,公司联营,joint,联营项目,副本项目名称统计表直营41条，联营693条(1).xlsx,2026-05-20
342,2022年日常维护项目（竞标12）,2022年日常维护项目(竞标12),公司联营,joint,联营项目,副本项目名称统计表直营41条，联营693条(1).xlsx,2026-05-20
343,德阳市罗江区救助管理站新建救助接待大厅新项目,德阳市罗江区救助管理站新建救助接待大厅新项目,公司联营,joint,联营项目,副本项目名称统计表直营41条，联营693条(1).xlsx,2026-05-20
344,龙岗001-20井气田水回注土建工程,龙岗001-20井气田水回注土建工程,公司联营,joint,联营项目,副本项目名称统计表直营41条，联营693条(1).xlsx,2026-05-20
345,龙岗001-20井气田水回注安装工程,龙岗001-20井气田水回注安装工程,公司联营,joint,联营项目,副本项目名称统计表直营41条，联营693条(1).xlsx,2026-05-20
346,德阳市第一小学校通风换气设备采购及配套用电设施改造项目,德阳市第一小学校通风换气设备采购及配套用电设施改造项目,公司联营,joint,联营项目,副本项目名称统计表直营41条，联营693条(1).xlsx,2026-05-20
347,旌阳区长江流域可持续发展（沱江上游-绵远河段）综合治理（4、5号地块地下室）（DYS2022-65）,旌阳区长江流域可持续发展(沱江上游-绵远河段)综合治理(4、5号地块地下室)(DYS2022-65),公司联营,joint,联营项目,副本项目名称统计表直营41条，联营693条(1).xlsx,2026-05-20
348,重庆市城投路桥管理有限公司2022年日常维护（竞标12）项目,重庆市城投路桥管理有限公司2022年日常维护(竞标12)项目,公司联营,joint,联营项目,副本项目名称统计表直营41条，联营693条(1).xlsx,2026-05-20
349,荣昌区仁义中学校舍建设项目,荣昌区仁义中学校舍建设项目,公司联营,joint,联营项目,副本项目名称统计表直营41条，联营693条(1).xlsx,2026-05-20
350,渝北区龙泉水库大坝公路西侧人行便道扶助工程,渝北区龙泉水库大坝公路西侧人行便道扶助工程,公司联营,joint,联营项目,副本项目名称统计表直营41条，联营693条(1).xlsx,2026-05-20
351,大足区2022年宝兴镇等（2）个镇丘陵山区高标准农田改造提升示范工程试点项目,大足区2022年宝兴镇等(2)个镇丘陵山区高标准农田改造提升示范工程试点项目,公司联营,joint,联营项目,副本项目名称统计表直营41条，联营693条(1).xlsx,2026-05-20
352,某部机关院内及教导队营房维修项目,某部机关院内及教导队营房维修项目,公司联营,joint,联营项目,副本项目名称统计表直营41条，联营693条(1).xlsx,2026-05-20
353,四川建筑职业技术学院德阳校区学生公寓粉刷维修项目,四川建筑职业技术学院德阳校区学生公寓粉刷维修项目,公司联营,joint,联营项目,副本项目名称统计表直营41条，联营693条(1).xlsx,2026-05-20
354,德阳九源燃气工程有限公司德阳市旌阳区老旧小区改造安全隐患治理中土方工程施工单位（第二批）,德阳九源燃气工程有限公司德阳市旌阳区老旧小区改造安全隐患治理中土方工程施工单位(第二批),公司联营,joint,联营项目,副本项目名称统计表直营41条，联营693条(1).xlsx,2026-05-20
355,德阳市旌阳区东山社区卫生服务中心基层防治能力提升项目,德阳市旌阳区东山社区卫生服务中心基层防治能力提升项目,公司联营,joint,联营项目,副本项目名称统计表直营41条，联营693条(1).xlsx,2026-05-20
356,丰都县峡南溪片区兴都公园大道西环线(K1+300—K2+611.409) 段市政道路工程,丰都县峡南溪片区兴都公园大道西环线(K1+300-K2+611.409)段市政道路工程,公司联营,joint,联营项目,副本项目名称统计表直营41条，联营693条(1).xlsx,2026-05-20
357,成青路（S105）、河黄路、子汉路路面维修工程,成青路(S105)、河黄路、子汉路路面维修工程,公司联营,joint,联营项目,副本项目名称统计表直营41条，联营693条(1).xlsx,2026-05-20
358,信达国际A栋1、2、3号电梯，D栋1、2号电梯井土建改造工程,信达国际A栋1、2、3号电梯，D栋1、2号电梯井土建改造工程,公司联营,joint,联营项目,副本项目名称统计表直营41条，联营693条(1).xlsx,2026-05-20
359,永川区卫星中型灌区续建配套与节水改造工程,永川区卫星中型灌区续建配套与节水改造工程,公司联营,joint,联营项目,副本项目名称统计表直营41条，联营693条(1).xlsx,2026-05-20
360,四川省烟草公司宜宾市公司外租仓库维修项目,四川省烟草公司宜宾市公司外租仓库维修项目,公司联营,joint,联营项目,副本项目名称统计表直营41条，联营693条(1).xlsx,2026-05-20
361,德阳市旌阳区医养结合中心及精神病院区建设项目,德阳市旌阳区医养结合中心及精神病院区建设项目,公司联营,joint,联营项目,副本项目名称统计表直营41条，联营693条(1).xlsx,2026-05-20
362,西藏华泰龙矿业开发有限公司接地环网安装工程,西藏华泰龙矿业开发有限公司接地环网安装工程,公司联营,joint,联营项目,副本项目名称统计表直营41条，联营693条(1).xlsx,2026-05-20
363,德阳市旌阳区医养结合中心及精神病院区建设项目国防电缆通信线路迁改工程,德阳市旌阳区医养结合中心及精神病院区建设项目国防电缆通信线路迁改工程,公司联营,joint,联营项目,副本项目名称统计表直营41条，联营693条(1).xlsx,2026-05-20
364,广清城际轨道交通项目（花都段）安置区工程（秀 全街乐同安置区）一期施工总承包项目 【园林园建】工程专业分包,广清城际轨道交通项目(花都段)安置区工程(秀全街乐同安置区)一期施工总承包项目【园林园建】工程专业分包,公司联营,joint,联营项目,副本项目名称统计表直营41条，联营693条(1).xlsx,2026-05-20
365,【广清城际轨道交通项目（花都段）安置区工程（狮岭镇前进安置区）一期施工总承包】项目【市政道路】工程专业分包,【广清城际轨道交通项目(花都段)安置区工程(狮岭镇前进安置区)一期施工总承包】项目【市政道路】工程专业分包,公司联营,joint,联营项目,副本项目名称统计表直营41条，联营693条(1).xlsx,2026-05-20
366,四川省烟草公司内江市公司土建、安装、装饰施工供应商采购项目,四川省烟草公司内江市公司土建、安装、装饰施工供应商采购项目,公司联营,joint,联营项目,副本项目名称统计表直营41条，联营693条(1).xlsx,2026-05-20
367,乐山嘉洋科技发展有限公司车间净化装修工程,乐山嘉洋科技发展有限公司车间净化装修工程,公司联营,joint,联营项目,副本项目名称统计表直营41条，联营693条(1).xlsx,2026-05-20
368,南川区第三中学扩建工程,南川区第三中学扩建工程,公司联营,joint,联营项目,副本项目名称统计表直营41条，联营693条(1).xlsx,2026-05-20
369,刘伟零星工程项目,刘伟零星工程项目,公司联营,joint,联营项目,副本项目名称统计表直营41条，联营693条(1).xlsx,2026-05-20
370,御嘉花苑2、3#楼,御嘉花苑2、3#楼,公司联营,joint,联营项目,副本项目名称统计表直营41条，联营693条(1).xlsx,2026-05-20
371,162井场外墙,162井场外墙,公司联营,joint,联营项目,副本项目名称统计表直营41条，联营693条(1).xlsx,2026-05-20
372,四川艺术职业学院消防隐患整治工程,四川艺术职业学院消防隐患整治工程,公司联营,joint,联营项目,副本项目名称统计表直营41条，联营693条(1).xlsx,2026-05-20
373,成渝双城经济圈川渝高竹新区制造产业园及配套基础设施建设项目（L3-1线道路及配套工程劳务分包）,成渝双城经济圈川渝高竹新区制造产业园及配套基础设施建设项目(L3-1线道路及配套工程劳务分包),公司联营,joint,联营项目,副本项目名称统计表直营41条，联营693条(1).xlsx,2026-05-20
374,德阳市行政综合办公楼（老政务中心）屋面防水改造工程,德阳市行政综合办公楼(老政务中心)屋面防水改造工程,公司联营,joint,联营项目,副本项目名称统计表直营41条，联营693条(1).xlsx,2026-05-20
375,德阳文德湖屿树花园项目一期一批次项目,德阳文德湖屿树花园项目一期一批次项目,公司联营,joint,联营项目,副本项目名称统计表直营41条，联营693条(1).xlsx,2026-05-20
376,绵阳金能集中办公室维修改造项目,绵阳金能集中办公室维修改造项目,公司联营,joint,联营项目,副本项目名称统计表直营41条，联营693条(1).xlsx,2026-05-20
377,东莞市长安镇莞港跨境货物运输接驳点工程,东莞市长安镇莞港跨境货物运输接驳点工程,公司联营,joint,联营项目,副本项目名称统计表直营41条，联营693条(1).xlsx,2026-05-20
378,西昌卷烟厂2021年厂区环境改造工程综合经营业务用房配套设施改造标段,西昌卷烟厂2021年厂区环境改造工程综合经营业务用房配套设施改造标段,公司联营,joint,联营项目,副本项目名称统计表直营41条，联营693条(1).xlsx,2026-05-20
379,国道G105线中山沙朗至古鹤段改建工程及市政配套工程堆料场场地处理,国道G105线中山沙朗至古鹤段改建工程及市政配套工程堆料场场地处理,公司联营,joint,联营项目,副本项目名称统计表直营41条，联营693条(1).xlsx,2026-05-20
380,米易县高铁站前广场环境整治项目,米易县高铁站前广场环境整治项目,公司联营,joint,联营项目,副本项目名称统计表直营41条，联营693条(1).xlsx,2026-05-20
381,盾构机制造、总装调试及再制造项目区域工程厂房钢结构专业分包施工程,盾构机制造、总装调试及再制造项目区域工程厂房钢结构专业分包施工程,公司联营,joint,联营项目,副本项目名称统计表直营41条，联营693条(1).xlsx,2026-05-20
