partner_id,legacy_partner_source,legacy_partner_id,name,customer_rank,supplier_rank,action
8763,xlsx_supplier_cooperat_company,name:中国农业发展银行四川省分行,中国农业发展银行四川省分行,1,0,create_new_xlsx_identity
8764,xlsx_supplier_cooperat_company,name:中江县南华镇创新石材经营部,中江县南华镇创新石材经营部,0,1,create_new_xlsx_identity
8765,xlsx_supplier_cooperat_company,name:农民工专户,农民工专户,0,1,create_new_xlsx_identity
8766,xlsx_supplier_cooperat_company,name:凉山州宏泰建筑劳务有限公司,凉山州宏泰建筑劳务有限公司,0,1,create_new_xlsx_identity
8767,xlsx_supplier_cooperat_company,name:剑阁县巧匠劳务有限公司,剑阁县巧匠劳务有限公司,0,1,create_new_xlsx_identity
8768,xlsx_supplier_cooperat_company,name:北川创建工程机械租赁有限公司,北川创建工程机械租赁有限公司,0,1,create_new_xlsx_identity
8769,xlsx_supplier_cooperat_company,name:喀什亚昌商贸有限公司,喀什亚昌商贸有限公司,0,1,create_new_xlsx_identity
8770,xlsx_supplier_cooperat_company,name:喀什市羽环工程机械租赁部,喀什市羽环工程机械租赁部,0,1,create_new_xlsx_identity
8771,xlsx_supplier_cooperat_company,name:喀什新路美建材有限公司英吉沙县分公司,喀什新路美建材有限公司英吉沙县分公司,0,1,create_new_xlsx_identity
8772,xlsx_supplier_cooperat_company,name:四川七星劳务有限公司成都分公司,四川七星劳务有限公司成都分公司,0,1,create_new_xlsx_identity
8773,xlsx_supplier_cooperat_company,name:四川三元聚弘建筑工程有限公司,四川三元聚弘建筑工程有限公司,0,1,create_new_xlsx_identity
8774,xlsx_supplier_cooperat_company,name:四川中德立鑫建设工程有限公司,四川中德立鑫建设工程有限公司,0,1,create_new_xlsx_identity
8775,xlsx_supplier_cooperat_company,name:四川博懿祥机械设备租赁有限公司,四川博懿祥机械设备租赁有限公司,0,1,create_new_xlsx_identity
8776,xlsx_supplier_cooperat_company,name:四川友鑫建筑工程有限公司,四川友鑫建筑工程有限公司,0,1,create_new_xlsx_identity
8777,xlsx_supplier_cooperat_company,name:四川名云百卓建筑工程有限公司,四川名云百卓建筑工程有限公司,0,1,create_new_xlsx_identity
8778,xlsx_supplier_cooperat_company,name:四川安高消防工程有限公司中江分公司,四川安高消防工程有限公司中江分公司,0,1,create_new_xlsx_identity
8779,xlsx_supplier_cooperat_company,name:四川宏旭建材有限公司,四川宏旭建材有限公司,0,1,create_new_xlsx_identity
8780,xlsx_supplier_cooperat_company,name:四川新驰峰商贸有限公司,四川新驰峰商贸有限公司,0,1,create_new_xlsx_identity
8781,xlsx_supplier_cooperat_company,name:四川涛聚信商贸有限责任公司,四川涛聚信商贸有限责任公司,0,1,create_new_xlsx_identity
8782,xlsx_supplier_cooperat_company,name:四川狮力威新材料科技有限公司,四川狮力威新材料科技有限公司,0,1,create_new_xlsx_identity
8783,xlsx_supplier_cooperat_company,name:四川瑞欣恒达建材销售有限公司,四川瑞欣恒达建材销售有限公司,0,1,create_new_xlsx_identity
8784,xlsx_supplier_cooperat_company,name:四川省德阳市坤鑫建筑劳务有限责任公司,四川省德阳市坤鑫建筑劳务有限责任公司,0,1,create_new_xlsx_identity
8785,xlsx_supplier_cooperat_company,name:四川省鑫顺发机械租赁有限公司,四川省鑫顺发机械租赁有限公司,0,1,create_new_xlsx_identity
8786,xlsx_supplier_cooperat_company,name:四川航兴建筑工程有限公司,四川航兴建筑工程有限公司,0,1,create_new_xlsx_identity
8787,xlsx_supplier_cooperat_company,name:四川锦泰致远智能工程有限公司,四川锦泰致远智能工程有限公司,0,1,create_new_xlsx_identity
8788,xlsx_supplier_cooperat_company,name:四川长腾建筑劳务有限公司,四川长腾建筑劳务有限公司,0,1,create_new_xlsx_identity
8789,xlsx_supplier_cooperat_company,name:四川鼎智盛工程项目管理有限公司,四川鼎智盛工程项目管理有限公司,0,1,create_new_xlsx_identity
8790,xlsx_supplier_cooperat_company,name:大通通利水泥制品有限公司,大通通利水泥制品有限公司,0,1,create_new_xlsx_identity
8791,xlsx_supplier_cooperat_company,name:布拖县民主加油站,布拖县民主加油站,0,1,create_new_xlsx_identity
8792,xlsx_supplier_cooperat_company,name:广州市飞隆工程运输有限公司,广州市飞隆工程运输有限公司,0,1,create_new_xlsx_identity
8793,xlsx_supplier_cooperat_company,name:广汉市丰众建材经营部,广汉市丰众建材经营部,0,1,create_new_xlsx_identity
8794,xlsx_supplier_cooperat_company,name:库尔班江依明,库尔班江·依明,0,1,create_new_xlsx_identity
8795,xlsx_supplier_cooperat_company,name:德阳兴灏工程机械租赁有限公司,德阳兴灏工程机械租赁有限公司,0,1,create_new_xlsx_identity
8796,xlsx_supplier_cooperat_company,name:德阳市九鼎机械设备租赁有限公司,德阳市九鼎机械设备租赁有限公司,0,1,create_new_xlsx_identity
8797,xlsx_supplier_cooperat_company,name:德阳市区天义光电检测行,德阳市区天义光电检测行,0,1,create_new_xlsx_identity
8798,xlsx_supplier_cooperat_company,name:德阳市区瑞克防水材料经营部,德阳市区瑞克防水材料经营部,0,1,create_new_xlsx_identity
8799,xlsx_supplier_cooperat_company,name:德阳市华壹商贸有限公司,德阳市华壹商贸有限公司,0,1,create_new_xlsx_identity
8800,xlsx_supplier_cooperat_company,name:德阳市吉瑞租赁有限公司,德阳市吉瑞租赁有限公司,0,1,create_new_xlsx_identity
8801,xlsx_supplier_cooperat_company,name:德阳市浙民电器设备有限公司,德阳市浙民电器设备有限公司,0,1,create_new_xlsx_identity
8802,xlsx_supplier_cooperat_company,name:德阳市罗江区社会保险服务中心,德阳市罗江区社会保险服务中心,1,1,create_new_xlsx_identity
8803,xlsx_supplier_cooperat_company,name:德阳彤宁土石方工程有限公司,德阳彤宁土石方工程有限公司,0,1,create_new_xlsx_identity
8804,xlsx_supplier_cooperat_company,name:德阳经开区旌鸿茂机械租赁经营部个体工商户,德阳经开区旌鸿茂机械租赁经营部（个体工商户）,0,1,create_new_xlsx_identity
8805,xlsx_supplier_cooperat_company,name:忠县富民劳务有限责任公司,忠县富民劳务有限责任公司,0,1,create_new_xlsx_identity
8806,xlsx_supplier_cooperat_company,name:成都宁锋商贸有限公司,成都宁锋商贸有限公司,0,1,create_new_xlsx_identity
8807,xlsx_supplier_cooperat_company,name:成都市长峰钢铁集团有限公司,成都市长峰钢铁集团有限公司,0,1,create_new_xlsx_identity
8808,xlsx_supplier_cooperat_company,name:成都长红润晨建材有限公司,成都长红润晨建材有限公司,0,1,create_new_xlsx_identity
8809,xlsx_supplier_cooperat_company,name:新疆凌新建筑工程有限公司,新疆凌新建筑工程有限公司,0,1,create_new_xlsx_identity
8810,xlsx_supplier_cooperat_company,name:旌阳区忠明工程机械设备租赁服务部,旌阳区忠明工程机械设备租赁服务部.,0,1,create_new_xlsx_identity
8811,xlsx_supplier_cooperat_company,name:旌阳区星龙机电经营部,旌阳区星龙机电经营部,0,1,create_new_xlsx_identity
8812,xlsx_supplier_cooperat_company,name:旌阳区睿行达建筑材料经营部,旌阳区睿行达建筑材料经营部,0,1,create_new_xlsx_identity
8813,xlsx_supplier_cooperat_company,name:旌阳区裕鑫五金经营部,旌阳区裕鑫五金经营部,0,1,create_new_xlsx_identity
8814,xlsx_supplier_cooperat_company,name:旌阳区金益建材经营部,旌阳区金益建材经营部,0,1,create_new_xlsx_identity
8815,xlsx_supplier_cooperat_company,name:旌阳区鑫宇建材经营部,旌阳区鑫宇建材经营部,0,1,create_new_xlsx_identity
8816,xlsx_supplier_cooperat_company,name:旌阳区雷盾电动门维修经营部,旌阳区雷盾电动门维修经营部,0,1,create_new_xlsx_identity
8817,xlsx_supplier_cooperat_company,name:普格县顺达经营部,普格县顺达经营部,0,1,create_new_xlsx_identity
8818,xlsx_supplier_cooperat_company,name:永川区启乘机械设备租赁经营部个体工商户,永川区启乘机械设备租赁经营部（个体工商户）,0,1,create_new_xlsx_identity
8819,xlsx_supplier_cooperat_company,name:永州市智博工程有限公司,永州市智博工程有限公司,0,1,create_new_xlsx_identity
8820,xlsx_supplier_cooperat_company,name:江津区恒峰铝合金加工经营部,江津区恒峰铝合金加工经营部,0,1,create_new_xlsx_identity
8821,xlsx_supplier_cooperat_company,name:深圳市正泓融资担保有限公司,深圳市正泓融资担保有限公司,0,1,create_new_xlsx_identity
8822,xlsx_supplier_cooperat_company,name:渝北区鸣谦机械设备租赁站,渝北区鸣谦机械设备租赁站,0,1,create_new_xlsx_identity
8823,xlsx_supplier_cooperat_company,name:璧山区林建工程机械租赁经营部,璧山区林建工程机械租赁经营部,0,1,create_new_xlsx_identity
8824,xlsx_supplier_cooperat_company,name:疏附县华拓机械租赁部,疏附县华拓机械租赁部,0,1,create_new_xlsx_identity
8825,xlsx_supplier_cooperat_company,name:绵竹市辰之兴工程管理服务部,绵竹市辰之兴工程管理服务部,0,1,create_new_xlsx_identity
8826,xlsx_supplier_cooperat_company,name:绵阳市游仙区福贵工程机械租赁部,绵阳市游仙区福贵工程机械租赁部,0,1,create_new_xlsx_identity
8827,xlsx_supplier_cooperat_company,name:绵阳源来志承油脂销售有限公司,绵阳源来志承油脂销售有限公司,0,1,create_new_xlsx_identity
8828,xlsx_supplier_cooperat_company,name:绵阳精运物流服务有限公司,绵阳精运物流服务有限公司,0,1,create_new_xlsx_identity
8829,xlsx_supplier_cooperat_company,name:绵阳鑫泰水泥制品有限公司,绵阳鑫泰水泥制品有限公司,0,1,create_new_xlsx_identity
8830,xlsx_supplier_cooperat_company,name:荣昌区昌州街道如鸿挖掘机租赁站,荣昌区昌州街道如鸿挖掘机租赁站,0,1,create_new_xlsx_identity
8831,xlsx_supplier_cooperat_company,name:西藏景胜工程技术有限公司,西藏景胜工程技术有限公司,0,1,create_new_xlsx_identity
8832,xlsx_supplier_cooperat_company,name:遂宁市祥通建材有限公司,遂宁市祥通建材有限公司,0,1,create_new_xlsx_identity
8833,xlsx_supplier_cooperat_company,name:重庆伟翰建筑设备租赁有限公司,重庆伟翰建筑设备租赁有限公司,0,1,create_new_xlsx_identity
8834,xlsx_supplier_cooperat_company,name:重庆图南供应链有限公司,重庆图南供应链有限公司,0,1,create_new_xlsx_identity
8835,xlsx_supplier_cooperat_company,name:重庆市南川区财政局,重庆市南川区财政局,0,1,create_new_xlsx_identity
8836,xlsx_supplier_cooperat_company,name:重庆建发建筑劳务有限公司,重庆建发建筑劳务有限公司,0,1,create_new_xlsx_identity
8837,xlsx_supplier_cooperat_company,name:重庆戴杨合建材有限公司,重庆戴杨合建材有限公司,0,1,create_new_xlsx_identity
8838,xlsx_supplier_cooperat_company,name:重庆柯腾建筑劳务有限公司,重庆柯腾建筑劳务有限公司,0,1,create_new_xlsx_identity
8839,xlsx_supplier_cooperat_company,name:重庆汇尔固机电设备有限公司,重庆汇尔固机电设备有限公司,0,1,create_new_xlsx_identity
8840,xlsx_supplier_cooperat_company,name:重庆泸酒阁商贸有限公司,重庆泸酒阁商贸有限公司,0,1,create_new_xlsx_identity
8841,xlsx_supplier_cooperat_company,name:重庆象征建筑设备租赁有限公司,重庆象征建筑设备租赁有限公司,0,1,create_new_xlsx_identity
8842,xlsx_supplier_cooperat_company,name:重庆鑫亚坤新型环保建材有限公司,重庆鑫亚坤新型环保建材有限公司,0,1,create_new_xlsx_identity
8843,xlsx_supplier_cooperat_company,name:重庆零零柒工程担保有限公司,重庆零零柒工程担保有限公司,0,1,create_new_xlsx_identity
8844,xlsx_supplier_cooperat_company,name:金牛区浩辉建材经营部,金牛区浩辉建材经营部,0,1,create_new_xlsx_identity
8845,xlsx_supplier_cooperat_company,name:铜梁区渝铜电脑商行,铜梁区渝铜电脑商行,0,1,create_new_xlsx_identity
8846,xlsx_supplier_cooperat_company,name:麦盖提县盛源水利电力工程有限公司,麦盖提县盛源水利电力工程有限公司,0,1,create_new_xlsx_identity
