contract_id,legacy_contract_id,legacy_project_id,project_id,project_name,partner_id,partner_name,name,subject,type,state,legacy_contract_no,legacy_document_no,legacy_external_contract_no,legacy_status,legacy_deleted_flag,legacy_counterparty_text,line_count,is_locked
361,3b8fa94e516e4801a2b1391a6bf44a76,6b4e37cd90a94055a69de211efdab846,334,易静工程（德阳二重工程项目）,19267,中国第二重型机械集团德阳万航模锻有限责任公司,CONIN2600358,XK2125A数控龙门铣现场位置变更整治施工,out,draft,DYS2022-51-5,WBHTGL-20220927-003,1000000767,2,0,中国第二重型机械集团德阳万航模锻有限责任公司,0,False
362,3b9d03d1f0cc47de8b81daf1f1746e7d,3ddb4ef7f09a4280b7ef904a6f6e5275,194,简乃华工程（八角卫生院项目）,19667,德阳市旌阳区八角井镇卫生院,CONIN2600359,八角卫生院-口腔科装修改造工程,out,draft,DYS2021-49-01,WBHTGL-20210616-001,1000000454,2,0,德阳市旌阳区八角井镇卫生院,0,False
363,3bb756656c66451d906e0426377beae7,b7f07bc4b72c4cd29b5d1b445b499386,553,工程学院零星项目,19452,四川工程职业技术学院,CONIN2600360,松苑餐厅楼梯及周边栏杆加固维修,out,draft,DYS2021-12-12,WBHTGL-20210628-001,1000000460,2,0,四川工程职业技术学院,0,False
364,3c0659411d374bfcb2313cef17bb6a52,52278e622558409db167eca9eba8c8b8,266,【广州市花都区殡仪馆迁建工程施工总承包】项目【室外（园建、绿化、道路及护坡工程）】工程,26049,中国建筑第四工程局有限公司,CONIN2600361,广州市花都区殡仪馆园建、绿化、道路及护坡工程专业分包,out,draft,GZS2019-66,WBHTGL-20200407-001,1000000165,2,0,中国建筑第四工程局有限公司,0,False
365,3c0807f4977d42f0bcd9a921d1cd833d,77f6ddc2d277451f922b7c5177530dde,364,违法建（构）筑物拆除工程施工协议2021-2024,19649,德阳市城市管理行政执法局,CONIN2600362,劳务外包服务协议,out,draft,2DYS2021-38-1,WBHTGL-20221010-001,1000000774,2,0,德阳市城市管理行政执法局,0,False
366,3c16265018624b8193477b6d68601007,6b4e37cd90a94055a69de211efdab846,334,易静工程（德阳二重工程项目）,19267,中国第二重型机械集团德阳万航模锻有限责任公司,CONIN2600363,热处理厂-XX产品散空冷区域现场整治,out,draft,DYS2025-195,WBHTGL-20251112-002,17629105572130000,2,0,中国第二重型机械集团德阳万航模锻有限责任公司,0,False
367,3c2e3955f585475383528309d3cd7e77,c2a0156bc72d457da0145ca8241ea734,583,重庆市璧山区璧泉街道老旧小区改造项目（天门社区）,20090,重庆市璧山区人民政府璧泉街道办事处,CONIN2600364,重庆市璧山区璧泉街道老旧小区改造项目（天门社区）,out,draft,CQS2025-132,WBHTGL-20250818-002,17555069418430000,2,0,重庆市璧山区人民政府璧泉街道办事处,0,False
368,3c5925fb362044acb52412524c299afa,22aa38f6dc0c44649d0a397653bce651,108,喀什地区塔什库尔干县生活垃圾分类收运及处置建设项目工程总承包第三标段,19428,喀什地区塔什库尔干县生活垃圾分类收运及处置建设项目工程总承包第三标段项目经理部,CONIN2600365,喀什地区塔什库尔干县生活垃圾分类收运及处置建设项目工程总承包第三标段,out,draft,XJ2024-133,WBHTGL-20240819-003,17240320073900000,-1,0,喀什地区塔什库尔干县生活垃圾分类收运及处置建设项目工程总承包第三标段项目经理部,0,False
369,3c6ce2c423194b32937ccb91646d9f21,6b4e37cd90a94055a69de211efdab846,334,易静工程（德阳二重工程项目）,26069,二重（德阳）重型装备有限公司,CONIN2600366,热处理厂25#、26#变压器及低压配电室改造合同,out,draft,DYS2024-76,WBHTGL-20240511-003,17153985476330000,2,0,二重（德阳）重型装备有限公司,0,False
370,3caad57f33b84455a237ca69ab0b2e31,e924a06df23947afb4218e1c38b3cfe8,695,花荄镇兴福村草溪河石拱桥维修加固工程,19944,绵阳市安州区花荄镇兴福村股份经济合作联合社,CONIN2600367,花荄镇兴福村草溪河石拱桥维修加固工程,out,draft,MYS2024-235,WBHTGL-20241031-001,17303372360490000,2,0,绵阳市安州区花荄镇兴福村股份经济合作联合社,0,False
371,3d25d90e164849caaf939dfe1ff32cac,b7f07bc4b72c4cd29b5d1b445b499386,553,工程学院零星项目,19452,四川工程职业技术学院,CONIN2600368,2021年3月单招校区维修项目,out,draft,DYS2021-12-06,WBHTGL-20210401-001,1000000388,2,0,四川工程职业技术学院,0,False
372,3d3e5b7d82eb4f78b1bc5691925a7684,ca9cc3a115d44c1faf31b0ae8d8c16dc,600,垫江县城区污水处理厂提标改造项目（中水管网建设工程A段）--玉鼎桥至明月大道段（第二次）,26087,垫江县小厦建筑有限公司,CONIN2600369,垫江县城区污水处理厂提标改造项目（中水管网建设工程A段）--玉鼎桥至明月大道段,out,draft,CQS2026-21,WBHTGL-20260204-001,17701959923610000,2,0,垫江县小厦建筑有限公司,0,False
373,3d822835e0df40cdbb71bf0071f14120,e7d967ab98084a1bb1efdb2e0cd7674c,689,杨永田项目,19734,德阳旌信城市管理服务股份有限公司,CONIN2600370,金螺湾及文德湖游乐设备维修与更换,out,draft,DYS2025-65,WBHTGL-20251009-001,17599918710280000,2,0,德阳旌信城市管理服务股份有限公司,0,False
374,3df53a3ee26e4ffc8ac7475c969c4fa4,ec8e6e03ff4c40cfb4ce25cdddc7474e,707,向东工程,26098,德阳市供水安装工程队,CONIN2600371,德阳文德房地产开发有限公司施工用水工程,out,draft,DYS2022-16-20,WBHTGL-20220507-013,1000000654,2,0,德阳市供水安装工程队,0,False
375,3e59e8b332b74eacb1d679cbd8f0d0f9,d5e059c23e3d4a2c802cbecb7911cd38,632,绵竹何高春项目,19934,绵竹市众力工程机械设备有限公司,CONIN2600372,绵竹市齐协路、桑土路道路维修养护工程,out,draft,DYS2023-75,WBHTGL-20230706-004,1000000962,2,0,绵竹市众力工程机械设备有限公司,0,False
376,3e9004ba82bc47f8bf5ea7aa77ff7524,6b4e37cd90a94055a69de211efdab846,334,易静工程（德阳二重工程项目）,19535,安徽电气集团股份有限公司,CONIN2600373,金结厂设备基础地槽铁项目改造工程,out,draft,DYS2025-50,WBHTGL-20250415-001,17446851829150000,2,0,安徽电气集团股份有限公司,0,False
377,3ee00f6f3e364d028eed24e5fbfe65c1,ec8e6e03ff4c40cfb4ce25cdddc7474e,707,向东工程,26098,德阳市供水安装工程队,CONIN2600374,四川锦晟鑫置业有限公司施工用水工程,out,draft,DYS2022-16-51,WBHTGL-20220726-029,1000000726,2,0,德阳市供水安装工程队,0,False
378,3fb1d48ea6cb4ace9fec0777df645cc4,973001fda0d442faa9516db4ace99a73,463,玛瑙村易地扶贫搬迁堡坎及边坡支护工程,20172,马边磷都发展有限公司,CONIN2600375,玛瑙村易地扶贫搬迁堡坎及边坡支护工程,out,draft,LSS2019-34,WBHTGL-20200303-013,1000000090,2,0,马边磷都发展有限公司,0,False
379,3fe94035f29c417cba0c23be63cb0b66,cad02e2bd4444edead1b36635639cf2d,601,巴中恩阳临港产业园建设项目一制造业组团项目润禾改造工程1-5号楼防水保温工程,19321,中铁十八局集团有限公司,CONIN2600376,巴中恩阳临港产业园建设项目一制造业组团项目润禾改造工程1-5号楼防水保温工程,out,draft,BZS2022-12,WBHTGL-20220111-001,1000000587,2,0,中铁十八局集团有限公司,0,False
380,401160b6a01b456ab6256e0efa7329de,ec8e6e03ff4c40cfb4ce25cdddc7474e,707,向东工程,26098,德阳市供水安装工程队,CONIN2600377,洛河小区A区东门自动售水机分户工程,out,draft,DYS2022-16-47,WBHTGL-20220726-025,1000000722,2,0,德阳市供水安装工程队,0,False
381,401cb4792bea4f6e9ea044aa9c67e77b,b155837db59c42d9a3eccff2df5bfad8,538,黄猫垭园区建设工程劳务分包,19493,四川省黄猫垭农业生物科技发展有限公司,CONIN2600378,黄猫垭园区建设工程劳务分包,out,draft,GYS2016-37,WBHTGL-20200229-029,1000000065,2,0,四川省黄猫垭农业生物科技发展有限公司,0,False
382,402a2b1856c047f3ad35b91b4d761bd6,9ebba094a48443a39dd7e1421da8dfbb,480,刘伟零星工程项目,19433,四川东电金宇置业有限公司瑞麟东方酒店,CONIN2600379,瑞麟东方酒店厨房燃气报警系统安装,out,draft,DYS2023-120,WBHTGL-20230908-001,16941530860850000,2,0,四川东电金宇置业有限公司瑞麟东方酒店,0,False
383,40502b6c91be452095d331270da853b8,0e04e445c6304b5f9e3b79ffdde72eb1,40,绵阳金能集中办公室维修改造项目,26118,绵阳皓华光电科技有限公司,CONIN2600380,竣工结算审核书,out,draft,MYS2022-40-1,WBHTGL-20240410-001,17127307357330000,2,0,绵阳皓华光电科技有限公司,0,False
384,4064848b42f94a5eaec1f0b24ef49ed0,ec8e6e03ff4c40cfb4ce25cdddc7474e,707,向东工程,26098,德阳市供水安装工程队,CONIN2600381,大名城8.9.10.11.12.20号楼新建户表工程,out,draft,DYS2021-01-15,WBHTGL-20210408-004,1000000399,2,0,德阳市供水安装工程队,0,False
385,4072c73b39744718a8786199e3d53cf8,784c455d3cfe45cf9b7dfdf3d752e81a,367,龙岗001-20井气田水回注土建工程,26051,中国石油天然气第七建设有限公司,CONIN2600382,合同变更协议,out,draft,NCS2022-67,WBHTGL-20250718-003,17528059777590000,2,0,中国石油天然气第七建设有限公司,0,False
386,408421dad9f44812b4411ab4b42bd483,9ebba094a48443a39dd7e1421da8dfbb,480,刘伟零星工程项目,19666,德阳市旌阳区仁蒙民族幼儿园,CONIN2600383,德阳市旌阳区仁蒙民族幼儿园厨房燃气报警系统安装,out,draft,DYS2023-117,WBHTGL-20230905-001,16938987510760000,2,0,德阳市旌阳区仁蒙民族幼儿园,0,False
387,40bf4c6dbef84cda86656e5dc4955faa,e0e2a533f7224713a481520af78809ad,668,幸福人家项目工程,19733,德阳方兴建设有限责任公司,CONIN2600384,幸福人家项目工程,out,draft,DYS2020-03,WBHTGL-20200623-001,1000000209,2,0,德阳方兴建设有限责任公司,0,False
388,40cbbbfc9a7b4b5b8f4af2e7e64f5d23,00a4bb196d944fa5a8c56e3bd3f1e448,1,德阳市罗江区鄢家镇高垭村山坪塘整治项目,19714,德阳市罗江区鄢家镇人民政府,CONIN2600385,德阳市罗江区鄢家镇高垭村山坪塘整治项目,out,draft,DYS2024-68,WBHTGL-20241127-006,17326945150190000,2,0,德阳市罗江区鄢家镇人民政府,0,False
389,40d53bed5f6c43e5a0d2a245f34f7b64,33bf23a069304419a4c259caf04473a8,163,南开两江中学学校宿舍改造工程,20074,重庆市南开两江中学校,CONIN2600386,南开两江中学校宿舍改造工程,out,draft,CQS2021-16,WBHTGL-20210303-001,1000000380,2,0,重庆市南开两江中学校,0,False
390,40d73339b064436e927065c91d3e71f2,b7f07bc4b72c4cd29b5d1b445b499386,553,工程学院零星项目,19452,四川工程职业技术学院,CONIN2600387,更换抽水泵,out,draft,DYS2021-13-26,WBHTGL-20211206-004,1000000555,2,0,四川工程职业技术学院,0,False
391,40e8c21c438f42efb2064fbe96aeca63,74d58dce00e345c3af7cbdc58dc2bbbc,355,中国移动四川分公司德阳片区2018-2020年渠道零星维修项目（标包14）,19258,中国移动通信集团四川有限公司德阳分公司,CONIN2600388,中国移动四川分公司德阳片区2018-2020年渠道零星维修项目,out,draft,DYS2019-25,WBHTGL-20200311-010,1000000119,2,0,中国移动通信集团四川有限公司德阳分公司,0,False
392,40ed68e47d3e44df8b715078f45cea8f,44169b333e24436aa3592d06b9d2a0c3,211,四川省区域应急救援雅安基地项目综合业务大楼外墙铝格栅专业分包工程,20156,雅安城投建筑工程有限公司,CONIN2600389,四川省区域应急救援雅安基地项目综合业务大楼外墙铝格栅专业分包工程,out,draft,YAS2023-62,WBHTGL-20230616-001,1000000949,2,0,雅安城投建筑工程有限公司,0,False
393,40f148c92b0a4cd8aa069a6f464f1b7c,ec8e6e03ff4c40cfb4ce25cdddc7474e,707,向东工程,26098,德阳市供水安装工程队,CONIN2600390,田勇岷江东路400号分户工程,out,draft,DYS2022-16-57,WBHTGL-20220726-034,1000000731,2,0,德阳市供水安装工程队,0,False
394,41100ce85d8840968328d580d305b0d7,b7f07bc4b72c4cd29b5d1b445b499386,553,工程学院零星项目,19452,四川工程职业技术学院,CONIN2600391,研发大楼至孵化大楼之间消防水管明沟施工项目,out,draft,DYS2024-07,WBHTGL-20240119-001,17056343466530000,2,0,四川工程职业技术学院,0,False
395,411556d078034b53a7a6a63691d266b6,b7f07bc4b72c4cd29b5d1b445b499386,553,工程学院零星项目,19452,四川工程职业技术学院,CONIN2600392,孵化大楼南面场地平整项目,out,draft,DYS2020-07-09,WBHTGL-20200904-001,1000000243,2,0,四川工程职业技术学院,0,False
396,4140baa6ba6347b4b60d5a995cc972ad,ec8e6e03ff4c40cfb4ce25cdddc7474e,707,向东工程,26098,德阳市供水安装工程队,CONIN2600393,泰山南路黄昌国分户工程,out,draft,DYS2020-59-01,WBHTGL-20201225-002,1000000322,2,0,德阳市供水安装工程队,0,False
397,415b6eed675349d8a79c22292d84a016,5ff6d476b782459db42c01e366ed73a7,303,德阳市罗江区老旧小区改造项目四标段（二期）,19701,德阳市罗江区住房和城乡建设局,CONIN2600394,德阳市罗江区老旧小区改造项目四标段（二期）,out,draft,DYS2022-99,WBHTGL-20221205-001,1000000828,2,0,德阳市罗江区住房和城乡建设局,0,False
398,415b8e3642274ae09ccd2b9e807c18fc,b7f07bc4b72c4cd29b5d1b445b499386,553,工程学院零星项目,19451,四川工程职业技术大学,CONIN2600395,校园外卖置物架及相关场地建设项目,out,draft,DYS2025-210,WBHTGL-20251124-004,17639753705940000,2,0,四川工程职业技术大学,0,False
399,418cae549b0240c494f163253cb3ce96,bc8a3285e9af4dcda5895313440be16a,564,九寨沟县漳扎镇小学校等灾后重建项目部-九寨沟干部职工周转房,19489,四川省第一建筑工程有限公司,CONIN2600396,九寨沟县干部职工周转宿舍装饰装修专业分包,out,draft,ABZ2020-14,WBHTGL-20200702-001,1000000216,2,0,四川省第一建筑工程有限公司,0,False
400,419650edd1c54b1c96fe7f868b58d673,d5e059c23e3d4a2c802cbecb7911cd38,632,绵竹何高春项目,19934,绵竹市众力工程机械设备有限公司,CONIN2600397,S419绵竹市遵道镇(太平村)至金花镇(金山村)段大修工程 劳务(沥青砼摊铺)施工补充合同,out,draft,DYS2024-84-1,WBHTGL-20240701-002,17198234090980000,2,0,绵竹市众力工程机械设备有限公司,0,False
401,41db9c3faa234466adc40e0371ac19c7,a3f1efed66944330a8825ac889c5cb86,501,中国航发公司郝小成零星工程,19272,中国航发航空科技股份有限公司,CONIN2600398,14厂车棚改造项目施工,out,draft,DYS2023-113,WBHTGL-20230825-003,16929541776830000,2,0,中国航发航空科技股份有限公司,0,False
402,424361fe38ef4de2ae7c74a10e91801b,0b3b88a05d6d454b9cbbe6b4c3c342d5,30,岳普湖县防沙治沙电力配套设施建设项目,26109,新疆维吾尔自治区岳普湖县自然资源局,CONIN2600399,岳普湖县防沙治沙电力配套设施建设项目,out,draft,XJ2026-26,WBHTGL-20260213-003,17709682057670000,1,0,新疆维吾尔自治区岳普湖县自然资源局,0,False
403,42656040066a4473971c3e73f01f58b0,9ebba094a48443a39dd7e1421da8dfbb,480,刘伟零星工程项目,19758,德阳鑫利化工厂,CONIN2600400,德阳鑫利化工厂锅炉房燃气报警系统安装,out,draft,DYS2025-233,WBHTGL-20251217-002,17659547346070000,2,0,德阳鑫利化工厂,0,False
404,426c9a6798e94c0fbf6921bf92a02f1a,65261c6899f64e658c76735183a388a4,316,年产55万吨牛卡及瓦楞纸项目配套废纸制浆车间、上料间、碎浆间、渣处理间工程第三方外协,19912,玖龙纸业（重庆）有限公司,CONIN2600401,年产55万吨牛卡及瓦楞纸项目配套废纸制浆车间、上料间、碎浆间、渣处理间工程第三方外协,out,draft,CQS2020-08,WBHTGL-20200427-006,1000000180,2,0,玖龙纸业（重庆）有限公司,0,False
405,426f69bf2f464e9fa69ec7c83a309b90,dccfa12fb5b747dca476d457c0464d30,653,御嘉花苑2、3#楼,19470,四川瑞荣建设有限责任公司,CONIN2600402,御嘉花苑2、3#楼,out,draft,CDS2022-37,WBHTGL-20220428-002,1000000636,2,0,四川瑞荣建设有限责任公司,0,False
406,427c7089fe894292af3e92cf93d0064d,fafad4e03da24e98b7f8cf26706127b8,744,中国移动四川分公司天府新区2018-2020年渠道零星维修项目（标包4）,19256,中国移动通信集团四川有限公司天府新区分公司,CONIN2600403,中国移动四川分公司天府新区2018-2020年渠道零星维修项目,out,draft,CDS2019-21,WBHTGL-20200311-011,1000000120,2,0,中国移动通信集团四川有限公司天府新区分公司,0,False
407,428167aa46c3465a93010874f2b387fe,6b4e37cd90a94055a69de211efdab846,334,易静工程（德阳二重工程项目）,19336,二重（德阳）重型装备有限公司,CONIN2600404,齿轮厂现场部分设施治漏,out,draft,DYS2023-59,WBHTGL-20230609-001,1000000946,2,0,二重（德阳）重型装备有限公司,0,False
408,42c5c153bd544fedbab7936f516eaf44,6b4e37cd90a94055a69de211efdab846,334,易静工程（德阳二重工程项目）,26069,二重（德阳）重型装备有限公司,CONIN2600405,齿轮厂车间大门整改,out,draft,DYS2020-06-03,WBHTGL-20201102-001,1000000273,2,0,二重（德阳）重型装备有限公司,0,False
409,42e786fbdead4cbaa6e809f58eed5c38,ec8e6e03ff4c40cfb4ce25cdddc7474e,707,向东工程,26098,德阳市供水安装工程队,CONIN2600406,保利翡丽湾C区施工用水工程,out,draft,DYS2021-01-06,WBHTGL-20210120-003,1000000352,2,0,德阳市供水安装工程队,0,False
410,42f837354cf241858c227feb171272ac,417d8d223a784630877b006d8067e142,204,岳普湖县2020年棚户区改造安置小区建设项目一标段,26136,中铁十九局集团第三工程有限公司,CONIN2600407,岳普湖县2020年棚户区改造安置小区建设项目一标段,out,draft,XJQ2021-105,WBHTGL-20211202-001,1000000551,2,0,中铁十九局集团第三工程有限公司,0,False
411,42ff827ce59b46bab197ba58fe5e6d12,f317a95150bd4989a3a673a4796c3c9c,727,中江实验中学新建教学及辅助用房和附属工程（一期）,19476,四川省中江实验中学,CONIN2600408,施工合同补充协议,out,draft,DYS2021-11-1,WBHTGL-20210628-004,1000000463,2,0,四川省中江实验中学,0,False
412,4330a39eef4641329d704fad8f8a018e,ec8e6e03ff4c40cfb4ce25cdddc7474e,707,向东工程,26098,德阳市供水安装工程队,CONIN2600409,久远德重机械有限公司（赵燕燕）关闭自备水工程,out,draft,DYS2024-29,WBHTGL-20240124-008,17060678055450000,2,0,德阳市供水安装工程队,0,False
413,435fa909b3484a83a41c1307be740e5a,ec8e6e03ff4c40cfb4ce25cdddc7474e,707,向东工程,26098,德阳市供水安装工程队,CONIN2600410,嘉利广场商业楼佘廷兵分户工程,out,draft,DYS2022-16-75,WBHTGL-20221117-009,1000000807,2,0,德阳市供水安装工程队,0,False
414,436983ffd4c845a3a3fbe3066c831f33,6b4e37cd90a94055a69de211efdab846,334,易静工程（德阳二重工程项目）,19267,中国第二重型机械集团德阳万航模锻有限责任公司,CONIN2600411,厂区房顶治漏及通风换气,out,draft,DYS2022-51-6,WBHTGL-20231219-037,17029836599730000,2,0,中国第二重型机械集团德阳万航模锻有限责任公司,0,False
415,436990ac62554fedb484001e8447639b,513f713857db46e196f61d6df8257fd1,261,四川金鑫公司职工家属区“三供一业”分离移交物业设施维修改造项目（东区）-防水工程,19621,德阳国信建设工程有限公司,CONIN2600412,四川金鑫公司职工家属区“三供一业”分离移交物业设施维修改造项目（东区）防水专业分包工程,out,draft,DYS2022-03,WBHTGL-20220114-001,1000000590,2,0,德阳国信建设工程有限公司,0,False
416,43a4444ae1da4e07aca9030858b9be83,6b4e37cd90a94055a69de211efdab846,334,易静工程（德阳二重工程项目）,26091,德阳二重新业建筑工程有限责任公司,CONIN2600413,万航模锻8万吨压机地下泵站通风整治项目,out,draft,DYS2023-87,WBHTGL-20230718-001,1000000974,2,0,德阳二重新业建筑工程有限责任公司,0,False
417,43dce049656a4f9cbcaafc6fc1c2b090,ec8e6e03ff4c40cfb4ce25cdddc7474e,707,向东工程,26098,德阳市供水安装工程队,CONIN2600414,德阳市天府旌城西二环（长江路-沱江路）给水管道迁改工程-（东海路-九龙江路）DN400给水管道迁改工程,out,draft,DYS2024-20,WBHTGL-20240123-014,17060035934190000,2,0,德阳市供水安装工程队,0,False
418,43e74910920f446498e2978dd84eddaa,bde18269fcd04d00910a9b456d0a4813,570,南川区第三中学扩建工程,20073,重庆市南川区第三中学校,CONIN2600415,南川区第三中学校扩建工程,out,draft,CQS2022-41,WBHTGL-20220509-001,1000000657,2,0,重庆市南川区第三中学校,0,False
419,447e33baaa1b4782b9cb4eefd6a0ad9b,9ebba094a48443a39dd7e1421da8dfbb,480,刘伟零星工程项目,19720,德阳市金山街学校,CONIN2600416,德阳市金山街学校厨房燃气报警系统安装,out,draft,DYS2025-207,WBHTGL-20251124-001,17639691304850000,2,0,德阳市金山街学校,0,False
420,44e0d9acd75a4e86ab04c40d6e1ed567,6b4e37cd90a94055a69de211efdab846,334,易静工程（德阳二重工程项目）,19267,中国第二重型机械集团德阳万航模锻有限责任公司,CONIN2600417,模锻厂-1#2#3#4#DDS出料机舱门修复,out,draft,DYS2025-23,WBHTGL-20250226-003,17405589532180000,2,0,中国第二重型机械集团德阳万航模锻有限责任公司,0,False
421,4512209014a642b78248b2bde9d5d60c,1da16136281c46fc9fb1d3038e68f983,90,石船镇农村公路（关兴村）井环路堡坎修复工程,19886,渝北区石船镇人民政府,CONIN2600418,石船镇农村公路（关兴村）井环路堡坎修复工程,out,draft,CQS2025-146,WBHTGL-20250908-001,17572994790920000,2,0,渝北区石船镇人民政府,0,False
422,458812cc54f5486c8b3aea48b9aeb356,9ebba094a48443a39dd7e1421da8dfbb,480,刘伟零星工程项目,19690,德阳市永成机械厂,CONIN2600419,德阳市永成机械厂厨房燃气报警系统安装,out,draft,DYS2024-64,WBHTGL-20240409-003,17126440122110000,2,0,德阳市永成机械厂,0,False
423,458bc43921934a10a346081d630ea931,b7f07bc4b72c4cd29b5d1b445b499386,553,工程学院零星项目,19452,四川工程职业技术学院,CONIN2600420,升本迎检校园环境维修,out,draft,DYS2023-167,WBHTGL-20231117-001,17001825847290000,2,0,四川工程职业技术学院,0,False
424,45b58264ae904bcf9dac8704f9f3b6b6,ec8e6e03ff4c40cfb4ce25cdddc7474e,707,向东工程,26098,德阳市供水安装工程队,CONIN2600421,北街74号中国农业银行移表工程,out,draft,DYS2024-153,WBHTGL-20240923-002,17270564602320000,2,0,德阳市供水安装工程队,0,False
425,45e89b664f24417180ffc65b6f55a454,a2188cd16afa4137a6672d5b21995152,493,环壁南路（中山大道至蒋家河段）DN600管给水工程,26079,四川汉南供水有限公司,CONIN2600422,环壁南路（中山大道至蒋家河段）DN600管给水工程,out,draft,DYS2021-66,WBHTGL-20210813-001,1000000488,2,0,四川汉南供水有限公司,0,False
426,4600c0b59ea4489d988b2f3b1fda5414,9ebba094a48443a39dd7e1421da8dfbb,480,刘伟零星工程项目,19450,四川川交路桥有限责任公司桥梁分公司,CONIN2600423,四川川交路桥有限责任公司桥梁分公司德阳驻地厨房燃气报警及送排风联动系统安装工程,out,draft,DYS2023-81,WBHTGL-20230710-005,1000000968,2,0,四川川交路桥有限责任公司桥梁分公司,0,False
427,461a35652bde450f9f0d7010f5bf8080,b7f07bc4b72c4cd29b5d1b445b499386,553,工程学院零星项目,19452,四川工程职业技术学院,CONIN2600424,三教入口门口透水砖恢复,out,draft,DYS2023-03-08,WBHTGL-20230315-004,1000000896,2,0,四川工程职业技术学院,0,False
428,4640f2b1d1e74cf38fc631bf56914a82,ce7c47d08d88409da91cd433099d5cee,612,四川现代农业工程职业学院一期工程（10#教学楼、培训中心）,26075,四川山水美地农业投资有限公司,CONIN2600425,四川现代农业工程职业学院一期工程,out,draft,DYS2020-11,WBHTGL-20200506-001,1000000181,2,0,四川山水美地农业投资有限公司,0,False
429,466d6c7b55944bfbb8a11d91bcb8aaed,ddd9a94d8aef4059a1def554a737e0e4,658,剑阁县2019年交通专项扶贫村道窄路加宽工程（杨村镇柏梓村）,19387,剑阁县杨村镇人民政府,CONIN2600426,剑阁县2019年交通专项扶贫村道窄路加宽工程（杨村镇柏梓村）,out,draft,GYS2019-31,WBHTGL-20200229-015,1000000049,2,0,剑阁县杨村镇人民政府,0,False
430,4681f2b0526b49fe92d5b312326c6c3e,ec8e6e03ff4c40cfb4ce25cdddc7474e,707,向东工程,26098,德阳市供水安装工程队,CONIN2600427,华庭阳光十九栋直饮机分户工程,out,draft,DYS2024-28,WBHTGL-20240124-007,17060677282330000,2,0,德阳市供水安装工程队,0,False
431,46990604d99447e2ae56462a1a99363a,6b4e37cd90a94055a69de211efdab846,334,易静工程（德阳二重工程项目）,19460,四川新众建筑加固工程有限公司,CONIN2600428,铸锻公司铸造厂清理主厂房升级改造项目土建施工---建筑与装饰工程（除结构加固工作内容外）分包,out,draft,DYS2024-259,WBHTGL-20241224-001,17350230364910000,2,0,四川新众建筑加固工程有限公司,0,False
432,46b0e2e7698f4f569bff0fff0450d681,069cd56871fd4307b836a3167fddf14b,16,和田地区于田县高速公路10千伏线路迁改工程,19337,于田县住房和城乡建设局,CONIN2600429,和田地区于田县高速公路10千伏线路迁改工程,out,draft,XJQ2021-91,WBHTGL-20211224-001,1000000570,2,0,于田县住房和城乡建设局,0,False
433,46d753373afe4f5ab911b22588aee78f,6b4e37cd90a94055a69de211efdab846,334,易静工程（德阳二重工程项目）,26091,德阳二重新业建筑工程有限责任公司,CONIN2600430,模锻厂炉窑护栏制作安装项目,out,draft,DYS2023-191,WBHTGL-20231219-035,17029579358270000,2,0,德阳二重新业建筑工程有限责任公司,0,False
