id,legacy_project_id,project_code,name
222,46792322bab04858b17a5b9e3345cf5d,PRJ260222,广汉市连山镇农村集体经济融合发展示范项目——广汉市连山镇农产品展示展销中心（二期）劳务分包工程
223,4693df15d594434c95aa9a3304b3a058,PRJ260223,高坪区2020年中央财政高标准农田建设项目（老君东观片区）标段
224,46b7613b1b2c4a6e918815ee5b8e5969,PRJ260224,金阳县青松乡中坪村至白银厂村连接路工程
225,47134879c069447c8eb6730a33939c9c,PRJ260225,临空经济总部大楼A栋9层装修装饰工程
226,47450def75994d9899db7eef50f5c0f0,PRJ260226,渝北区双龙水库管理所2024年水库维修养护工程
227,4797240705544506a61fe48f4331e6dc,PRJ260227,四川省德阳市2012-2013年中小河流水文监测系统新建水文站-站房工程
228,47ed9576f8bb462c8d3092603084f690,PRJ260228,西藏军区工程建设项目临时器材库和装备库建设项目（2302项目）.
229,485a8ffc95b04691b30085b2d0207339,PRJ260229,生产线及生活区区防水工程
230,4860c86d34c74e858db90a3e7940327b,PRJ260230,德阳市旌阳区八角井镇卫生院-各类设施零星维护管理
231,4a4ed31a48164cee80671c16275f4ad7,PRJ260231,何埂小学新建综合楼、食堂及运动场工程
232,4ab6f7c219e2421fa998d1d575ee8496,PRJ260232,三标段旌湖路（秦岭山路至峨眉山南路）10kv下地改造工程
233,4ac61c70932e4dfa870ddf06ed5b36d2,PRJ260233,建工五建——科发泰升人和——装饰装修2专业分包
234,4ad2dea566464eba8851e0dd675d1583,PRJ260234,布拖县2016年—2019年安全住房地质隐患应急抢险项目
235,4ae5c8869c02493bb691c66b26fcba3b,PRJ260235,德阳新城吾悦广场商业及住宅整期建设工程维修工程
236,4b7a21220a1040129a798b604acdf5f1,PRJ260236,全国新增1000亿斤粮食生产能力安居区2018年田间工程建设项目二标段
237,4b868719ff8e43fbaf928e79f4aabf0c,PRJ260237,四川建筑职业技术学院西区运动场舞台工程
238,4b89ee16cc58497bac061d8ae5fddd82,PRJ260238,雅瑶东路教育设施建设项目（雅瑶东路小学）
239,4b8d30c6415f4768a994a73e75896668,PRJ260239,2024年中江县永兴镇七郎村集体经济扶持村项目
240,4bbff2852e8e46d38ceb8ed5b1c9de84,PRJ260240,旌阳区综合管廊项目庐山路段支护及防水3标
241,4c2a355dd42d488083fe81525363142f,PRJ260241,77561部队制供氧站用房新建项目
242,4c749e69caeb45ec9708bf4db81cde17,PRJ260242,罗江区2022年暴雨洪灾水毁灾后重建覆岸覆土工程-凯江段新增杂草、杂树清理施工劳务
243,4c93e1d422624fcf830d807d95e272a9,PRJ260243,青川县营盘乡永红村农村安全饮水
244,4cc5641ac4af46a4b021cf514887cf4b,PRJ260244,四川纹江致远建筑开发工程有限公司2025-2026年度管道临时封堵专业分包
245,4d1d59a3abc94504972df359e27af61f,PRJ260245,旌阳区综合管廊项目泰山路段支护及防水工程一标
246,4d5d46d841c24c629fd4ebdd4796980f,PRJ260246,大唐甘肃发电有限公司碧口水力发电厂碧口水电站右岸泄洪洞护坦防护结构改造施工
247,4daa72750bcc496aaebbf008fc28659c,PRJ260247,某部家属楼暖气更换项目
248,4dbaf1390e46481aaf4835b25933910a,PRJ260248,南货站库区9号安全哨空调线 管维修等7项维修
249,4de47622b3e6404a98ad734ddc53f27a,PRJ260249,西昌市市政建设工程管理处亮化材料（含安装）采购项目
250,4e69feaf5c854b54a44de07e4e94300c,PRJ260250,中国移动四川公司市州分公司2025年—2028年管理用房及生产枢纽楼公共区域零星维修项目的标包13 南充
251,4e9dbc2aa6534022b42a254295b52e34,PRJ260251,重庆市綦江区育英高级中学建设工程（一标段）
252,4ecb23acaad749acb971656d3f92322b,PRJ260252,仙足岛阜康医院前人行道改造项目
253,4ee72935ae304f56b051798722befec3,PRJ260253,江陵路快速化改造一期工程PB0+560-PB1+180庞北恢复及拆除残桥工程
254,4f039bfb37e049cf890e468d00178e45,PRJ260254,广汉市第二十三污水处理站新增五里村五组污水管网工程项目
255,4f2b6e3ed6db4e15bf7a475e00d8e73c,PRJ260255,2023年中江县普兴镇村社道路建设项目
256,4f86be86dc0f46508613c812126849d5,PRJ260256,保盛公司采购平台
257,4f8d48ca33fc442a8577308228eea07e,PRJ260257,大興壹號售楼部装修项目
258,4fc55dfb8a2e415cbcca4db2f9df2dbf,PRJ260258,重庆巴南区华南城充电站建设
259,5011e3673ec54e11a2e2a47a47ab34e1,PRJ260259,中铁十九局集团有限公司1415项目P、T 点位
260,5090c7dcbced4376817b6721cf5db568,PRJ260260,英吉沙县乡村两级锅炉改造项目第三标段
261,512df28c4b854d4aac32bb7f394b5275,PRJ260261,中江县联合镇中心学校群星分校新建运动场项目工程
262,513f713857db46e196f61d6df8257fd1,PRJ260262,四川金鑫公司职工家属区“三供一业”分离移交物业设施维修改造项目（东区）-防水工程
263,517794218ca44c1a8b95ea1a3b9ee01d,PRJ260263,四川省烟草公司宜宾市公司外租仓库维修项目
264,518c8c43a90f43558a535828b8be342d,PRJ260264,仁中风华二期工程
265,51f509199c434dd0a6f1f6f3dfced9d7,PRJ260265,中建七局天府大道北延线（德阳段）项目桥面防水工程
266,5216a7e00d554423bb2e77f6b7dd0d9c,PRJ260266,铜梁区永嘉镇2020年断头路、联网路建设圣水村八组、塘坪村十一组、十七组公路工程
267,52278e622558409db167eca9eba8c8b8,PRJ260267,【广州市花都区殡仪馆迁建工程施工总承包】项目【室外（园建、绿化、道路及护坡工程）】工程
268,523f3ae95af74fd187567b113e642c10,PRJ260268,苍溪县五龙镇三会园区房屋拆迁复垦工程
269,52dbcbcb460349ecac1ec682f9129b29,PRJ260269,德阳市旌阳区东湖-和新（崴和路）道路改建工程（K4+140-K4+790边坡滑坡治理）
270,530af800e78245f9a9975f80d9587ced,PRJ260270,罗江区滨河路沿线健康骑游道项目块料铺贴劳务分包（第五次）
271,531c46015cb843b1a330c71e092fef13,PRJ260271,智慧之心项目2#、3#、4#、5#楼及裙楼景观绿化工程专业分包项目
272,53647e839a2b4f8195342eef3dcc8264,PRJ260272,潼南支行东安分理处营业网点主体装修工程项目
273,5364878e0dc142c6b133d57c6eb09980,PRJ260273,新场乡长虹村灌溉蓄水池及防洪沟修建项目
274,53c2eb41efaf4f7189405125701e67b1,PRJ260274,中国移动四川公司广元分公司2021-2022年渠道维修采购项目框架协议
275,53d146fb74524859a820019e03d8a8dc,PRJ260275,伽师县工业园区空气源供热建设项目（二次）二标段
276,541e6dbb75224e48b0ab8c09c28c70ef,PRJ260276,重庆翰博光电工业园项目一期B部分（2#厂房）工程
277,5533cd035fea4b59ba91ebb3e16b6d5d,PRJ260277,露天破碎站地中衡工程
278,55804d7aa29f40c68fdfd12a6996d3e4,PRJ260278,青龙工业园区污水管网改造项目（第二期） 劳务分包
279,55a317a482484e6fb37f023de6f063e7,PRJ260279,凯州新城城乡一体化项目配套建设工程保温工程专业分包
280,560ae40a3f244039bc3e6944959d80f1,PRJ260280,恒荣半岛小区东舍北苑组团消防地下管网设施设备改造项目
281,56627cf2610e4345ba195ef14c1ddd17,PRJ260281,梧桐·骊府土方专业分包项目
282,56e3011796694d71baaf4bc868ce37c7,PRJ260282,广汉市旌江干线沥青混凝土路面维修工程
283,573f606161ae486ba27422b42781f1dc,PRJ260283,中江县御河中学校新建学生宿舍、附属工程及设备购置建设项目
284,5776e5836ee949b7a464ad53fb0000cb,PRJ260284,御嘉花苑1#楼 外墙外保温劳务项目
285,57925b24d00a47ddafa39631e8df9951,PRJ260285,【米易阳光里】项目【二】期景观园林工程
286,57bd7e81163b4800ad47fbe092c8d58f,PRJ260286,四川广汉火车站省粮食储备库和兴中心库建设项目（一期工程）
287,57dfa8223dae43c999c1d2e26650453f,PRJ260287,绵竹市高新区科技服务中心项目消防工程
288,59680a7bdc344036bf1bc659f9090814,PRJ260288,格尔木市2021年城市污水处理提质增效项目第二次
289,59a29f63bee94720b7e85f4d48b2c72e,PRJ260289,绵竹市城乡供水一体化项目(高柏、红旗)劳务、机械协作单位.
290,5a4ab1da8abf45089d9b6b24e07b1296,PRJ260290,中国民用航空飞行学院院本部雨污分流工程
291,5a6292b632ec46a0b55645e68028157c,PRJ260291,渭河路市场夜市市集项目
292,5b42b379257242539e27ddb3ff34fcfc,PRJ260292,御锦坊裙楼商业幕墙
293,5b60b4bec4114f6dbda0d2706c0fce0a,PRJ260293,白驿镇金凤村园区道路新建水泥混凝土路面工程
294,5b8510c8256946c29cde293937443344,PRJ260294,天台湖小区新增门卫室工程
295,5c44a17531ae4105bde23f05303bda78,PRJ260295,花园路街道古楼片区配套基础设施建设工程
296,5c4db999649c43aa91e9a94014abfbc5,PRJ260296,建筑工程实训基地室外改造提升
297,5cacc39424034ea09fa2bfe27057778e,PRJ260297,成都中铁二院商业运营管理有限公司2025-2027年度供应商集中招募
298,5ce3a10946434bf3bb1a79351d5de269,PRJ260298,广东西部沿海高速公路珠海段斗门收费站建设工程房建工程
299,5d3979512ead4bd8a20d8053164a516a,PRJ260299,富加镇河堰村、和桂村2017年易地扶贫搬迁基础设施建设项目
300,5ddc008baa11420ebb0485734c073a75,PRJ260300,中国电信泸州分公司2024-2026年房屋装修、维修服务项目
301,5de86b43f29448b9822ccef8c2c5edc5,PRJ260301,石柱县沿溪镇滨江社区居住环境改善工程
302,5e286add68254849ab587a81f407f401,PRJ260302,2021年德阳经开区旌东片区保障性安居工程城镇老旧小区改造一期土建、二期项目（四标段）
303,5eddae1dfcf446fb963edf1fd3925db3,PRJ260303,中国移动四川公司2018-2020年渠道零星维修项目
304,5ff6d476b782459db42c01e366ed73a7,PRJ260304,德阳市罗江区老旧小区改造项目四标段（二期）
305,600fa2546bb14411ab99b72fd892a64e,PRJ260305,国道219线22标K1221+200-K1239+705段水稳、透层、沥青混凝土面层工程
306,60a2b8f9977543a99d04daa5c8b78af9,PRJ260306,德阳市太行山路项目工程水稳层专业分包
307,615e67a1e771454bb8618d795c692760,PRJ260307,太行山路（钱塘江路-信江路）道路工程劳务分包
308,616ed34f2e0040da880cf3913cdf6700,PRJ260308,巴中恩阳临港产业园建设项目-制造业组团项目21-22号厂房消防工程
309,62b1d6342b754ae5bf6b344dc1be010e,PRJ260309,绵阳市粮食质量安全检验监测体系建设（第三次）项目
310,62dbc2a8200f45f88f8a8584141af871,PRJ260310,驻所武警营房安装防护栏杆工程
311,63151c4e794243ec8a52e85d9c0eb410,PRJ260311,中国移动四川公司成都分公司2023-2025年渠道维修采购项目
312,6379e48fed5748af876b694457c00a80,PRJ260312,广汉市城市更新城西片区城中村改造项目--配套道路路面工程专业分包
313,64127fa422624757bc12f7dae485c234,PRJ260313,幸福人家A区区域景观土建工程
314,64805c7a472d4136be2a82d9ec9a793f,PRJ260314,拉萨市柳梧新区公园水系污水渗漏改造
315,64e0706eed044170b60295774f2fb924,PRJ260315,梦溪苑商住项目外墙保温装饰一体板制作安装分包工程
316,64f83d6cd91a459c9609c48a8e98889d,PRJ260316,国盛莲花湖（1号地块）5.7.8.9.10#楼公共区域室内精装修工程
317,65261c6899f64e658c76735183a388a4,PRJ260317,年产55万吨牛卡及瓦楞纸项目配套废纸制浆车间、上料间、碎浆间、渣处理间工程第三方外协
318,65b2b2e4f19143b2b42e4c6f1da469a9,PRJ260318,德阳九源燃气工程有限公司德阳市旌阳区老旧小区改造安全隐患治理中土方工程施工单位（第二批）
319,65e7a3336fe04151962cc866422cd5fa,PRJ260319,中国电信股份有限公司成都分公司2024年大邑县城区电信大楼外墙景观照明项目
320,6685fcb7a6614a0d89558d44653aec8c,PRJ260320,忠县涂井乡龙滩村农村移民安置区精准扶贫项目.
321,66b66086a7144848ba8194ce7db8f101,PRJ260321,中国移动四川分公司乐山片区2018-2020年渠道零星维修项目（标包5）
322,66bc67e86f8e4f4c88186af4a70104fd,PRJ260322,PET-CT安装工程
323,66efda2bb2b54b13965122fd2bb35618,PRJ260323,绿地健康谷二号地块1标段项目泡沫混凝土工程
324,6801dfe526d14ac1963bdb600ace2a79,PRJ260324,""" 四川省德阳市2012-2013年中小河流水文监测系统新建水文站 -站房工程（第二次） """
325,682991317e43497dbb4119f9990fe0ce,PRJ260325,巴中恩阳临港产业园建设项目-制造业组团项目 21、22 号厂房防水保温工程
326,6890dd7cde4446059d33a86af5e8ec7a,PRJ260326,西藏方向军事设施建设项目EPC工程总承包合同12项目LBYQ-室外强弱电工程施工劳务分包合同
327,68d2896f3eaf4682b902117d4dcda350,PRJ260327,环壁北路（环壁南路至马牧河段）DN500管给水安装工程项目
328,6a00ac86acbb4ac1a7474b917f5f5bf6,PRJ260328,石船镇农村公路护栏修复工程
329,6a159518e9b143cab983f8ee74c3a3b2,PRJ260329,沥青混凝土路面专业分包施工合同
330,6a6b66ef5cc244359a6389425cf4393b,PRJ260330,渝北区石船镇龙胆路石船段公交站新建工程
331,6a9c137ef7a44d6bb67efff0dfa2dca8,PRJ260331,国有企业职工家属区“三供一业”分离移交改造项目物业管理部分-沁苑小区工程
332,6afb33672c394b2984b82f859550575b,PRJ260332,翡翠湾售楼部改造工程
333,6b15fd3e78694585bba77c73601b3ccb,PRJ260333,朝天区沙河镇元西村农村公路面硬化工程
334,6b46b842c0d344a08dd79ae5ba83628a,PRJ260334,马踏洞安置房停车场相关基础设施项目
335,6b4e37cd90a94055a69de211efdab846,PRJ260335,易静工程（德阳二重工程项目）
336,6c8b94d81edc4bb7aef0c3c0f58e3b2a,PRJ260336,结古、囊谦、治多路政大队和共和塔拉滩超限站配置发电机以及电路改造项目
337,6e315aeb124b4afaac4c79345f3971dc,PRJ260337,德阳市第一小学校通风换气设备采购及配套用电设施改造项目
338,6ee79af1274b49ffbd25926ad5f04f4d,PRJ260338,中国移动四川公司成都分公司2021-2025年管理用房及生产枢纽楼公共区域维修服务项目-上市
339,6f39bd9ada194b63828edcb0f846c184,PRJ260339,南平智能环保产业孵化中心监控设施及道闸安装工程
340,6f5cacd6245346079d3cbc0f0dd078de,PRJ260340,建筑门窗、幕墙工程施工图深化设计项目
341,6f87b6f5c70744a0ad50b5bf87b32abb,PRJ260341,丰都县峡南溪片区兴都公园大道西环线(K1+300—K2+611.409) 段市政道路工程
342,70207ec218f04345ac987514a121c9ad,PRJ260342,巴中临港产业园项目13#-16#楼标准厂房室内消防（BZS2022-73）
343,702cd4f80b7c4180afc3a5730e29625f,PRJ260343,荣昌区盘龙镇黄桷滩水库库区集体经济产业基础设施配套
344,703168b02c414c4fa219307367d2fd54,PRJ260344,2023年南岸区城市桥隧设施病害整治工程
345,708f939840de45d7b68fc07e9200d912,PRJ260345,合川分行沙溪分理处营业网点主体装修工程
346,71158c73ca8e43bc9d7a0848181fdaaf,PRJ260346,四川省玻纤集团有限公司屋面维修工程
347,71387d99afc94f92aa22e36cb068524d,PRJ260347,罗江县2018年水利发展资金高效节水灌溉项目
348,71aafee1c1074febb2f69baf9ac964e3,PRJ260348,渝北区龙泉水库大坝公路两侧人行便道扶助工程施工
349,71b02926f98b416c8d27220566c4195c,PRJ260349,绵阳市安州区公办学校空调电力改造安装工程(桑枣小学)
350,725351f017384485b35a2a9297a4739d,PRJ260350,雅安市雨城区生活垃圾资源化利用项目劳务班组采购项目包件2钢结构
351,7389350ed3904d4895d3a918fc3caad2,PRJ260351,德阳市旌阳区东山社区卫生服务中心基层防治能力提升项目
352,73b8da91cfe945d0bf6ba8babbeee779,PRJ260352,什邡市方亭街道老旧小区改造项目六标段
353,7454e9d853394d9991f8bf3b110b2e2a,PRJ260353,四川省德阳市罗江区2019年元宝山片区高标准农田建设项目（一标段）
354,7478e2bb9d1d401dabd67d1aae8e0d03,PRJ260354,荣昌猪核心区建设基地(SPF猪生产示范场项目)二期
355,74a80ab7582e4672815771b3b2c10fbe,PRJ260355,2025年西南石油工程公司钻前辅助工程劳务框架招标（9标段：中江、孝泉等地区）项目
356,74d58dce00e345c3af7cbdc58dc2bbbc,PRJ260356,中国移动四川分公司德阳片区2018-2020年渠道零星维修项目（标包14）
357,7502f0c9996a4e0893330ccf0d85661c,PRJ260357,旌阳区城市地下综合管廊建设项目庐山路段中控室装饰装修工程专业分包
358,765cd5c4cb9a494187d25185290c4027,PRJ260358,洪安镇土门村杂柑基地改造提升项目
359,769e23c09ba3423797b9306dd3a44b0c,PRJ260359,喜德县2018年第二批农村公路工程尼波镇打尔村-甘洛村水泥路改建工程
360,76d2c1e0fcf841bbae0d2d7e3ece029a,PRJ260360,白鹤花园棚户区改造项目一期工程
361,773f4494b4f54667ae4bac516f591fde,PRJ260361,德阳市行政综合办公楼（老政务中心）屋面防水改造工程
362,777eb3f422ea4384851c2e11090623ac,PRJ260362,区级机关综合办公大楼车库地坪整治项目
363,77a04024304d44bcae389f681f68f0c9,PRJ260363,广汉市南兴镇农业综合开发高标准农田建设项目
364,77a9757e6b0a4bbe94563dc71d5f12c9,PRJ260364,23号油库立式油罐防腐处理及改造合同
365,77f6ddc2d277451f922b7c5177530dde,PRJ260365,违法建（构）筑物拆除工程施工协议2021-2024
366,7804bf2a4b6e4d258d501945273868c0,PRJ260366,53019工程、3644-3、4、3617总坪安装工程
367,782bebc32a78434cb3c72045d0771fda,PRJ260367,旌阳印象森林餐厅零星维修工程
368,784c455d3cfe45cf9b7dfdf3d752e81a,PRJ260368,龙岗001-20井气田水回注土建工程
369,786f45af49be4b29b4a1ad2717804e0d,PRJ260369,德缆公司-能源装备及轨道交通用电缆数字化车间建设项目提升机房雨棚建设工程-雨棚建设
370,79023537dbb240b0ae976797542cf3f9,PRJ260370,广汉市金轮镇铁塔路维修工程项目
371,791aca08955c42f088311447b7b70e38,PRJ260371,广汉市文化体育中心室外篮球场维修项目
372,7967194e66c2442390f25050c5a859d7,PRJ260372,石鸡水电站尾水区右岸挡墙加固处理
373,79b8d5fbe3b14dfb8c9cb4065cf4e814,PRJ260373,牡丹北苑修建建筑垃圾池
374,79c4128054be48bcb8377af16faba3fd,PRJ260374,旌城印象更换单元门
375,79db41967bf84a6c98eca2e5fb490b56,PRJ260375,德阳市旌阳区乡镇通组道路工程(双东镇)
376,7a9e747d055946fe91da93e794819a4e,PRJ260376,阿坝-成都东线路工程14标
377,7ac0d75f530f4ecbb8d2f4169d9c0af8,PRJ260377,S206线K3+440-K4+040段改建工程施工全一标段
378,7ae92d3ae6a34881b96e7aa1aaa53e87,PRJ260378,城南壹号3区·央堂（一期）专业分包包2安装工程
379,7c38d18f4d2e4ab6818f9527e46cce15,PRJ260379,四川司法产教融合实训基地二期项目（运动场及附属设施）土石方工程
380,7c468620d025454db6eb932a5a5562fa,PRJ260380,阿合奇县劳保局棚户区（城市危旧房屋）改造项目（一标段）防水专业分包工程
381,7c5bb2cf30bf470a93d959b223c7fb15,PRJ260381,盘龙镇大建果园路改建工程
382,7cc55a8369d148a28e41f470b8f982af,PRJ260382,国宾府售楼部、样板间室内精装修工程
383,7ccb740801cf4ffba45d3e4990d51a47,PRJ260383,东水门大桥、朝天门大桥（南北）公园、停车场、电梯等新增附属设施工程
384,7dc77eabfb054d6f8d70ca8a9825938d,PRJ260384,银鑫五洲广场二期 1#楼 A、D 座楼栋间交界处防水施工
385,7ece2d06323c438d89c1a89c7a3a134f,PRJ260385,米易县高铁站前广场环境整治项目
386,7f207699fff8424980ab795089a8a9f4,PRJ260386,塔什库尔干县达布达尔乡农业灌溉管道建设项目
387,7f29aa1fea1745cf8868ec7db11261f2,PRJ260387,高地库房
388,7fa2733fb3d34cc6a7870d625504a391,PRJ260388,宁南县骑骡沟镇曹家营、董家龙潭饮用水源地保护工程施工合同
389,7fa5e23b3bfa44e184eeaf9f6aa891c0,PRJ260389,水韵江南10栋维修
390,7fa974d0bc674fb48bd98beaad6825ab,PRJ260390,测试3.0名称123
391,7fd8ea3e59b7430fa97844b5fde512e4,PRJ260391,西昌市西部城区A2-04地块房地产开发项目项目消防、智能化、暖通预留预埋部分安装专业分包
392,800fb4620f6f4afca71708d0da82500f,PRJ260392,实验幼儿园卫生间及功能室维修工程
393,8021c0268aac4ab0adbded0135329637,PRJ260393,四川保盛贵州茅台酒采购平台
394,8023626ac42a4b898b22735e281c8608,PRJ260394,渭河路（庐山北路至秦岭山北路）道路改造工程道路水稳层材料供应和施工项目
395,80ccba31ed86452683ada4a39f2027bd,PRJ260395,驻渝某单位废油罐拆装工程（第三次）
396,816c71305aa94216886d5a43d371eb0f,PRJ260396,国网四川省电力公司家属区物业改造二标段项目
397,81925fb85f68450d9108e75665063f94,PRJ260397,米易中心城一二期架空层及入户大堂软装采购工程
398,81d3115930624b97aedc862be17f8d7e,PRJ260398,布拖县拉达乡现代设施蔬菜产业融合示范园附属工程
399,81f1c11cde6e4db0bc782b1aaf07f75d,PRJ260399,德阳市供水安装工程队非招标项目施工劳务分包备选合同
400,820b75e8bc1d44b199a52ffe48f1c350,PRJ260400,蓬溪县苇子湾水库除险加固工程
401,8210d117e0d14137b74221d251aba7a9,PRJ260401,全国新增1000亿斤粮食生产能力射洪县2018年田间工程建设项目二标段
402,82b352940a4446beaec40efdcd1f0c34,PRJ260402,潼南支行东安分理处营业网点主体装修工程项目
403,82f853994a7f4e8e9e602dda3f89691f,PRJ260403,郫都区安德街道崇德沟黑臭水体整治项目
404,8340e78b40b54a178e8020ff2cb67fe3,PRJ260404,德阳市旌江线城市路灯及绿化工程(八角路口交通改善)项目
405,837f285f234d42b6b60e717ea8e7390b,PRJ260405,乔庄镇茶树村排水沟整治
406,8394414a2c9548ff91c728854b0f972d,PRJ260406,北新国际冷链商贸物流项目E地块E3#-1、E4#-1综合项目
407,83bc85cab5f64cbe91486de3d1d46045,PRJ260407,华系田园猪”生产技术集成示范与应用项目——2024年华系田园猪舍采购(包1：应用示范一)
408,83e7238256b547f2a986adb2e2599541,PRJ260408,某部食堂维修整治工程
409,84294b0ce2fa49f493c40ed4d2676b79,PRJ260409,2018年乐山城域传送网汇聚机房建设工程
410,842ab5bb919d45ca9f23040dc3e34050,PRJ260410,绵阳市安州区2025年制种大县项目-生产基地设施建设工程
411,84523f6e180f4f519bb0b1e60b6922c6,PRJ260411,国有企业职工家属区“三供一业”分离移交改造项目供水部分
412,84c69a9362964c71924c359adc4efb67,PRJ260412,中建四局-杜秀佳项目
413,84e432dea3ad41d09fb63c0470de73b3,PRJ260413,围墙亮化及环境改造项目
414,84e981fdde7d4cbbb060120806e08159,PRJ260414,信达国际车库伸缩缝漏水维修工程项目
415,8501f263d1874d7ea4206eea6387184f,PRJ260415,中国移动四川公司乐山分公司2025-2026年渠道维修采购项目
416,855160338f1e45cfbc0d0c34ed169a79,PRJ260416,绵土路九龙里至武新路路面和桥梁工程
417,8565db0386b842f0932560eb0780e129,PRJ260417,智慧之心项目5#泡沫混凝土工程
418,85866c001d2e4b029b09516966968acc,PRJ260418,中江县2016年抗旱应急水源工程
419,85a310ee93c644e7afb8d61dade74000,PRJ260419,大英县城西片区棚户区改造城中村项目（三期）一标段建设项目、郪江北安置房建设项目、盐华小学校建设EPC项目
420,85a4017a9c604e0391500307328339fb,PRJ260420,成绵TJ4项目部驻地房屋恢复装修工程
421,876f32f8b96d4bb192f628a4cb4d0b49,PRJ260421,征拆服务中心办公用房装修工程
422,87f7752054484eb9988c3714e39102ad,PRJ260422,三星堆旅游环线工业游基地基础设施改造项目（一期）设计施工总承包项目
423,88dc03d2639144e2a513a82c2ebec878,PRJ260423,成都市青羊区文庙后街雨水管网管道清淤及更换维修改造工程
424,88e26d8ae253462cbcfc30e462f2da7f,PRJ260424,广汉金鱼镇凉水村管网延伸工程
425,890be7b5d630451fa7183f49d5d7b7e2,PRJ260425,四川省烟草公司内江市公司土建、安装、装饰施工供应商采购项目
426,8929f6ba520a4e24813d0adb7e6479e7,PRJ260426,绵阳高新医院（肺病医院）建设项目之办公室装饰装修分包合同
427,896c436fa83944339095020270c16178,PRJ260427,旌南小区消防蓄水池防水防漏维修工程施工合同
428,89839027a8fe4876a6f7edd4a103ec2e,PRJ260428,北温泉街道状元府第照度提升工程
429,8a17b9ff95fc42b696dc7c91938904dc,PRJ260429,绵阳市公安局高新技术产业开发区分局磨家派出所改造工程
430,8a37f6f69a15444d97084d605610d841,PRJ260430,长虹技佳重庆分公司彩钢棚搭建项目
431,8a57f2823a644db09f6c915d4942f9d5,PRJ260431,泰安综合楼屋面改造工程
432,8a72b33293404bebab3141c623e6ecca,PRJ260432,濛阳河路（泰山路-蓥华山路）市政道路工程劳务分包
433,8ab29cb255744a2d8b8369c642ee6fe6,PRJ260433,常宜高速公路CY-CZ1标梁场生产区建设项目
434,8ad18cbf8fa3437e896a05658738a32e,PRJ260434,四川致远锂业有限公司氯化锂车间地基加固工程
435,8b32e4c1d62849e59c6a9596571b5dcd,PRJ260435,中国移动四川公司天府新区分公司2020-2022年渠道维修采购项目
436,8b702fa4ccca4b3b98261a07cbde8ae7,PRJ260436,新华水库放水闸阀整治工程
437,8c344596cdd444249482d76da3b86016,PRJ260437,渭河路邻里中心2-2-1、2-2-2铺位装修
438,8c4d70aba64643968392105d93c77f4b,PRJ260438,重庆2025年度零星维修服务项目
439,8c9c5aa21f3a444caad16458f3100d00,PRJ260439,新疆维吾尔自治区喀什地区大数据局电力机房维修维护项目
440,8d6e8dafbdb44480b46396d6e058b208,PRJ260440,张家河洪安镇三村村10组和大同村11组护坡整治工程
441,8dff413b6fb14d6387ccbf6904b861fc,PRJ260441,违法建（构）筑物拆除工程
442,8e1e8ffb0e244123a5f5b269a540fb17,PRJ260442,珠峰文化旅游创意产业园区基础设施建设项目一期工程第一标段、二标段
443,8eab805030f6469fb6138c53b388ad26,PRJ260443,德阳市旌阳区涪江路小学校校舍维修工程
444,8ef8a9d9c4884fca98f054365e1789ba,PRJ260444,德阳市罗江区救助管理站新建救助接待大厅新项目
445,8f5413ca3b9648668a00f54f9fee5b5b,PRJ260445,蓬莱镇城乡一体化建设项目四标段项目模板脚手架专业分包
446,8f874aff67254dde80a7b2a2c63ba91e,PRJ260446,800MM冷却区整改
