id,legacy_project_id,project_code,name
670,e106501cc7184d8e8b8b08871e03e5dc,PRJ260670,金元镇江关咀村2019年社道路建设项目
671,e1391ec880fb40b79668111da2f78540,PRJ260671,国网新疆喀什供电公司110kV叶果线杆塔提升隐患治理大修等13项工程
672,e1603619f0814d02b4c86bc5c044ea0b,PRJ260672,巴中恩阳临港产业园项目-制造业组团项目1-8号厂房、13号厂房、16号厂房防水保温工程
673,e198e1afc1324069844bfe3a310cfe91,PRJ260673,誉城国际一期二批次
674,e207665460d740a8a140020004c3cd22,PRJ260674,中国移动四川公司2025-2027年全省汇聚机房土建工程施工集中采购项目
675,e237f61a7cf6461fa360da20307d6522,PRJ260675,朝天区花石乡以工代赈脱贫攻坚项目工程
676,e27eae2a90224ae1a7a6025b4dded66d,PRJ260676,龙江大酒店装修改造项目
677,e292fb92ad184e6d8715c99a89bd2beb,PRJ260677,信达国际A栋1、2、3号电梯，D栋1、2号电梯井土建改造工程
678,e2edc267b1b24c8ebc8ab5ab2aabd399,PRJ260678,松垭商业城保障性住房提升改造项目--装修施工项目
679,e3b0f12a3e2448fa89e070f0272f74d0,PRJ260679,青白江综合办公楼土石方工程
680,e3d42a6ff2044fe2bf8b60af246de053,PRJ260680,贾家工业园区办公点装修工程
681,e4bccb1e4815421ba8c8778fc30f6077,PRJ260681,四川金鑫公司职工家属区“三供一业”分离移交物业设施维修改造项目（南区）
682,e4c9309b78f847dba4a007a04cc6128a,PRJ260682,智慧之心项目2#楼及2#楼裙楼泡沫混凝土工程
683,e4cdcff7175147c4aec010329f08f217,PRJ260683,林芝区域办事处办公用房装修工程施工专业分包
684,e50c5b8828a74dd5b84ea854d2256ab9,PRJ260684,重庆机场护宾楼二层办公室改造项目
685,e5c64d4f13ba477191da0b3e3bd12236,PRJ260685,德阳市经开区再生资源利用园区基础设施项目九标段项目市政安装工程
686,e5d7653bc34a45649a7083c79912cf8e,PRJ260686,德阳站综合交通枢纽改造项目（德阳站、S11 线连通工程等 4 个子项）漓江一、二西路特殊地基处理工程
687,e5e8bd5755cb4d20a7c0686a8e13be6e,PRJ260687,朝天区三滩村至龙门等道路工程-潜溪路一段
688,e6b323e651a7407e9ee9191cfbe285a4,PRJ260688,沸水小学空调电力改造安装工程
689,e712d2cd1f10406abfd3f4857656495d,PRJ260689,西南大数据创新应用中心项目-深潜土石方工程
690,e7d967ab98084a1bb1efdb2e0cd7674c,PRJ260690,杨永田项目
691,e7df166996ed40c5abbb0c97cd6cd86d,PRJ260691,绵阳市游仙区盐泉镇道碑观索桥危桥改造工程项目
692,e8882f317dfd4b8197a28571795b4200,PRJ260692,绵竹市城乡供水一体化项目(高柏、红旗)劳务、机械协作单位
693,e8a559bf5ba24de8b25213c1b7be2a78,PRJ260693,东莞市长安镇莞港跨境货物运输接驳点工程
694,e8f89b108b8e4e46b84c1d3a60233d10,PRJ260694,南川区石溪镇2024年农村公路（学校至王官果业（主干道至家禽屠宰场）、灯草湾至枫香榜）建设项目
695,e91ab58b0d264ccaba5f9356ad85ae44,PRJ260695,西部(重庆)科学城保障性住房(一期)室外 综合管网、景观、绿化、围墙、精装修及 标识标牌系统工程
696,e924a06df23947afb4218e1c38b3cfe8,PRJ260696,花荄镇兴福村草溪河石拱桥维修加固工程
697,e9ef3126e9594e518a5e518047574439,PRJ260697,中江县小型汽车驾驶人考场建设项目
698,e9f5e654b3e249c3b4fd1600dcb58c63,PRJ260698,德阳市中心城区照明改造工程-10KV配电工程
699,e9f8e5da180a4ac59191def6a721a33c,PRJ260699,四川建筑职业技术学院德阳校区垃圾压缩站项目（第二次）
700,ea0e76e15df1488590e9ed4a1e25fee1,PRJ260700,大足区2022年宝兴镇等（2）个镇丘陵山区高标准农田改造提升示范工程试点项目
701,ea7b223b560a4d998f5fc6f14cb2bd3c,PRJ260701,城西片区青衣江路西段道路五段
702,eaec532f7b9b47a4bf4c0c2989290a70,PRJ260702,中国农业发展银行什邡市支行雨、污管道改造项目
703,eb14bf937d704385be6d6c968b71bac5,PRJ260703,万润苑改造项目
704,eb4cf9d9b714420e89a3c2a6fff6f8d5,PRJ260704,德阳市旌阳区医养结合中心及精神病院区建设项目
705,ec3d1ca099cc49fb82659e6f12c3fef4,PRJ260705,剑阁县秀钟乡太清村2017年农村饮水安全巩固提升项目工程
706,ec3ec41ba43448d5b51353272d63d4aa,PRJ260706,宜宾机场航站区配套工程公安设备工程
707,ec6c84495a4448b6ba0356b8bfd95b3d,PRJ260707,德阳市主城区园林绿化及市政设施提档升级项目（庐山路及长江路示范段）
708,ec8e6e03ff4c40cfb4ce25cdddc7474e,PRJ260708,向东工程
709,ecd2fbc747a541cca5ec8572052e2451,PRJ260709,苍溪县五龙镇城乡建设用地增减挂钩项目
710,ed56c6b210964e16806002ca33cee644,PRJ260710,深圳市捷顺科技实业股份有限公司年度外包合同
711,ed83a5f4dfe24e3c92d5ece83267f800,PRJ260711,城口县明通镇中心小学改扩建及幼儿园建设项目
712,edd87052c5a044328e248bb6b8168598,PRJ260712,德阳保利国际城中央花园A区二标段土建及水电安装总承包工程
713,ee4dbf78773b4fe2a43fdf283635ef4d,PRJ260713,二重厂西路（华山路-衡山路）市政道路工程、衡山路（二重厂西路-韩江路）市政道路工程、琴江路、武江路（华山路-规划路）市政道路工程 沥青路面、水稳基层专业分包
714,ee58e169dc56474284f6bb85b6e0d51f,PRJ260714,经开区应急周转房项目（2#）工程
715,ef18f8708c5b493d841efc8c3f3c9fe9,PRJ260715,广清城际轨道交通项目（花都段）安置区工程(狮岭镇前进安置区) 一期施工总承包项目（市政园林工程施工）专业分包合同
716,ef4ade9de4e74f63bf72ccb6786c604a,PRJ260716,2024-2025年度成都所区零星工程框架协议
717,efedf2ee02f84c20bee514662834df29,PRJ260717,河黄路种子加工中心至双佳养殖场、罗绵路至种子加工中心、制种基地展示中心至种子加工中心、罗绵路至彩色油路沥青混凝土路面摊铺
718,effd5e093a8a4663926b94a97696abf6,PRJ260718,德阳市罗江区综合行政执法局2024年罗江区零星市政维修工程（苍海D区、潺亭中学旁等7座公厕维修改造）
719,f0548e3dd1ea48b39a60d52766f1c466,PRJ260719,德阳经济技术开发区产城融合示范园区基础设施建设 旌湖路 、 太湖路道路改造工程
720,f0746ee8f26b4368875b92ca0b10b241,PRJ260720,前油库卸油平台防腐处理及卸油系统改造项目
721,f076f5c267084d478373fc91f1157091,PRJ260721,模锻厂45MN泵站降温改造
722,f0d13d9a3be74f30a0c7389e034d1496,PRJ260722,德阳市罗江区调元镇顺河村农村生活污水治理建设项目
723,f0d85ad0105443808f71c033f53a85c2,PRJ260723,中国移动四川公司南充分公司2021-2022年渠道维修采购项目框架协议
724,f0efe9aa0fc946c7aadaad11ed6105bd,PRJ260724,四川致远锂业有限公司一号窑收尘器基础工程
725,f12172c47e6b4a4285f6fdfc780b24d3,PRJ260725,重庆市璧山区璧城街道老旧小区改造建设项目（东关社区）
726,f12a441ef7dc4acba80bdce8a6b1b6e3,PRJ260726,德阳站综合交通枢纽改造项目（旌阳区长江流域可持续发展（沱江上游-绵远河段）综合治理项目-河西段）工程
727,f1b18dce54fc409eafce2b38cf431fe1,PRJ260727,中国人民解放军 32167 部队66 号楼整修项目
728,f317a95150bd4989a3a673a4796c3c9c,PRJ260728,中江实验中学新建教学及辅助用房和附属工程（一期）
729,f38cc5d7d0ac4c758b7547effc62c97a,PRJ260729,苍溪县歧坪镇爱国村等11个村城乡建设用地增减挂钩项目
730,f3d8f9c8218e49a89d660257c4cf9dca,PRJ260730,绵阳高新区普明街道古泉社区居民委员会普明街道古泉社区农业灌溉水利设施整治提升项目
731,f421214fc99b4c4fb133e82c9acfb9b9,PRJ260731,管网安装抢修零星土石方开挖恢复及用工等年度外包项目（1年）
732,f566b87da9024087a8da380d976a5554,PRJ260732,河黄路种子加工中心至双佳养殖场、罗绵路至种子加工中心、制种基地展示中心至种子加工中心、罗绵路至彩色油路沥青摊铺项目
733,f63676e5d4b844eaaecbe42cc2218d75,PRJ260733,德阳高新区万福棚户区改造工程一期一标段“8.11”特大暴雨灾后修复工程
734,f680bdc8b1ae4a6a84fe7066f7b8056c,PRJ260734,A项目-建筑幕墙专业分包
735,f6db642585394c49a6278eb0eed3119a,PRJ260735,柳梧新区雨污水管网及防洪渠维保服务采购项目一标段
736,f73c2f32e28d4180a093122ef1129461,PRJ260736,柳梧新区地下雨水管网清理项目
737,f772a3bb0b27467eaf46a8b7e13155c9,PRJ260737,全民健身活动中心五人制足球场实施维修改造项目
738,f77d5a1eff67405982b3178110ab35b6,PRJ260738,盾构机制造、总装调试及再制造项目区域工程厂房钢结构专业分包施工程
739,f818ed35825945368619a8ed681101dc,PRJ260739,齐家堰水生态保护修复项目
740,f83ec03b24d24fec8c8fb9cfadb304f7,PRJ260740,重庆市沙坪坝区土主街道桐子林黄金湾C1栋 二层
741,f947d45769804682af3a6233ff0b5d0d,PRJ260741,中国移动四川分公司巴中分公司2021-2022渠道维修采购项目框架协议
742,fa54a849d16840faa4991732709c30b6,PRJ260742,德阳市旌北13、14#地块（德阳北站TOD及基础设施配套项目）项目示范区园林景观工程专业分包
743,fa81dfa136ae42009e8d1d86af0bd1e2,PRJ260743,德阳市罗江区一根松应急抢险工程
744,faa210f1d28440a8b24e787a2db4e1d8,PRJ260744,塔什库尔干县塔什库尔干乡托格伦夏村村容村貌整治提升项目
745,fafad4e03da24e98b7f8cf26706127b8,PRJ260745,中国移动四川分公司天府新区2018-2020年渠道零星维修项目（标包4）
746,fb0c4133-f011-44a4-a285-59cfd30aec27,PRJ260746,公司综合平台
747,fb6de3927cc44f4497c986be12ecd05f,PRJ260747,中国移动四川公司市州分公司2025年—2028年管理用房及生产枢纽楼公共区域零星维修项目的标包1 成都
748,fbbe809ac1994bf9a245f59229553730,PRJ260748,四川建筑职业技术学院成都校区迁建工程（二期）室内外消防工程
749,fd55ff03dc53471a90744a6e145fbba7,PRJ260749,新能源电气控制系统研发制造中心项目
750,fdeb2bb017b94856850715fb5f1ec2c0,PRJ260750,射洪县金鹤乡白店村、长房村、大榆镇松林村等3个高标准基本农田建设项目
751,fe69283d9c29498bab1083b9a12cce88,PRJ260751,2025年西南石油工程公司钻前辅助工程劳务框架招标（7标段：成都、绵阳等地区）项目
752,febf7841fc634ae09dfed83a425979a4,PRJ260752,成青路（S105）、河黄路、子汉路路面维修工程
753,fee87af934dd4759852f0af8b05b6022,PRJ260753,石灵社区杂物室、防腐木扶手等零星项目
754,ff1cd896b4c94a229a243a8228fa9816,PRJ260754,修剪田坝村、中南村、西铁村社区老旧小区存量违法建筑周边树木
755,ff88aca287f94ee09bcc0a53649e5c0f,PRJ260755,广清城际轨道交通项目（花都段）安置区工程（秀 全街乐同安置区）一期施工总承包项目 【园林园建】工程专业分包
756,ff9ee430d28a4fb2b4279a6e9634c247,PRJ260756,绵阳市游仙区魏城镇竹柳村（原柳塔村二组）通组路建设工程项目
