id,legacy_project_id,project_code,name
447,8fdbef4293604b95a0e2d7a44d5a8b80,PRJ260447,40万吨高强包装纸扩建项目余土/渣土外运专业分包工程
448,90199c09b08c49fabf8a8d70e620b9f1,PRJ260448,易初明通公司拉萨分公司装修及厂区改造项目
449,90e7b8156a46435ba1b1c39b30479fd0,PRJ260449,德阳市罗江区乡村水务供水建设项目钢筋、模板、混凝土、管道及阀门安装劳务分包二标段
450,910ed968bceb422f9ce302e2799da9b8,PRJ260450,西藏方向军事设施建设项目施工总承包合同90项目工程工序劳务作业
451,918683f439b8487cadb404658ab90785,PRJ260451,中国移动四川公司市州分公司2025年—2028年管理用房及生产枢纽楼公共区域零星维修项目的标包7 泸州
452,92308c59fc714d39a2d5cc45e483c1f0,PRJ260452,铜梁区太平镇团碾村十七组（CU69）公路工程
453,93cc6b74baa344f3bc26a971682f88bb,PRJ260453,德阳市市区背街小巷风貌整治工程（施工二标段）
454,93eb0c58a37649418efd2b28f0757c80,PRJ260454,长安汽车全球培训中心改造工程施工服务
455,93f06cd7b4224d759b02bd71317c00d9,PRJ260455,2025年中石化西南石油工程公司钻前辅助工程劳务项目（1-8标段）
456,94c6a77e5b8e4eaea55e16a4ee4bb604,PRJ260456,峨边彝族自治县人工智能实践基地建设项目
457,94e3c6b241b94290aee703a35bacf5cd,PRJ260457,荣昌区仁义中学校舍建设项目
458,94e5c244917144bdbfcbe8bb2e1d45ec,PRJ260458,伽师县工业园区空气源供热建设项目（二次）
459,95046cba907f454e912ac49de532fcc7,PRJ260459,德阳校区日常维修服务
460,952e810223ff4a18aac271de72d232af,PRJ260460,国网新疆喀什岳普湖县供电公司城区供电所项目
461,95e6ded075be48a9950e0e9f5411ac30,PRJ260461,银鑫·五洲广场A地块漏水维修工程
462,9679632240d74ff9bd55e0c7b26a0d07,PRJ260462,德阳市龙泉山北路（泾河路-青衣江路）更换井座盖
463,96af7424fa7747b48aae24ab669caa3e,PRJ260463,旌兴·和悦雲岸1#-11#楼项目公区精装修工程专业分包
464,973001fda0d442faa9516db4ace99a73,PRJ260464,玛瑙村易地扶贫搬迁堡坎及边坡支护工程
465,975c978ebf34482ab92912e0e4825d58,PRJ260465,阳市罗江区秀水河2020年水毁修复工程（劳务）一标段项目、二标段
466,976f7632cefe4535a53f8a239d5fb1c2,PRJ260466,东林智慧学校停车场工程建设项目
467,98af7d7c7a6247bfa410c4e081af4469,PRJ260467,四川广元昭化中国食品产业发展重点园区（工业园区泉坝台阶地）项目场平、道路工程施工
468,99859d05ebee43d98f4b947a62aaccab,PRJ260468,中核城建德阿项目(EPC)工程27#地块钢结构厂房屋面光伏安装施工专业分包
469,9997cf42719c4991a9ef015c49e0a94c,PRJ260469,绵竹应急周转房项目3#点位
470,9999948fd712497985312d9b63a718fb,PRJ260470,两路市政环卫所-渝北区2022年元旦春节街景灯饰建设工程项目
471,99d71acc6c124557921fbd34cd845492,PRJ260471,罗江区城镇污水垃圾治理-城区垃圾中转站改造项目
472,9a112eb2adae49ea84d9e4baa92dded4,PRJ260472,天弓智慧城产业园（一期）总承包工程精装修工程工程专业分包
473,9b2699105e5a437d96e46f1be52c66a6,PRJ260473,喀什地区塔什库尔干县曲什曼检查站至垃圾处理厂道路路灯采购项目（二次）
474,9b42b1d50b224729a824ee78afa7387e,PRJ260474,德阳市委党校整体迁建工程区域工程-给排水专业分包(第二次)
475,9b66381d3eab487fa180887ba7ee343c,PRJ260475,自贡航空产业园航空大道南延线二标段（K1+860-K2+670）土石方工程设备租赁
476,9b7a50ed79df43dcb4bc61cc23f1c62f,PRJ260476,青衣江路、泰山路等市政道路维修整治工程
477,9bd11b5b52694523b3eecb0ccf6c3c04,PRJ260477,重庆轨道交通15号线一期土建工程01标金童路站2B出入口 DN500 给水管道迁改工程
478,9c886de4b2df40c69ee0567fe75bf196,PRJ260478,2025年西南石油工程公司钻前辅助工程劳务框架招标（4标段：内江、自贡等地区）项目
479,9c9b148d8642412bbc5bb655d73ede29,PRJ260479,中国移动四川公司省本部2021-2023年管理用房及生产枢纽楼公共区域零星维修项目（补采）
480,9d60cf8cfdb546b5a01189c5c9128748,PRJ260480,西藏军区工程建设项目临时器材库和装备库建设项目（2302项目）
481,9ebba094a48443a39dd7e1421da8dfbb,PRJ260481,刘伟零星工程项目
482,9ee8c6df78d84fb79e7bacee20f9803e,PRJ260482,剑阁县2017年国家水土保持重点建设工程剑江项目区治理工程
483,9f0ba65501144ebc97ad9ca1812c6f5d,PRJ260483,旌阳区涪江苑小区等2个城镇老旧小区改造及配套基础设施改造项目（孝感街道二期）-涪江苑小区周边道路改造
484,9f65fb36101c4f598431d46550c76f8a,PRJ260484,四川护理职业学校2019年暑假德阳校区区域总平修缮工程
485,9f9532c518f646cc8f518111de5c4505,PRJ260485,喀什某单位锅炉房锅炉扩容改造项目
486,a066ecd41c8a4c52b51338d3c00115e1,PRJ260486,德阳智茂润亚电子科技有限公司3C配件及终端制造项目厂房装修工程
487,a0d056eb1a064f0cbb2cf26b4eb30fcf,PRJ260487,德新镇绿化及风貌改造工程
488,a169409a19654f2080b224b3cf9a2d66,PRJ260488,安州高新区数字经济产业园基础设施补短板项目--地块二专业分包招标
489,a1affaaaf8124d54bfedebee978dda0b,PRJ260489,西藏鲲泰建设集团有限公司2021年度劳务作业分包必选入围项目
490,a1c8757811764320a6915a1df6d7846b,PRJ260490,剑阁县盐店镇莲石笋村居民改造项目七标段
491,a1d5df160ba1409dbb581cc5c68a9cfc,PRJ260491,营盘乡高峰村、都家坝、丁家碥村农村安全饮水
492,a1df3e6b2cbe4363b1f33cb30b679822,PRJ260492,绵阳市安州区村容村貌环境改造提升项目——黄土镇江池村道路工程项目
493,a1e8265ed4924aa793e4e304ede160dd,PRJ260493,国网德阳供电公司综合中心建设场地平整工程
494,a2188cd16afa4137a6672d5b21995152,PRJ260494,环壁南路（中山大道至蒋家河段）DN600管给水工程
495,a23dd17f3b044c6e922cddbecbae097e,PRJ260495,细磨车间、碳酸锂车间防水补漏项目工程
496,a26cdf3caf4d4040809169e35af677b7,PRJ260496,工程部油料化工组后油库油罐防腐层检修合同
497,a276363513d1424da525b3a0069cad76,PRJ260497,青衣江小学东侧绿化带整治
498,a27fc25d859f4e8c89c1de148f879008,PRJ260498,西藏华泰龙矿业开发有限公司接地环网安装工程
499,a2ed40b404af4ce0b9256320d9d0ea9c,PRJ260499,白马关镇接引村“三格式+人工湿地”集中式生活污水处理设施项目
500,a302d9524c1c476b9467347fd2366c29,PRJ260500,德阳文德湖屿树花园项目一期一批次项目
501,a31f60322d4549d08c02b28c71911eaf,PRJ260501,九寨沟县假日阳光建设项目（酒店标段）勘察-设计-施工总承包（EPC）项目
502,a3f1efed66944330a8825ac889c5cb86,PRJ260502,中国航发公司郝小成零星工程
503,a41a50af79294ecb925b470611f7ffbd,PRJ260503,伽师县综合物流园建设项目-新建10KV配电工程
504,a47049a94e0f4b61b0d7bf3e26dc1bf5,PRJ260504,中国移动四川公司雅安分公司2021-2022年渠道维修采购项目框架协议
505,a4c3b0033e8a41e68da82541dd2ba833,PRJ260505,建筑工程实训管改造提升采购项目
506,a54d1136b4874e4a821efd15fdc99656,PRJ260506,剑阁县白龙鲁班片区市政基础建设工程
507,a57caf01d54f4466a15c975d806f6d43,PRJ260507,青海盐湖工业股份有限公司钾肥分公司2020年冬季维保项目加工一车间局部地面硬化项目区域四、区域五地坪修复工程 标段一
508,a5c3158b49694b9b80cc642bde276b66,PRJ260508,汉源县生态农副产品产业园区基础配套设施建设项目-孵化园一标段
509,a5d250ac5bbf451a9793ba879c02cfe4,PRJ260509,中国移动四川公司眉山分公司2020-2022年渠道维修采购项目框架协议
510,a649f6ec842b490fa661f7f985335fef,PRJ260510,滨河路加油站室外污水管网修建项目
511,a6c5c648fc4c4a32b2affa2b7bcd40ff,PRJ260511,德阳市罗江区万安南塔社区多功能运动场建设项目
512,a74d16f8345a4e29a837fb2ea222deea,PRJ260512,广清城际轨道交通项目（花都段）安置区工程（狮岭镇军田安置区一期工程）项目（市政道路）工程
513,a7f1cabfc69e4b0e9a8f93a295c8ee03,PRJ260513,中建四局-刘兴宇项目
514,a833c96d0fcc4025b38b6b6f534bf835,PRJ260514,南木林县拉布普乡皮布岔口东娘村公路工程项目
515,a87f64ee0cf84e24ba5def696a8db151,PRJ260515,1-8号厂房、13号厂房、16号厂房防水保温工程专业分包合同
516,a9d5da6068554951b32ac50fd0882879,PRJ260516,德阳市自来水公司给水管道维修工程
517,aa1718235eda4e43a6bc5e018bac9aac,PRJ260517,喀什地区某医院综合内科楼消防设施改造工程
518,ab320098414a44169a230f356a43a778,PRJ260518,2023年德阳经开区保障性安居工程城镇老旧小区主体改造项目劳务分包第十二标段
519,ab4b61f019744a5bae5f5ee00538f82b,PRJ260519,重庆市城投路桥管理有限公司2022年日常维护（竞标12）项目
520,ab85a39f56c54484bb2c8097a4a55b36,PRJ260520,平武古城敬老院维修改造项目
521,abb8fe1c7d94468e87f740a796daa4e1,PRJ260521,民洛一级公路10千伏线路迁改工程
522,abcd51a9a4144153ab3c770d763e7219,PRJ260522,孝感镇和平村1、2、3、6、7组墓地迁建区域配套项目
523,abee105af4f140e9a3596ff620d771d5,PRJ260523,界石围栏采购项目
524,ad19ad5cd2244aa4830302b0c8a545b8,PRJ260524,罗江区集中办公区食堂项目
525,ad21c497c9cd46f29dcf11deb58d2e0b,PRJ260525,旌南大厦12楼办公场所装修项目
526,ad660cc6918646d8a94fe5ff0f0fccc5,PRJ260526,德阳市旌阳区医养结合中心及精神病院区建设项目国防电缆通信线路迁改工程
527,ad7fbdddb4114548a9b6e547bba0821d,PRJ260527,违法建（构）筑物拆除工程施工协议
528,ad80a3099a1b4502b742b3396c7bd3bd,PRJ260528,中江县北塔南北干道至东二环道路工程二期
529,ada14cce57224111bd53c4427cedba4a,PRJ260529,异地扶贫搬迁项目
530,ade530f935bc4134a288b363dddb4b49,PRJ260530,国网新疆喀什供电公司110kV一明线接地网大修等2项工程
531,ae12c308edb84f0aad945e6a9017eb35,PRJ260531,乐山嘉洋科技发展有限公司车间净化装修工程
532,aec263c51c77406b9e1cbdae1cde27eb,PRJ260532,德阳文德湖屿树花园项目总承包工程大区土方开挖分包合同
533,af285b99ff1d4d829aa2ff13843f76a3,PRJ260533,常宜高速公路CY-CZ1承台墩柱1标工程
534,b011d38f5f2a43d6acfe6cb196f70d8f,PRJ260534,中江县“8.16”渠道水毁修复工程
535,b024fdce92fc4c7d9a196718ad0734a8,PRJ260535,德阳站综合交通枢纽改造项目桥梁地下室主体结构工程
536,b02b08e025ab4b038d764e0525b2e64b,PRJ260536,健康骑游道铺装劳务
537,b032b1d023394264bea8890d30a6f16e,PRJ260537,中江县杏花路道路建设工程施工
538,b04092bf64244df4ba3e3d8888115d68,PRJ260538,中国移动四川公司德阳分公司2021-2022年渠道维修采购项目框架协议
539,b155837db59c42d9a3eccff2df5bfad8,PRJ260539,黄猫垭园区建设工程劳务分包
540,b17db7c3d7814760a0b0710bf88bef0d,PRJ260540,树木移栽合同
541,b1da8255e06e4056aaf0e844559b407c,PRJ260541,眉山环天水务有限公司舒坪社区管网修复工程
542,b259e293688c4bfb866ab5e190275273,PRJ260542,2021年11月1日-2023年10月31日期间学校安排的防水维修项目和应急处理
543,b30548069e964194aca239afd9b34d82,PRJ260543,中国移动四川分公司南充片区2018-2020年渠道零星维修项目（标包9）
544,b3f527d6f80c45498a54241c44fee03b,PRJ260544,罗江区2020年暴雨洪灾水毁修复9个工程施工分包单位及单价补充协议书
545,b46d0ef2c882487aae2e2858aed634e2,PRJ260545,重庆工业职业技术学院
546,b4d056223bda427d8dff39113334ef37,PRJ260546,【广清城际轨道交通项目（花都段）安置区工程（狮岭镇前进安置区）一期施工总承包】项目【市政道路】工程专业分包
547,b5ee8bfd20284bcd84383b0764db24fb,PRJ260547,理塘碧桂园项目
548,b653753feab74ec1baf2be1b531a5d99,PRJ260548,成都（北部商城）西部国际家电交易中心1#楼及地下室
549,b68df914cf3b47b888e43028b1057da1,PRJ260549,德新镇污水处理厂及污水收集主管网建设（德新镇污水处理厂工程）
550,b69a287978ee4573b1b21768e3868581,PRJ260550,德阳市旌阳区中医院门诊综合大楼项目及住院综合大楼项目
551,b6cc0a037a2643c18ed61e593250ec3a,PRJ260551,旌阳区孝感镇灵庙村2017年节水型社会重点县建设项目
552,b79f8cb44d6045c1869f6bb575b5e77e,PRJ260552,绵阳市安州区人民检察院智慧检察系统Ⅴ期办案工作区土建项目
553,b7c7e4c229024786b30ee5bec6d0ad9b,PRJ260553,国网新疆电力有限公司阿勒泰供电公司省管产业单位2024年第一次服务类区域联合授权框架招标采购
554,b7f07bc4b72c4cd29b5d1b445b499386,PRJ260554,工程学院零星项目
555,b98aa16d7a9d42e3a7eb8dbbe2907651,PRJ260555,德阳市绵远河西岸生态整治工程（青衣江路-牡丹江路）
556,b9f1ea27e66c41fba95cb7573c425073,PRJ260556,重庆市璧山区璧泉街道老旧小区改造配套基础设施（南关社区）（第二次）
557,baeda23eedeb4f788ea28c0d60af1904,PRJ260557,西藏军区工程建设项目临时器材库和装备库建设项目（2302项目）
558,bb0ccbdd806d4c49b287d32ffb70ebff,PRJ260558,城南壹号·熙悦府（一期）专业分包包2安装工程
559,bb463f5786a54cbeb158e5a7972e53af,PRJ260559,拉萨市柳梧新区污水分流部分区域改造
560,bb479eae09634eca926443b260524e78,PRJ260560,重庆丰都龙城华府（三期）二组团10#、11#住宅屋顶分布式光伏项目
561,bb522fee21af41b384c8fc7647fe63f3,PRJ260561,合格土销售项目
562,bb77cc54c910443da84b9a2c7d6f10f3,PRJ260562,天元街道产业园区配套道路建设项目
563,bbe61b7f1a754c2a9998c3cec3e80260,PRJ260563,巴楚县中心敬老院消防改造提升建设项目
564,bbea9e93630f48eea51296e418ad83b7,PRJ260564,射洪县仁和中学校教学用房及相关附属设施建设项目
565,bc8a3285e9af4dcda5895313440be16a,PRJ260565,九寨沟县漳扎镇小学校等灾后重建项目部-九寨沟干部职工周转房
566,bcf49916c2384becac4bf9844fe05ea3,PRJ260566,四川工程职业技术学院二、三食堂周边铺装改造
567,bd0099f172af405e8eb98f712df92127,PRJ260567,1851-20项目消防联调联试及通风系统安装工程
568,bd7953ddbca04d708e1d5ae2c42fcdf2,PRJ260568,2025年西南石油工程公司钻前辅助工程劳务框架招标（8标段：内江、自贡等地区）项目
569,bdaa2a6cd8fc429b89053c278f6ed3b6,PRJ260569,53019工程、3644-3、4、3617工程（2022.01.17）
570,bdcac58b05554a5c98e5d6afeb3f7f9f,PRJ260570,旌阳区保密局办公室改造
571,bde18269fcd04d00910a9b456d0a4813,PRJ260571,南川区第三中学扩建工程
572,be3f89e0cb294643bdbc6f62c5a242c2,PRJ260572,2021年柳梧新区雨污水管网及防洪渠维保服务采购项目一标段
573,bedcf08fe3a040b6a2123a148f45dd5c,PRJ260573,川北幼儿师范高等专科学校三期工程-室外附属一批次工程
574,beea539bc3a94a7d8d2c4852c1f08c25,PRJ260574,黄许镇绵远河袁家大桥建设项目农房拆迁安置 基础设施配套项目一村道、排水沟、管网建设项目
575,bfa15c3cc6544332a4573e54f79a5b98,PRJ260575,越西县普雄镇消防站建设项目
576,bfd2012972084181b83a6f7e885ada70,PRJ260576,柳梧新区地下雨污水管网（部分路段）改造项目
577,c0751730f07349fb9d2b573a765484eb,PRJ260577,鸿图府项目第一期建筑安装工程
578,c0fec62dffee4c0cbcf8eaab7e4a5477,PRJ260578,【广清城际轨道交通项目（花都段）安置区工程 （狮岭镇军田安置区一期工程）施工总承包】项目 【挡土墙】工程专业分包合同
579,c14136ad1c52463bbde74fe5f3498398,PRJ260579,瑜园小区配套基础设施及环境改造工程
580,c15575514d04462bb5a4020601c3ef71,PRJ260580,旌阳区综合管廊项目钱塘江路段管廊支护及防水工程专业分包
581,c1ffdc83503e4cce9d2801316060bed7,PRJ260581,重庆轨道交通15号线一期土建工程03标绣湖路DN400给水管道迁改工程
582,c217fd220f2e4caa882c878faab9ab1d,PRJ260582,环壁南路至环湖北路（青白江河）DN800管安装工程
583,c2924b9b428d4542a346a60c82b82231,PRJ260583,马尔康市卓克基水厂挡墙恢复工程
584,c2a0156bc72d457da0145ca8241ea734,PRJ260584,重庆市璧山区璧泉街道老旧小区改造项目（天门社区）
585,c2ee2572f2e64330acc9922be5d292e6,PRJ260585,刘兴宇项目
586,c2f0d3a74d0940a4a0154792a281712d,PRJ260586,旌阳区全域旅游公共服务保障设施建设项目/凯江大回湾改造工程.
587,c42de1a899dd4c6cb44252bd70299691,PRJ260587,旌阳区德新镇国家农业产业强镇建设二期稻谷产地初加工提升项目
588,c46a561b9aa24ebfb3f0dd11e4b14280,PRJ260588,中国移动四川分公司成都分公司2021-2025年管理用房及生产枢纽楼办公区域维修服务项目-通服
589,c482406a0a254922800ed08a40707fc5,PRJ260589,棉县高层安置小区消防系统维修项目（向阳小区）消防专业分包
590,c4ba575a135e49c6acc9a9d40704535a,PRJ260590,2025年西南石油工程公司钻前辅助工程劳务框架招标（1标段：罗江、黄许等地区）项目
591,c4fa49e392464a0b811c60e8a1e13eef,PRJ260591,66号楼整修项目
592,c4fd674a84cc4c2bbeae55d8207443ce,PRJ260592,堆龙德庆区乃琼亲子公园建设项目
593,c52d2b1e41f747bbb8231326c8d2d344,PRJ260593,奇峰镇共和村蔬菜产业园提升项目
594,c5aaca9d17534640bd9c0821a1032d92,PRJ260594,四川创型工程设计有限责任公司
595,c5d91c8c77db49e3b66db0ac88d0d643,PRJ260595,合川高新区南溪组团用地整治项目
596,c7f4ba7e38cf4b29b239a9b5ddd0ff94,PRJ260596,罗江翰林豪锦苑一期工程
597,c845a86e0fed40a6afd947f09580664f,PRJ260597,渝北区东风水库防汛公路硬化扶助工程
598,c956e9e28b784932b46951bd146d401d,PRJ260598,2023年高标准农田改造提升-东美村1
599,c99641e9b7d8419bb1318f070e2496fd,PRJ260599,什邡市经济开发区一级消防站及综合应急救援训练基地项目
600,ca9894f65c5e4b3cac86e93d68fadc29,PRJ260600,中国移动四川公司绵阳分公司2021-2022年渠道维修采购项目框架协议
601,ca9cc3a115d44c1faf31b0ae8d8c16dc,PRJ260601,垫江县城区污水处理厂提标改造项目（中水管网建设工程A段）--玉鼎桥至明月大道段（第二次）
602,cad02e2bd4444edead1b36635639cf2d,PRJ260602,巴中恩阳临港产业园建设项目一制造业组团项目润禾改造工程1-5号楼防水保温工程
603,cbfd01c8330749afb93f66ff9951df78,PRJ260603,四川建筑职业技术学院德阳校区学生公寓粉刷维修项目
604,cc151f2cfc9e487f82f7f1ba1362d0ad,PRJ260604,剑阁县东宝镇迎春村村级阵地搬迁配套设施工程二标段
605,cc493dcfaf6b488492e6566f21b42af0,PRJ260605,C地块非机动车停车场修建工程
606,ccbab4088228455ba6ac3375b1d2482d,PRJ260606,信息中心图书馆安全整治及服务能力提升项目
607,cce3135c7a5347cd9733a853b942a3fc,PRJ260607,C4-3-1、C4-3-2等3宗地块整治工程水泥稳定碎石层铺筑
608,cd4ddecc90324b76b303a4e4cbbb9e5b,PRJ260608,国家水土保持重点项目中江县2019年冯店小流域水土流失综合治理项目
609,cd883a71c893424fbe432603091e451d,PRJ260609,澜公馆景观工程
610,ce271702026b42be8f214613a471690e,PRJ260610,眉山天府新区老场镇雨污分流改造工程（钢铁片区）管网检测
611,ce39775b7f8e42c7bc487ff69c4acc98,PRJ260611,阆中水城项目唐家山片区一期酒店热水及地暖改造工程
612,ce7524b7223d46e8974e48044decb355,PRJ260612,苍溪县鸳溪镇城乡建设用地增减挂钩项目
613,ce7c47d08d88409da91cd433099d5cee,PRJ260613,四川现代农业工程职业学院一期工程（10#教学楼、培训中心）
614,cf1710ce2cc140c2b0710924a59a216b,PRJ260614,喀什地区英吉沙县2022年停车场建设项目工程总承包
615,cfa432be43df4f4284bb60fb3fce488d,PRJ260615,德阳市旌阳区崴螺山-高屋（寿崴路改线）道路改建工程项目
616,cfca2fd82f1242f3806057b2900d06b0,PRJ260616,眉山环天水务有限公司各条线服务供应商项目（包2）-舒坪社区管网工程
617,d07b7a7a37aa473a89d006c178a4e033,PRJ260617,拉萨市柳梧新区管网错接改造
618,d0ba123f238b4fd68e33aad904dfcb50,PRJ260618,拉萨市柳梧新区排污管网改造
619,d15f664bee1444c488e1b88b678e6af2,PRJ260619,大唐甘肃发电有限工程碧口水力发电厂心苑职工家属区物业维修改造
620,d160e20360074d30af053a069f62ebec,PRJ260620,江油涪江上游武都水库珍稀和特有鱼类繁育中心项目
621,d17be2d1b09f4364bc37820ccd7c6b05,PRJ260621,旌阳区黄许镇糖场桥暴雨洪涝灾害水毁重建工程项目
622,d2584e69e21145199d66b25b0181e0a8,PRJ260622,西南大数据创新应用中心项目土石方
623,d2fbb60741f64cd99c82017452a54663,PRJ260623,何东中石油煤层气公司新疆后峡项目
624,d306ec31828d4c3eabf63d75a7c1b448,PRJ260624,莎车县艾力西湖镇拜什库都克(12)村农村污水治理建设项目(二次)
625,d33b7d4610d240a0a3551630955bd733,PRJ260625,四川省绵阳外国语学校综合中心初中部图书室改造项目
626,d397cd38ebae427ca4304745cd901ba4,PRJ260626,德阳新城吾悦广场住宅整期幕墙工程
627,d3efb18b6f9a44f9b72343d9223c5b40,PRJ260627,四川致远锂业有限公司生产厂房土建零星及维修工程
628,d44862eefe674f20bc033c364f15c515,PRJ260628,喀什地区检察院办案与专业技术用房外立面改造项目
629,d4f6b2931e7c4a2386171451104abc9b,PRJ260629,伽师县工业园区空气源供热建设项目（二次）
630,d502c2489723449486522eca798884fa,PRJ260630,中国移动四川公司成都分公司2021-2022年渠道维修采购项目框架协议
631,d5335e46b2c241fcb9ae857d721331d6,PRJ260631,德阳市漓江路大桥-穿绵远河给水管道工程
632,d54e7276be1b4244b5531898f2d2f00b,PRJ260632,德阳市旌阳区东湖-和新道路改建工程一标段、德阳市旌阳区崴螺山至高层（寿崴路改线）道路工程
633,d5e059c23e3d4a2c802cbecb7911cd38,PRJ260633,绵竹何高春项目
634,d61b20783fc842faa95fa3b2e1bf16bc,PRJ260634,2025年西南石油工程公司钻前辅助工程劳务框架招标（2标段：成都、资阳等地区）项目
635,d673283d7f064228aa3bcdb822c8d425,PRJ260635,中建四局集团-唐颖刚项目
636,d6a4d48ebb62405baf97d36e9e4e228a,PRJ260636,林芝市巴宜区八一镇小学运动场维修工程项目
637,d75424f3247646c395ff5edd2ab1b1f9,PRJ260637,罗江区新盛镇X601新慧路王家湾桥危桥拆除重建工程(第二次)
638,d76027f8b9d148389e9cf2ba799cb07e,PRJ260638,中国移动下游采购合同平台
639,d78614b5e31046649529451acc80e016,PRJ260639,中国移动四川公司成都分公司2025-2026年渠道维修采购项目
640,d795445cf03e48b99618f3eb559a235b,PRJ260640,中江县支公司办公职场装修工程
641,d90bec648f574bc6a2f5bb5f398e87d8,PRJ260641,周超零星工程
642,d9c6cbd20d9f41cc876ad845341304d7,PRJ260642,重庆轨道交通15号线一期土建工程果塘路站二期给水管线迁改工程
643,da53b59ac75e4481b3fff1667e0de7e2,PRJ260643,狮子水库尾水渠垮塌抢险救灾工程
644,da80de7b7a9644428b917920cb14e31a,PRJ260644,东湖山水土石方挖运工程
645,dab94e2764674db5849b05f9b06714bb,PRJ260645,中江县殡仪馆提档改建项目工程
646,db4b47a81c304c03b4914e86eeb5f124,PRJ260646,罗江县蟠龙镇2016年农业综合开发高标准农田建设项目
647,dbf6b62b0ad24261a949828e0d8219d2,PRJ260647,旌阳区全域旅游公共服务保障设施建设项目/凯江大回湾改造工程
648,dbfa5695dccc445c9bf84f504e70912d,PRJ260648,重庆机场航空口岸综合指定监管场地增设防护解除区项目
649,dc23b3505b384d529dc60bef5f64a6e7,PRJ260649,大足支行珠溪分理处主体装修工程
650,dc59bf70a1a54961a96e4a169555842f,PRJ260650,洛浦县市政基础设施建设及配套项目（施工一标段）
651,dc5f03ef90a749be8e3cd19daca87163,PRJ260651,天山北路公共卫生间改造项目
652,dc99595923e7425da8d87ca56ad23f76,PRJ260652,德阳市旌阳区天山路（黄河路-凯江路）改造项目
653,dc9faab2919147868ffddd380f58ea3e,PRJ260653,拉萨市柳梧新区路面井盖维护更换合同
654,dccfa12fb5b747dca476d457c0464d30,PRJ260654,御嘉花苑2、3#楼
655,dcd315ee82ba47d6a463c3090abd9577,PRJ260655,深圳友唱技术有限公司万达零星维修工程
656,dd3c76208c3642b2a44c834db32f1f8f,PRJ260656,广汉市城市更新城西片区城中村改造项目地基基础工程专业分包
657,ddc10588a1094d7986d2b383189125b3,PRJ260657,中江县凯江中学校教学及辅助用房建设项目
658,ddc8f420948e434bbc73f430c4d26d6c,PRJ260658,重庆轨道交通15号线一期工程01标合同段供水管道迁改工程
659,ddd9a94d8aef4059a1def554a737e0e4,PRJ260659,剑阁县2019年交通专项扶贫村道窄路加宽工程（杨村镇柏梓村）
660,dddffb953eee4f1fbba18a5b462ffb1a,PRJ260660,渭河路（庐山北路至秦岭山北路）道路改造工程道路沥青砼路面专业分包施工
661,de55113c54914c5093efa5164f840cdb,PRJ260661,燕山路（洪湖路-柳江街）市政道路工程
662,decc584ec24d4b51b672d8bf3518bf42,PRJ260662,新建杭州经绍兴至台州铁路站前工程一标项目
663,def62d8fc3df471080951397c4fdfd22,PRJ260663,银鑫·五洲广场二期 CD 座室外消防车道施工
664,df39b5bfb9df4c30a7eaaa639e5d5753,PRJ260664,2023年高标准农田改造提升-东美村
665,dfdd8eb86b064e7f8615d74aa2bc222a,PRJ260665,德阳市寿丰河截污干管工程劳务分包
666,e02e8e8061ab4ee599884c34365f1bd0,PRJ260666,莎车县低压电力设施改造项目施工第一标段
667,e0ba5308a59e4e98a4225b4b75d34818,PRJ260667,潼南支行双江分理处营业网点主体装修工程项目
668,e0db577a23194699b7ea732cc08a2eb7,PRJ260668,50万吨年食品级PET高分子新材料项目
669,e0e2a533f7224713a481520af78809ad,PRJ260669,幸福人家项目工程
