line,dimension,map_id,legacy_key,legacy_name,decision,status,reason,target_id,target_name
422,partner,88,丹棱县金星陶瓷有限公司||duplicate_across_carriers,丹棱县金星陶瓷有限公司,,skipped,noop,,
423,partner,280,旌阳区黄许镇运红建材部|92510603ma68trp14b|tax_code_conflict,旌阳区黄许镇运红建材部,,skipped,noop,,
424,project,38,旌北新区（龙泉山路）雨水管网项目,旌北新区（龙泉山路）雨水管网项目,,skipped,noop,,
425,partner,471,四川鑫良友金属丝网制造有限公司||duplicate_across_carriers,四川鑫良友金属丝网制造有限公司,,skipped,noop,,
426,partner,282,旌阳区慧乐发建材经营部（个体工商户）||duplicate_across_carriers,旌阳区慧乐发建材经营部（个体工商户）,,skipped,noop,,
427,partner,291,旌阳区旌瑞机械设备租赁服务部||duplicate_across_carriers,旌阳区旌瑞机械设备租赁服务部,,skipped,noop,,
428,partner,709,四川欧峰实业有限公司||fact_partner_candidate,四川欧峰实业有限公司,,skipped,noop,,
429,partner,392,四川百汇绿科建材有限公司||duplicate_across_carriers,四川百汇绿科建材有限公司,,skipped,noop,,
430,partner,710,罗江区鑫顺建筑机械租赁部||fact_partner_candidate,罗江区鑫顺建筑机械租赁部,,skipped,noop,,
431,partner,711,德阳市旌阳区社会保险局||fact_partner_candidate,德阳市旌阳区社会保险局,,skipped,noop,,
432,partner,712,四川栩峰海瑞贸易有限公司||fact_partner_candidate,四川栩峰海瑞贸易有限公司,,skipped,noop,,
433,partner,713,刘汶衔||fact_partner_candidate,刘汶衔,,skipped,noop,,
434,partner,163,德阳市旌阳区柏隆天然气有限公司||duplicate_across_carriers,德阳市旌阳区柏隆天然气有限公司,,skipped,noop,,
435,partner,100,德阳杰狮物流有限公司||duplicate_across_carriers,德阳杰狮物流有限公司,,skipped,noop,,
436,partner,215,德阳中亚投资有限公司||duplicate_same_carrier_or_empty_tax,德阳中亚投资有限公司,,skipped,noop,,
437,partner,714,四川兴盛达石业有限公司||fact_partner_candidate,四川兴盛达石业有限公司,,skipped,noop,,
438,partner,715,倪德模（机械）||fact_partner_candidate,倪德模（机械）,,skipped,noop,,
439,partner,716,四川旭阳华鑫建材有限公司||fact_partner_candidate,四川旭阳华鑫建材有限公司,,skipped,noop,,
440,partner,455,四川森宝电气有限公司|91510600572772022t|tax_code_conflict,四川森宝电气有限公司,,skipped,noop,,
441,partner,274,旌阳区黄许镇关跃模货运部||duplicate_same_carrier_or_empty_tax,旌阳区黄许镇关跃模货运部,,skipped,noop,,
442,partner,717,利欧集团浙江泵业有限公司||fact_partner_candidate,利欧集团浙江泵业有限公司,,skipped,noop,,
443,business_entity,31,460522b05ba8415ba95d05f7efd850d0,四川翔驰恒瑞商贸有限公司,,skipped,noop,,
444,partner,718,刘汶衔班组||fact_partner_candidate,刘汶衔班组,,skipped,noop,,
445,partner,719,广汉市华强钢化玻璃有限公司||fact_partner_candidate,广汉市华强钢化玻璃有限公司,,skipped,noop,,
446,partner,544,周路林机械||duplicate_across_carriers,周路林机械,,skipped,noop,,
447,partner,721,四川汇鑫大德行进出口物资贸易有限公司||fact_partner_candidate,四川汇鑫大德行进出口物资贸易有限公司,,skipped,noop,,
448,partner,720,绵阳安州区桑枣豪熙百货销售有限责任公司||fact_partner_candidate,绵阳安州区桑枣豪熙百货销售有限责任公司,,skipped,noop,,
449,partner,509,陶通勇（涂料）||duplicate_across_carriers,陶通勇（涂料）,,skipped,noop,,
450,partner,476,四川兴君瑞机械租赁有限公司||duplicate_across_carriers,四川兴君瑞机械租赁有限公司,,skipped,noop,,
451,partner,722,广东省中汇光电工程有限公司||fact_partner_candidate,广东省中汇光电工程有限公司,,skipped,noop,,
452,partner,172,德阳市南富鑫商贸有限公司||duplicate_across_carriers,德阳市南富鑫商贸有限公司,,skipped,noop,,
453,partner,723,广东坚朗建材销售有限公司||fact_partner_candidate,广东坚朗建材销售有限公司,,skipped,noop,,
454,partner,724,四川长瑞土木工程检测有限公司||fact_partner_candidate,四川长瑞土木工程检测有限公司,,skipped,noop,,
455,partner,224,广汉市华溢井业服务部||duplicate_across_carriers,广汉市华溢井业服务部,,skipped,noop,,
456,business_entity,32,8f4479e608b845889bfd188dfb4b779e,旌阳区应木建材经营部,,skipped,noop,,
457,partner,725,旌阳区一烟酒鼎烟酒行||fact_partner_candidate,旌阳区一烟酒鼎烟酒行,,skipped,noop,,
458,partner,726,德阳市区菱发建材门市部||fact_partner_candidate,德阳市区菱发建材门市部,,skipped,noop,,
459,partner,727,四川宏政嘉斯建筑工程有限公司||fact_partner_candidate,四川宏政嘉斯建筑工程有限公司,,skipped,noop,,
460,partner,442,四川鹿为工程管理咨询有限公司||duplicate_across_carriers,四川鹿为工程管理咨询有限公司,,skipped,noop,,
461,partner,728,四川华邦塑胶有限公司||fact_partner_candidate,四川华邦塑胶有限公司,,skipped,noop,,
462,partner,729,陈红兵||fact_partner_candidate,陈红兵,,skipped,noop,,
463,partner,271,旌阳区鸿洋工程机械租赁部||duplicate_across_carriers,旌阳区鸿洋工程机械租赁部,,skipped,noop,,
464,partner,730,德阳市群运物资有限责任公司||fact_partner_candidate,德阳市群运物资有限责任公司,,skipped,noop,,
465,partner,398,四川川盾门窗有限公司|91510626ma679k040b|duplicate_same_carrier_or_empty_tax,四川川盾门窗有限公司,,skipped,noop,,
466,partner,731,旌阳区忠明工程机械设备租赁服务部||fact_partner_candidate,旌阳区忠明工程机械设备租赁服务部,,skipped,noop,,
467,partner,732,四川海鹏运业有限公司||fact_partner_candidate,四川海鹏运业有限公司,,skipped,noop,,
468,partner,77,成都市劳瑞斯移动板房有限公司||duplicate_across_carriers,成都市劳瑞斯移动板房有限公司,,skipped,noop,,
469,partner,733,肖敦林||fact_partner_candidate,肖敦林,,skipped,noop,,
470,business_entity,33,fe64f2df81b04f6a8ffd510956a8a3f2,旌阳区宏裕辉建材经营部,,skipped,noop,,
471,partner,160,德阳市旌盾工贸有限公司|91510603ma7hdfnt0n|tax_code_conflict,德阳市旌盾工贸有限公司,,skipped,noop,,
472,partner,734,任云||fact_partner_candidate,任云,,skipped,noop,,
473,partner,735,德阳鑫天力广告有限公司||fact_partner_candidate,德阳鑫天力广告有限公司,,skipped,noop,,
474,partner,491,四川中宸项目管理有限公司||duplicate_same_carrier_or_empty_tax,四川中宸项目管理有限公司,,skipped,noop,,
475,partner,736,四川天鑫意石业有限公司||fact_partner_candidate,四川天鑫意石业有限公司,,skipped,noop,,
476,partner,44,四川一仕诺公路工程有限公司||duplicate_across_carriers,四川一仕诺公路工程有限公司,,skipped,noop,,
477,partner,737,四川建设发展股份有限公司金特尔钢构厂||fact_partner_candidate,四川建设发展股份有限公司金特尔钢构厂,,skipped,noop,,
478,partner,334,旌阳区智佳广告设计工作室||duplicate_same_carrier_or_empty_tax,旌阳区智佳广告设计工作室,,skipped,noop,,
479,partner,738,中国人寿财产保险股份有限公司德阳市中心支公司||fact_partner_candidate,中国人寿财产保险股份有限公司德阳市中心支公司,,skipped,noop,,
480,partner,50,中国太平洋财产保险股份有限公司德阳中心支公司|91510600740032542c|tax_code_conflict,中国太平洋财产保险股份有限公司德阳中心支公司,,skipped,noop,,
481,partner,739,江苏光大生态工程技术有限公司||fact_partner_candidate,江苏光大生态工程技术有限公司,,skipped,noop,,
482,partner,222,高新区信洲机械租赁服务部||duplicate_same_carrier_or_empty_tax,高新区信洲机械租赁服务部,,skipped,noop,,
483,partner,740,四川禾霸木业有限公司||fact_partner_candidate,四川禾霸木业有限公司,,skipped,noop,,
484,partner,741,绵竹市东北镇伟全工程机械设备租赁站||fact_partner_candidate,绵竹市东北镇伟全工程机械设备租赁站,,skipped,noop,,
485,partner,742,胡玉斌||fact_partner_candidate,胡玉斌,,skipped,noop,,
486,partner,743,旌阳区卓越成溪机械租赁部||fact_partner_candidate,旌阳区卓越成溪机械租赁部,,skipped,noop,,
487,partner,744,四川吖吖新型材料有限公司||fact_partner_candidate,四川吖吖新型材料有限公司,,skipped,noop,,
488,partner,158,德阳市经开区广利长荣建材经营部||duplicate_across_carriers,德阳市经开区广利长荣建材经营部,,skipped,noop,,
489,partner,396,四川博润智慧建设工程有限公司||duplicate_across_carriers,四川博润智慧建设工程有限公司,,skipped,noop,,
490,partner,478,四川轩瑞清建筑装饰有限公司||duplicate_across_carriers,四川轩瑞清建筑装饰有限公司,,skipped,noop,,
491,partner,745,王进||fact_partner_candidate,王进,,skipped,noop,,
492,partner,746,凌林||fact_partner_candidate,凌林,,skipped,noop,,
493,partner,109,德阳经开区凯浮机械租赁经营部||duplicate_across_carriers,德阳经开区凯浮机械租赁经营部,,skipped,noop,,
494,partner,228,汉承电线电缆有限公司||duplicate_across_carriers,汉承电线电缆有限公司,,skipped,noop,,
495,partner,747,旌阳区鸿信建材经营部||fact_partner_candidate,旌阳区鸿信建材经营部,,skipped,noop,,
496,partner,513,王周兵||duplicate_across_carriers,王周兵,,skipped,noop,,
497,partner,514,王周喜||duplicate_across_carriers,王周喜,,skipped,noop,,
498,partner,748,社保||fact_partner_candidate,社保,,skipped,noop,,
499,partner,749,四川美城优品户外用品有限公司||fact_partner_candidate,四川美城优品户外用品有限公司,,skipped,noop,,
500,partner,365,绵竹市富新镇诺全建材经营部||duplicate_across_carriers,绵竹市富新镇诺全建材经营部,,skipped,noop,,
501,partner,68,成都茗洋机械租赁有限公司||duplicate_across_carriers,成都茗洋机械租赁有限公司,,skipped,noop,,
502,partner,429,四川俊晟商贸有限公司||duplicate_across_carriers,四川俊晟商贸有限公司,,skipped,noop,,
503,partner,123,德阳精简商务服务有限公司||duplicate_across_carriers,德阳精简商务服务有限公司,,skipped,noop,,
504,partner,750,四川聚能同创建材有限公司||fact_partner_candidate,四川聚能同创建材有限公司,,skipped,noop,,
505,partner,390,税务局||duplicate_across_carriers,税务局,,skipped,noop,,
506,partner,407,四川宏川建筑劳务有限公司||duplicate_across_carriers,四川宏川建筑劳务有限公司,,skipped,noop,,
507,partner,276,旌阳区黄许镇金石机械租赁部||duplicate_across_carriers,旌阳区黄许镇金石机械租赁部,,skipped,noop,,
508,partner,329,旌阳区永镪机械租赁部||duplicate_across_carriers,旌阳区永镪机械租赁部,,skipped,noop,,
509,partner,751,旌阳区富强筛网护栏经销部||fact_partner_candidate,旌阳区富强筛网护栏经销部,,skipped,noop,,
510,partner,194,德阳市区贞诚木业加工服务部||duplicate_across_carriers,德阳市区贞诚木业加工服务部,,skipped,noop,,
511,business_entity,34,cade317968c943fb971eebe06d9407dd,四川晟博通达商贸有限公司,,skipped,noop,,
512,partner,377,郫都区新月石材经营部|92510124ma6c4uct6y|tax_code_conflict,郫都区新月石材经营部,,skipped,noop,,
513,partner,196,德阳市圣方物资贸易有限公司||duplicate_across_carriers,德阳市圣方物资贸易有限公司,,skipped,noop,,
514,partner,752,旌阳区国成机械租赁经营部(个体工商户)||fact_partner_candidate,旌阳区国成机械租赁经营部(个体工商户),,skipped,noop,,
515,partner,753,四川勇兴建筑工程有限公司||fact_partner_candidate,四川勇兴建筑工程有限公司,,skipped,noop,,
516,partner,235,华略创新（成都）科技有限公司||duplicate_across_carriers,华略创新（成都）科技有限公司,,skipped,noop,,
517,partner,754,德阳旌辉建筑材料有限公司||fact_partner_candidate,德阳旌辉建筑材料有限公司,,skipped,noop,,
518,partner,152,德阳市华丰物资有限公司||duplicate_same_carrier_or_empty_tax,德阳市华丰物资有限公司,,skipped,noop,,
519,partner,397,四川财富源防水材料有限公司||duplicate_across_carriers,四川财富源防水材料有限公司,,skipped,noop,,
520,partner,755,德阳驿泊停车场服务有限公司||fact_partner_candidate,德阳驿泊停车场服务有限公司,,skipped,noop,,
521,partner,81,成都同盛聚合机电设备有限公司||duplicate_across_carriers,成都同盛聚合机电设备有限公司,,skipped,noop,,
522,partner,447,四川奇燕石材有限公司||duplicate_across_carriers,四川奇燕石材有限公司,,skipped,noop,,
523,partner,486,四川芸恒暮科技有限公司||duplicate_across_carriers,四川芸恒暮科技有限公司,,skipped,noop,,
524,partner,65,成都磊数科技有限公司||duplicate_across_carriers,成都磊数科技有限公司,,skipped,noop,,
525,project,39,柏隆粮油园区项目,柏隆粮油园区项目,,skipped,noop,,
526,partner,414,四川华西集采电子商务有限公司||duplicate_across_carriers,四川华西集采电子商务有限公司,,skipped,noop,,
527,partner,66,成都栎强门业有限公司||duplicate_across_carriers,成都栎强门业有限公司,,skipped,noop,,
528,partner,54,安信铝业集团有限公司||duplicate_across_carriers,安信铝业集团有限公司,,skipped,noop,,
529,partner,147,德阳市福兴建筑劳务有限公司||duplicate_across_carriers,德阳市福兴建筑劳务有限公司,,skipped,noop,,
530,partner,370,南宁市东杭木业有限公司||duplicate_across_carriers,南宁市东杭木业有限公司,,skipped,noop,,
531,partner,320,旌阳区鑫创达建筑材料经营部||duplicate_across_carriers,旌阳区鑫创达建筑材料经营部,,skipped,noop,,
532,partner,756,王勇||fact_partner_candidate,王勇,,skipped,noop,,
533,partner,757,旌阳区慧乐发建材经营部||fact_partner_candidate,旌阳区慧乐发建材经营部,,skipped,noop,,
534,partner,758,德阳开发区继红建材经营部--机械||fact_partner_candidate,德阳开发区继红建材经营部--机械,,skipped,noop,,
535,partner,530,杨中林||duplicate_across_carriers,杨中林,,skipped,noop,,
536,partner,759,旌阳区昌鑫机械设备租赁服务部||fact_partner_candidate,旌阳区昌鑫机械设备租赁服务部,,skipped,noop,,
537,partner,138,德阳路亿建筑劳务有限公司||duplicate_across_carriers,德阳路亿建筑劳务有限公司,,skipped,noop,,
538,partner,83,成都星沃金属制品有限公司||duplicate_across_carriers,成都星沃金属制品有限公司,,skipped,noop,,
539,partner,760,成都峰岩工程材料有限公司||fact_partner_candidate,成都峰岩工程材料有限公司,,skipped,noop,,
540,partner,761,旌阳区大力运输服务部||fact_partner_candidate,旌阳区大力运输服务部,,skipped,noop,,
541,partner,762,胡俊||fact_partner_candidate,胡俊,,skipped,noop,,
542,partner,122,德阳旌特线缆有限公司||duplicate_across_carriers,德阳旌特线缆有限公司,,skipped,noop,,
543,partner,306,旌阳区瑞洋机电建材经营部||duplicate_across_carriers,旌阳区瑞洋机电建材经营部,,skipped,noop,,
544,partner,416,四川环泰环保有限公司||duplicate_across_carriers,四川环泰环保有限公司,,skipped,noop,,
545,partner,449,四川乾睿辰工程项目管理有限公司||duplicate_across_carriers,四川乾睿辰工程项目管理有限公司,,skipped,noop,,
546,partner,299,旌阳区鹏博建材经营部||duplicate_across_carriers,旌阳区鹏博建材经营部,,skipped,noop,,
547,partner,532,尹华聪||duplicate_across_carriers,尹华聪,,skipped,noop,,
548,partner,763,旌阳区富畅建材经营部||fact_partner_candidate,旌阳区富畅建材经营部,,skipped,noop,,
549,partner,764,成都鼎拓佳商贸有限公司||fact_partner_candidate,成都鼎拓佳商贸有限公司,,skipped,noop,,
550,partner,174,德阳市清康环保科技有限公司||duplicate_across_carriers,德阳市清康环保科技有限公司,,skipped,noop,,
551,partner,428,四川聚木园林绿化工程有限公司||duplicate_across_carriers,四川聚木园林绿化工程有限公司,,skipped,noop,,
552,partner,260,旌阳区富玉建材经营部|92510603ma67qqd426|tax_code_conflict,旌阳区富玉建材经营部,,skipped,noop,,
553,partner,765,德阳开发区华强照明配送经营部||fact_partner_candidate,德阳开发区华强照明配送经营部,,skipped,noop,,
554,partner,766,德阳市九鼎机械设备租赁有限公司||fact_partner_candidate,德阳市九鼎机械设备租赁有限公司,,skipped,noop,,
555,partner,23,德阳市俊寅广告传媒有限公司||duplicate_across_carriers,德阳市俊寅广告传媒有限公司,,skipped,noop,,
556,partner,767,德阳开发区周汉胜建材经营部||fact_partner_candidate,德阳开发区周汉胜建材经营部,,skipped,noop,,
557,partner,520,吴海丰||duplicate_across_carriers,吴海丰,,skipped,noop,,
558,partner,768,四川瑞鑫恒创实业有限公司（运输）||fact_partner_candidate,四川瑞鑫恒创实业有限公司（运输）,,skipped,noop,,
559,partner,769,旌阳区丰瀚商贸经营部||fact_partner_candidate,旌阳区丰瀚商贸经营部,,skipped,noop,,
560,partner,770,德阳开发区继红建材经营部--材料||fact_partner_candidate,德阳开发区继红建材经营部--材料,,skipped,noop,,
561,partner,470,四川鑫华瑞建筑机械设备租赁有限公司||duplicate_across_carriers,四川鑫华瑞建筑机械设备租赁有限公司,,skipped,noop,,
562,partner,200,德阳市兴海川机械设备制造有限公司||duplicate_across_carriers,德阳市兴海川机械设备制造有限公司,,skipped,noop,,
563,partner,422,四川金裕同商贸有限公司||duplicate_across_carriers,四川金裕同商贸有限公司,,skipped,noop,,
564,partner,97,德阳吉欣建筑劳务有限责任公司||duplicate_across_carriers,德阳吉欣建筑劳务有限责任公司,,skipped,noop,,
565,partner,771,四川省鑫万泽金属制品有限公司||fact_partner_candidate,四川省鑫万泽金属制品有限公司,,skipped,noop,,
566,partner,36,旌阳区星龙机电经营部|92510603ma63umhc06|tax_code_conflict,旌阳区星龙机电经营部,,skipped,noop,,
567,partner,413,四川华瑞吊装工程有限公司||duplicate_across_carriers,四川华瑞吊装工程有限公司,,skipped,noop,,
568,partner,259,旌阳区德新镇罗氏钻井工程服务部||duplicate_across_carriers,旌阳区德新镇罗氏钻井工程服务部,,skipped,noop,,
569,partner,424,四川旌宸项目管理有限公司||duplicate_across_carriers,四川旌宸项目管理有限公司,,skipped,noop,,
570,partner,772,周小蓉||fact_partner_candidate,周小蓉,,skipped,noop,,
571,partner,773,德阳邦名建筑劳务有限公司||fact_partner_candidate,德阳邦名建筑劳务有限公司,,skipped,noop,,
572,partner,774,德阳经开区凯诚机械租赁部||fact_partner_candidate,德阳经开区凯诚机械租赁部,,skipped,noop,,
573,partner,775,高标准农田改造项目杂工||fact_partner_candidate,高标准农田改造项目杂工,,skipped,noop,,
574,partner,776,旌阳区鑫兴商贸行||fact_partner_candidate,旌阳区鑫兴商贸行,,skipped,noop,,
575,partner,144,德阳市财政局||duplicate_across_carriers,德阳市财政局,,skipped,noop,,
576,partner,777,德阳开发区继红建材经营部（材料）||fact_partner_candidate,德阳开发区继红建材经营部（材料）,,skipped,noop,,
577,partner,778,旌阳区骏强机械设备租赁部（个体工商户）||fact_partner_candidate,旌阳区骏强机械设备租赁部（个体工商户）,,skipped,noop,,
578,partner,436,四川浪梵石业有限公司||duplicate_across_carriers,四川浪梵石业有限公司,,skipped,noop,,
579,partner,779,德阳市弘伍建筑劳务有限公司||fact_partner_candidate,德阳市弘伍建筑劳务有限公司,,skipped,noop,,
580,partner,431,四川凯晨洲消防科技有限公司||duplicate_across_carriers,四川凯晨洲消防科技有限公司,,skipped,noop,,
581,partner,318,旌阳区肖蒙建材经营部||duplicate_across_carriers,旌阳区肖蒙建材经营部,,skipped,noop,,
582,partner,780,德阳市旌阳区孝感街道杨柳村村民委员会||fact_partner_candidate,德阳市旌阳区孝感街道杨柳村村民委员会,,skipped,noop,,
583,partner,781,旌阳区朗威浩机械租赁服务部||fact_partner_candidate,旌阳区朗威浩机械租赁服务部,,skipped,noop,,
584,partner,187,德阳市区新开橱柜经营部||duplicate_across_carriers,德阳市区新开橱柜经营部,,skipped,noop,,
585,partner,782,德阳市区华泰建材经营部||fact_partner_candidate,德阳市区华泰建材经营部,,skipped,noop,,
586,partner,783,魏云刚||fact_partner_candidate,魏云刚,,skipped,noop,,
587,partner,131,德阳开发区辉银机械设备租赁部||duplicate_same_carrier_or_empty_tax,德阳开发区辉银机械设备租赁部,,skipped,noop,,
588,partner,784,旌阳区国中机械设备租赁服务部||fact_partner_candidate,旌阳区国中机械设备租赁服务部,,skipped,noop,,
589,partner,300,旌阳区鹏达建材经营部||duplicate_same_carrier_or_empty_tax,旌阳区鹏达建材经营部,,skipped,noop,,
590,partner,785,四川华创智慧照明科技有限公司（分包）||fact_partner_candidate,四川华创智慧照明科技有限公司（分包）,,skipped,noop,,
591,partner,786,中国人民财产保险股份有限公司德阳市分公司||fact_partner_candidate,中国人民财产保险股份有限公司德阳市分公司,,skipped,noop,,
592,partner,481,四川壹樽恒业贸易有限公司||duplicate_across_carriers,四川壹樽恒业贸易有限公司,,skipped,noop,,
593,partner,787,德阳经开区凯诚机械租赁部(个体工商户)||fact_partner_candidate,德阳经开区凯诚机械租赁部(个体工商户),,skipped,noop,,
594,partner,446,四川鹏宸项目管理有限公司||duplicate_same_carrier_or_empty_tax,四川鹏宸项目管理有限公司,,skipped,noop,,
595,partner,364,绵阳阳亿胜建筑劳务有限责任公司||duplicate_across_carriers,绵阳阳亿胜建筑劳务有限责任公司,,skipped,noop,,
596,partner,789,刘维军||fact_partner_candidate,刘维军,,skipped,noop,,
597,partner,788,四川祥坤新材料有限公司（机械）||fact_partner_candidate,四川祥坤新材料有限公司（机械）,,skipped,noop,,
598,partner,790,旌阳区飞丰华机械租赁服务部||fact_partner_candidate,旌阳区飞丰华机械租赁服务部,,skipped,noop,,
599,partner,539,中江县凯江镇王师白铁经营部||duplicate_across_carriers,中江县凯江镇王师白铁经营部,,skipped,noop,,
600,partner,791,四川万柏土石方工程有限公司||fact_partner_candidate,四川万柏土石方工程有限公司,,skipped,noop,,
601,partner,61,成都创仕达交通设施有限公司||duplicate_across_carriers,成都创仕达交通设施有限公司,,skipped,noop,,
602,partner,792,刘应木||fact_partner_candidate,刘应木,,skipped,noop,,
603,partner,463,四川腾创商贸有限公司||duplicate_across_carriers,四川腾创商贸有限公司,,skipped,noop,,
604,partner,794,成都正本源生化科技有限公司||fact_partner_candidate,成都正本源生化科技有限公司,,skipped,noop,,
605,partner,793,旌阳区柏顺建材经营部||fact_partner_candidate,旌阳区柏顺建材经营部,,skipped,noop,,
606,partner,528,杨波||duplicate_across_carriers,杨波,,skipped,noop,,
607,partner,795,四川齐燕石材有限公司||fact_partner_candidate,四川齐燕石材有限公司,,skipped,noop,,
608,partner,86,成都筑强企业管理有限公司||duplicate_same_carrier_or_empty_tax,成都筑强企业管理有限公司,,skipped,noop,,
609,partner,175,德阳市区百润油漆店||duplicate_across_carriers,德阳市区百润油漆店,,skipped,noop,,
610,partner,316,旌阳区孝泉镇利荣建材经营部||duplicate_across_carriers,旌阳区孝泉镇利荣建材经营部,,skipped,noop,,
611,partner,796,德阳开发区天马水暖建材经营部||fact_partner_candidate,德阳开发区天马水暖建材经营部,,skipped,noop,,
612,partner,797,四川爱达乐明德食品有限公司||fact_partner_candidate,四川爱达乐明德食品有限公司,,skipped,noop,,
613,partner,798,什邡市欧风建筑装饰工程有限公司||fact_partner_candidate,什邡市欧风建筑装饰工程有限公司,,skipped,noop,,
614,partner,799,绵竹市新市镇鸿辰建材经营部||fact_partner_candidate,绵竹市新市镇鸿辰建材经营部,,skipped,noop,,
615,partner,800,李合贵（机械）||fact_partner_candidate,李合贵（机械）,,skipped,noop,,
616,partner,801,曾国华||fact_partner_candidate,曾国华,,skipped,noop,,
617,partner,802,郑红明（机械）||fact_partner_candidate,郑红明（机械）,,skipped,noop,,
618,partner,803,旌阳区俊阳兰建材经营部||fact_partner_candidate,旌阳区俊阳兰建材经营部,,skipped,noop,,
619,partner,804,德阳市福宾加油站||fact_partner_candidate,德阳市福宾加油站,,skipped,noop,,
620,project,40,中江驾考校,中江驾考校,,skipped,noop,,
621,partner,805,德阳市奕汐档案管理服务有限公司||fact_partner_candidate,德阳市奕汐档案管理服务有限公司,,skipped,noop,,
622,partner,806,四川绿茂环卫设施有限公司||fact_partner_candidate,四川绿茂环卫设施有限公司,,skipped,noop,,
