line,dimension,map_id,legacy_key,legacy_name,decision,status,reason,target_id,target_name
623,partner,807,四川兴禾维工程项目管理有限公司||fact_partner_candidate,四川兴禾维工程项目管理有限公司,,skipped,noop,,
624,partner,808,李飞||fact_partner_candidate,李飞,,skipped,noop,,
625,business_entity,35,58b0d30ab0af4b3eb9fc815d2335383b,四川世旺鑫润商贸有限公司,,skipped,noop,,
626,partner,432,四川楷楠建设工程有限公司|91510600ma6234en4c|duplicate_same_carrier_or_empty_tax,四川楷楠建设工程有限公司,,skipped,noop,,
627,partner,809,德阳市叁伍土石方沙石工程有限公司||fact_partner_candidate,德阳市叁伍土石方沙石工程有限公司,,skipped,noop,,
628,partner,375,郫都区柏克建材经营部||duplicate_across_carriers,郫都区柏克建材经营部,,skipped,noop,,
629,partner,810,德阳开发区永晟工程机械租赁经营部||fact_partner_candidate,德阳开发区永晟工程机械租赁经营部,,skipped,noop,,
630,business_entity,36,d68125dac99640249bd4f0518269009a,四川迈投建筑工程有限公司,,skipped,noop,,
631,project,41,蓥华山路道路工程-包2,蓥华山路道路工程-包2,,skipped,noop,,
632,partner,225,广汉市欧风建筑工程有限公司||duplicate_across_carriers,广汉市欧风建筑工程有限公司,,skipped,noop,,
633,partner,395,四川彬明劳务服务有限公司||duplicate_across_carriers,四川彬明劳务服务有限公司,,skipped,noop,,
634,partner,445,四川美力科技有限公司||duplicate_across_carriers,四川美力科技有限公司,,skipped,noop,,
635,partner,811,四川八玺广告有限公司||fact_partner_candidate,四川八玺广告有限公司,,skipped,noop,,
636,partner,507,汤旭富||duplicate_across_carriers,汤旭富,,skipped,noop,,
637,partner,73,成都市和欣建材有限公司||duplicate_across_carriers,成都市和欣建材有限公司,,skipped,noop,,
638,partner,812,四川金通喜商贸有限公司||fact_partner_candidate,四川金通喜商贸有限公司,,skipped,noop,,
639,partner,813,德阳市德加汽车服务有限公司||fact_partner_candidate,德阳市德加汽车服务有限公司,,skipped,noop,,
640,partner,79,成都市兴立新塑料装饰材料有限公司||duplicate_across_carriers,成都市兴立新塑料装饰材料有限公司,,skipped,noop,,
641,partner,814,邓世娇||fact_partner_candidate,邓世娇,,skipped,noop,,
642,partner,815,德阳市旌阳区孝感街道金牛社区居民委员会||fact_partner_candidate,德阳市旌阳区孝感街道金牛社区居民委员会,,skipped,noop,,
643,partner,352,刘强||duplicate_across_carriers,刘强,,skipped,noop,,
644,partner,816,四川川盾门窗有限公司（分包）||fact_partner_candidate,四川川盾门窗有限公司（分包）,,skipped,noop,,
645,partner,477,四川星泛美科技有限公司||duplicate_across_carriers,四川星泛美科技有限公司,,skipped,noop,,
646,partner,357,罗江区瑞锦建筑机械经营部||duplicate_across_carriers,罗江区瑞锦建筑机械经营部,,skipped,noop,,
647,partner,817,易德富班组||fact_partner_candidate,易德富班组,,skipped,noop,,
648,partner,818,四川欧甲工贸有限公司||fact_partner_candidate,四川欧甲工贸有限公司,,skipped,noop,,
649,partner,523,徐州大有灌排设备有限公司||duplicate_same_carrier_or_empty_tax,徐州大有灌排设备有限公司,,skipped,noop,,
650,partner,389,手续费||duplicate_same_carrier_or_empty_tax,手续费,,skipped,noop,,
651,partner,80,成都顺建机械工程有限公司||duplicate_across_carriers,成都顺建机械工程有限公司,,skipped,noop,,
652,partner,819,中国铁塔股份有限公司德阳市分公司||fact_partner_candidate,中国铁塔股份有限公司德阳市分公司,,skipped,noop,,
653,partner,91,德阳诚建集装箱租赁有限公司||duplicate_across_carriers,德阳诚建集装箱租赁有限公司,,skipped,noop,,
654,partner,168,德阳市旌阳区水印图文制作服务部（个体工商户）||duplicate_across_carriers,德阳市旌阳区水印图文制作服务部（个体工商户）,,skipped,noop,,
655,partner,820,德阳市鑫福锌钢护栏有限公司||fact_partner_candidate,德阳市鑫福锌钢护栏有限公司,,skipped,noop,,
656,partner,821,德阳欧峰实业有限公司||fact_partner_candidate,德阳欧峰实业有限公司,,skipped,noop,,
657,partner,822,罗方友||fact_partner_candidate,罗方友,,skipped,noop,,
658,partner,383,山东华谊工程材料有限公司||duplicate_across_carriers,山东华谊工程材料有限公司,,skipped,noop,,
659,partner,342,冷晓春||duplicate_across_carriers,冷晓春,,skipped,noop,,
660,partner,394,四川彪哥机械租赁有限公司||duplicate_across_carriers,四川彪哥机械租赁有限公司,,skipped,noop,,
661,partner,165,德阳市旌阳区东湖街道拱桥社区居民委员会||duplicate_same_carrier_or_empty_tax,德阳市旌阳区东湖街道拱桥社区居民委员会,,skipped,noop,,
662,partner,140,德阳明源电力集团有限公司德为分公司||duplicate_across_carriers,德阳明源电力集团有限公司德为分公司,,skipped,noop,,
663,partner,823,德阳经开区诚建建材经营部||fact_partner_candidate,德阳经开区诚建建材经营部,,skipped,noop,,
664,partner,824,德阳市区浩杰建材经门市部||fact_partner_candidate,德阳市区浩杰建材经门市部,,skipped,noop,,
665,partner,825,刘春红||fact_partner_candidate,刘春红,,skipped,noop,,
666,partner,245,金堂七鑫机电租赁站||duplicate_across_carriers,金堂七鑫机电租赁站,,skipped,noop,,
667,partner,826,德阳市区西卡防水保温材料经营部||fact_partner_candidate,德阳市区西卡防水保温材料经营部,,skipped,noop,,
668,partner,827,广汉市鑫锦泰机械设备经营部||fact_partner_candidate,广汉市鑫锦泰机械设备经营部,,skipped,noop,,
669,partner,129,德阳开发区好利来机械租赁服务部||duplicate_same_carrier_or_empty_tax,德阳开发区好利来机械租赁服务部,,skipped,noop,,
670,partner,492,四川中辉绿建集装箱有限公司||duplicate_across_carriers,四川中辉绿建集装箱有限公司,,skipped,noop,,
671,partner,828,旌阳区德新镇创新机械租赁部||fact_partner_candidate,旌阳区德新镇创新机械租赁部,,skipped,noop,,
672,partner,829,德阳市瑞荣建材有限公司||fact_partner_candidate,德阳市瑞荣建材有限公司,,skipped,noop,,
673,partner,525,宣威市农业农村局||duplicate_across_carriers,宣威市农业农村局,,skipped,noop,,
674,partner,830,旌阳区德耀机械设备租赁服务部（刘新龙）||fact_partner_candidate,旌阳区德耀机械设备租赁服务部（刘新龙）,,skipped,noop,,
675,partner,831,德阳市盛宇电器有限公司||fact_partner_candidate,德阳市盛宇电器有限公司,,skipped,noop,,
676,partner,832,四川三电成缆电缆有限公司||fact_partner_candidate,四川三电成缆电缆有限公司,,skipped,noop,,
677,partner,833,四川径畅交通工程有限公司（分包）||fact_partner_candidate,四川径畅交通工程有限公司（分包）,,skipped,noop,,
678,partner,354,刘志勇||duplicate_same_carrier_or_empty_tax,刘志勇,,skipped,noop,,
679,partner,71,成都润安势市政设施有限公司||duplicate_across_carriers,成都润安势市政设施有限公司,,skipped,noop,,
680,partner,834,成都鑫虹贵商贸有限公司||fact_partner_candidate,成都鑫虹贵商贸有限公司,,skipped,noop,,
681,partner,192,德阳市区宇测仪器经营部||duplicate_same_carrier_or_empty_tax,德阳市区宇测仪器经营部,,skipped,noop,,
682,partner,454,四川三和源招标代理有限公司||duplicate_across_carriers,四川三和源招标代理有限公司,,skipped,noop,,
683,partner,835,德阳开发区兴顺建材经营部||fact_partner_candidate,德阳开发区兴顺建材经营部,,skipped,noop,,
684,partner,420,四川金广信工程管理咨询有限公司||duplicate_same_carrier_or_empty_tax,四川金广信工程管理咨询有限公司,,skipped,noop,,
685,partner,836,四川涂派新材料科技有限公司||fact_partner_candidate,四川涂派新材料科技有限公司,,skipped,noop,,
686,partner,154,德阳市汇新钢化玻璃有限公司||duplicate_same_carrier_or_empty_tax,德阳市汇新钢化玻璃有限公司,,skipped,noop,,
687,partner,837,德阳鑫科能电力控制设备有限公司||fact_partner_candidate,德阳鑫科能电力控制设备有限公司,,skipped,noop,,
688,partner,126,德阳骏驰建材有限公司||duplicate_across_carriers,德阳骏驰建材有限公司,,skipped,noop,,
689,partner,190,德阳市区星龙农机经营部|92510600ma63n5632y|tax_code_conflict,德阳市区星龙农机经营部,,skipped,noop,,
690,partner,838,德阳云刚土石方工程有限公司-材料||fact_partner_candidate,德阳云刚土石方工程有限公司-材料,,skipped,noop,,
691,partner,839,德阳辽河昌鸿建筑设备租赁有限公司||fact_partner_candidate,德阳辽河昌鸿建筑设备租赁有限公司,,skipped,noop,,
692,partner,521,厦门郁茶香贸易有限公司||duplicate_across_carriers,厦门郁茶香贸易有限公司,,skipped,noop,,
693,partner,350,临时水电组||duplicate_across_carriers,临时水电组,,skipped,noop,,
694,partner,840,唐明龙负责人||fact_partner_candidate,唐明龙负责人,,skipped,noop,,
695,partner,841,admin||fact_partner_candidate,admin,,skipped,noop,,
696,partner,843,四川保盛建设集团有限公司成都分公司||fact_partner_candidate,四川保盛建设集团有限公司成都分公司,,skipped,noop,,
697,partner,842,四川术广企业管理咨询有限公司||fact_partner_candidate,四川术广企业管理咨询有限公司,,skipped,noop,,
698,partner,502,孙洛洛||duplicate_same_carrier_or_empty_tax,孙洛洛,,skipped,noop,,
699,partner,541,中江县凯江镇兴中意装饰经营部||duplicate_across_carriers,中江县凯江镇兴中意装饰经营部,,skipped,noop,,
700,partner,70,成都诺美力威科技有限公司||duplicate_across_carriers,成都诺美力威科技有限公司,,skipped,noop,,
701,partner,844,张鑫||fact_partner_candidate,张鑫,,skipped,noop,,
702,partner,5,旌阳区新豪五金机电商贸部||duplicate_across_carriers,旌阳区新豪五金机电商贸部,,skipped,noop,,
703,partner,164,德阳市旌阳区柏隆镇农民用水户协会||duplicate_across_carriers,德阳市旌阳区柏隆镇农民用水户协会,,skipped,noop,,
704,partner,845,德阳市晨丰市政设施有限公司||fact_partner_candidate,德阳市晨丰市政设施有限公司,,skipped,noop,,
705,partner,99,德阳建发预制构件厂||duplicate_across_carriers,德阳建发预制构件厂,,skipped,noop,,
706,partner,846,四川庆源派供水设备有限公司||fact_partner_candidate,四川庆源派供水设备有限公司,,skipped,noop,,
707,partner,33,旌阳区久悦建筑物清洁服务部||duplicate_across_carriers,旌阳区久悦建筑物清洁服务部,,skipped,noop,,
708,partner,847,魏刚||fact_partner_candidate,魏刚,,skipped,noop,,
709,partner,405,四川合和顺建设集团有限公司||duplicate_across_carriers,四川合和顺建设集团有限公司,,skipped,noop,,
710,project,42,旌阳区供水项目(柏隆水厂及管网）,旌阳区供水项目(柏隆水厂及管网）,,skipped,noop,,
711,partner,848,德阳博顺商贸有限公司||fact_partner_candidate,德阳博顺商贸有限公司,,skipped,noop,,
712,partner,849,旌阳区骏采卓航建材经营部||fact_partner_candidate,旌阳区骏采卓航建材经营部,,skipped,noop,,
713,partner,483,四川翊堃晟保温材料有限公司||duplicate_across_carriers,四川翊堃晟保温材料有限公司,,skipped,noop,,
714,partner,850,德阳市区海之防水工程部||fact_partner_candidate,德阳市区海之防水工程部,,skipped,noop,,
715,partner,230,河北楠涵水利机械有限公司||duplicate_across_carriers,河北楠涵水利机械有限公司,,skipped,noop,,
716,partner,546,周述礼||duplicate_across_carriers,周述礼,,skipped,noop,,
717,partner,851,中国平安财产保险股份有限公司广东分公司||fact_partner_candidate,中国平安财产保险股份有限公司广东分公司,,skipped,noop,,
718,partner,852,成都众和丰市政工程有限公司||fact_partner_candidate,成都众和丰市政工程有限公司,,skipped,noop,,
719,partner,182,德阳市区全鑫不锈钢经营部||duplicate_across_carriers,德阳市区全鑫不锈钢经营部,,skipped,noop,,
720,partner,210,德阳鑫川物资有限公司||duplicate_across_carriers,德阳鑫川物资有限公司,,skipped,noop,,
721,partner,317,旌阳区孝泉镇文春木材加工厂||duplicate_across_carriers,旌阳区孝泉镇文春木材加工厂,,skipped,noop,,
722,partner,439,四川立尔信工程管理咨询有限公司||duplicate_across_carriers,四川立尔信工程管理咨询有限公司,,skipped,noop,,
723,partner,853,苏州梦启诚机械设备有限公司||fact_partner_candidate,苏州梦启诚机械设备有限公司,,skipped,noop,,
724,partner,856,双东镇东美村村民委员会||fact_partner_candidate,双东镇东美村村民委员会,,skipped,noop,,
725,partner,854,四川朗照律师事务所||fact_partner_candidate,四川朗照律师事务所,,skipped,noop,,
726,partner,855,德阳市旌阳区双东镇东美村村民委员会||fact_partner_candidate,德阳市旌阳区双东镇东美村村民委员会,,skipped,noop,,
727,partner,540,中江县凯江镇鑫亿隆酒店用品批发部||duplicate_across_carriers,中江县凯江镇鑫亿隆酒店用品批发部,,skipped,noop,,
728,partner,857,报销||fact_partner_candidate,报销,,skipped,noop,,
729,partner,324,旌阳区鑫宇建材经营部|92510603ma63r7td8e|tax_code_conflict,旌阳区鑫宇建材经营部,,skipped,noop,,
730,partner,858,成都千胶百媚商贸有限公司||fact_partner_candidate,成都千胶百媚商贸有限公司,,skipped,noop,,
731,partner,440,四川立格建设项目管理有限公司||duplicate_across_carriers,四川立格建设项目管理有限公司,,skipped,noop,,
732,partner,359,罗明贵||duplicate_across_carriers,罗明贵,,skipped,noop,,
733,partner,534,浙江六来机电有限公司||duplicate_across_carriers,浙江六来机电有限公司,,skipped,noop,,
734,partner,859,德阳市明丰工艺玻璃厂||fact_partner_candidate,德阳市明丰工艺玻璃厂,,skipped,noop,,
735,partner,12,成都佳林园公用设施有限公司||duplicate_across_carriers,成都佳林园公用设施有限公司,,skipped,noop,,
736,partner,391,四川安正智慧计量检测有限公司||duplicate_across_carriers,四川安正智慧计量检测有限公司,,skipped,noop,,
737,partner,860,山东龙洲交通设施有限公司||fact_partner_candidate,山东龙洲交通设施有限公司,,skipped,noop,,
738,partner,511,田德银||duplicate_across_carriers,田德银,,skipped,noop,,
739,partner,861,德阳市睿丰贸易有限公司||fact_partner_candidate,德阳市睿丰贸易有限公司,,skipped,noop,,
740,partner,862,成都杰仕龙工贸有限公司||fact_partner_candidate,成都杰仕龙工贸有限公司,,skipped,noop,,
741,partner,376,郫都区弘昌建材经营部||duplicate_across_carriers,郫都区弘昌建材经营部,,skipped,noop,,
742,partner,863,刘恒伟||fact_partner_candidate,刘恒伟,,skipped,noop,,
743,partner,864,中国平安财产保险股份有限公司德阳中心支公司||fact_partner_candidate,中国平安财产保险股份有限公司德阳中心支公司,,skipped,noop,,
744,partner,865,德阳卓优鼎广告有限公司||fact_partner_candidate,德阳卓优鼎广告有限公司,,skipped,noop,,
745,partner,501,孙传章（劳务）||duplicate_across_carriers,孙传章（劳务）,,skipped,noop,,
746,partner,866,成都资禺花镜园林工程有限公司||fact_partner_candidate,成都资禺花镜园林工程有限公司,,skipped,noop,,
747,partner,867,四川亿顺峰环卫设备有限公司||fact_partner_candidate,四川亿顺峰环卫设备有限公司,,skipped,noop,,
748,partner,379,青白江区鑫合信货运部||duplicate_across_carriers,青白江区鑫合信货运部,,skipped,noop,,
749,partner,868,旌阳区隆源建材经营部||fact_partner_candidate,旌阳区隆源建材经营部,,skipped,noop,,
750,partner,869,天台凯元商贸有限公司||fact_partner_candidate,天台凯元商贸有限公司,,skipped,noop,,
751,partner,870,四川晨光信息自动化工程有限公司||fact_partner_candidate,四川晨光信息自动化工程有限公司,,skipped,noop,,
752,partner,415,四川华西旌诚置业有限公司||duplicate_across_carriers,四川华西旌诚置业有限公司,,skipped,noop,,
753,partner,871,秦军负责人||fact_partner_candidate,秦军负责人,,skipped,noop,,
754,partner,308,旌阳区盛行办公设备经营部||duplicate_across_carriers,旌阳区盛行办公设备经营部,,skipped,noop,,
755,partner,872,鸿瑞电缆有限公司||fact_partner_candidate,鸿瑞电缆有限公司,,skipped,noop,,
756,partner,873,成都鸿运腾达园林工程有限公司||fact_partner_candidate,成都鸿运腾达园林工程有限公司,,skipped,noop,,
757,partner,874,邓初荣||fact_partner_candidate,邓初荣,,skipped,noop,,
758,partner,494,四川中天创远企业管理有限公司||duplicate_across_carriers,四川中天创远企业管理有限公司,,skipped,noop,,
759,partner,512,王道辉||duplicate_across_carriers,王道辉,,skipped,noop,,
760,partner,875,四川洋铄电力物资贸易有限公司||fact_partner_candidate,四川洋铄电力物资贸易有限公司,,skipped,noop,,
761,partner,876,德阳市区显举机械修理部||fact_partner_candidate,德阳市区显举机械修理部,,skipped,noop,,
762,partner,227,桂连全||duplicate_across_carriers,桂连全,,skipped,noop,,
763,partner,877,绵竹市孝德镇川流云集建材经营部||fact_partner_candidate,绵竹市孝德镇川流云集建材经营部,,skipped,noop,,
764,partner,878,沧州圣翔管道装备有限公司||fact_partner_candidate,沧州圣翔管道装备有限公司,,skipped,noop,,
765,partner,879,武孝磊||fact_partner_candidate,武孝磊,,skipped,noop,,
766,partner,880,旌阳区子荣工程机械租赁服务部||fact_partner_candidate,旌阳区子荣工程机械租赁服务部,,skipped,noop,,
767,partner,881,德阳市讯立科技有限公司||fact_partner_candidate,德阳市讯立科技有限公司,,skipped,noop,,
768,partner,542,中江县中达财税咨询服务有限公司||duplicate_across_carriers,中江县中达财税咨询服务有限公司,,skipped,noop,,
769,partner,206,德阳四通民建水泥制品有限公司||duplicate_across_carriers,德阳四通民建水泥制品有限公司,,skipped,noop,,
770,partner,310,旌阳区顺心电动车经营部||duplicate_same_carrier_or_empty_tax,旌阳区顺心电动车经营部,,skipped,noop,,
771,partner,882,曾令强||fact_partner_candidate,曾令强,,skipped,noop,,
772,partner,883,廖述森||fact_partner_candidate,廖述森,,skipped,noop,,
773,partner,884,德阳市区怡鑫悦烘焙服务部||fact_partner_candidate,德阳市区怡鑫悦烘焙服务部,,skipped,noop,,
774,partner,885,广汉市远憬再生资源回收经营部(个体工商户)||fact_partner_candidate,广汉市远憬再生资源回收经营部(个体工商户),,skipped,noop,,
775,partner,886,舒小明||fact_partner_candidate,舒小明,,skipped,noop,,
776,partner,387,社保局||duplicate_across_carriers,社保局,,skipped,noop,,
777,partner,887,成都市祥成建辅建材经营部||fact_partner_candidate,成都市祥成建辅建材经营部,,skipped,noop,,
778,partner,889,德阳市区永发办公用品经营部||fact_partner_candidate,德阳市区永发办公用品经营部,,skipped,noop,,
779,partner,888,德阳腾飞商贸有限公司||fact_partner_candidate,德阳腾飞商贸有限公司,,skipped,noop,,
780,partner,201,德阳市星耀建材有限公司||duplicate_across_carriers,德阳市星耀建材有限公司,,skipped,noop,,
781,partner,890,德阳正弘商贸有限公司||fact_partner_candidate,德阳正弘商贸有限公司,,skipped,noop,,
782,partner,891,德阳森元路面工程有限公司||fact_partner_candidate,德阳森元路面工程有限公司,,skipped,noop,,
783,business_entity,37,26910d20f3864c7581fba068175a20f9,四川宏政嘉斯建筑工程有限公司,,skipped,noop,,
784,partner,6,旌阳区芝英五金经营部||duplicate_across_carriers,旌阳区芝英五金经营部,,skipped,noop,,
785,partner,892,德阳市晨鑫建材有限公司||fact_partner_candidate,德阳市晨鑫建材有限公司,,skipped,noop,,
786,partner,233,湖南开工智合数字技术有限公司||duplicate_across_carriers,湖南开工智合数字技术有限公司,,skipped,noop,,
787,business_entity,38,fcbdeaa1aade4da5a7adbab4e96d484c,德阳市福兴建筑劳务有限公司,,skipped,noop,,
788,partner,893,史洪斌||fact_partner_candidate,史洪斌,,skipped,noop,,
789,partner,493,四川中礼仁学建筑工程有限公司||duplicate_across_carriers,四川中礼仁学建筑工程有限公司,,skipped,noop,,
790,partner,894,贾长蓉||fact_partner_candidate,贾长蓉,,skipped,noop,,
791,partner,474,四川鑫永欣建材有限公司||duplicate_across_carriers,四川鑫永欣建材有限公司,,skipped,noop,,
792,partner,895,四川省铭瑞建材有限公司||fact_partner_candidate,四川省铭瑞建材有限公司,,skipped,noop,,
793,partner,896,绵竹市美熙建材有限公司||fact_partner_candidate,绵竹市美熙建材有限公司,,skipped,noop,,
794,partner,897,南京泰吉电器有限公司||fact_partner_candidate,南京泰吉电器有限公司,,skipped,noop,,
795,partner,898,郑红明班组||fact_partner_candidate,郑红明班组,,skipped,noop,,
796,partner,130,德阳开发区宏福办公设备经营部||duplicate_same_carrier_or_empty_tax,德阳开发区宏福办公设备经营部,,skipped,noop,,
797,partner,207,德阳先河非融资性担保有限公司||duplicate_across_carriers,德阳先河非融资性担保有限公司,,skipped,noop,,
798,partner,460,四川省万泰租赁有限公司||duplicate_across_carriers,四川省万泰租赁有限公司,,skipped,noop,,
799,partner,84,成都耘竹不锈钢有限公司||duplicate_across_carriers,成都耘竹不锈钢有限公司,,skipped,noop,,
800,partner,312,旌阳区特伟达建筑材料经营部||duplicate_across_carriers,旌阳区特伟达建筑材料经营部,,skipped,noop,,
801,partner,899,德阳市区金顺利商贸行||fact_partner_candidate,德阳市区金顺利商贸行,,skipped,noop,,
802,partner,900,黄小兰||fact_partner_candidate,黄小兰,,skipped,noop,,
803,partner,901,四川川蓉金标交通工程有限公司||fact_partner_candidate,四川川蓉金标交通工程有限公司,,skipped,noop,,
804,partner,902,旌阳区旌泰五金机电经营部||fact_partner_candidate,旌阳区旌泰五金机电经营部,,skipped,noop,,
805,partner,382,阮文武||duplicate_across_carriers,阮文武,,skipped,noop,,
806,partner,903,旌东电缆||fact_partner_candidate,旌东电缆,,skipped,noop,,
807,partner,904,德阳市区旺财汽车配件经营部||fact_partner_candidate,德阳市区旺财汽车配件经营部,,skipped,noop,,
808,partner,459,四川省天然气管道投资有限责任公司||duplicate_across_carriers,四川省天然气管道投资有限责任公司,,skipped,noop,,
809,partner,905,德阳市区志强涂料经营部||fact_partner_candidate,德阳市区志强涂料经营部,,skipped,noop,,
810,partner,906,旌阳区孝感镇创利建材经营部||fact_partner_candidate,旌阳区孝感镇创利建材经营部,,skipped,noop,,
811,partner,450,四川日盛项目管理有限公司||duplicate_across_carriers,四川日盛项目管理有限公司,,skipped,noop,,
812,partner,907,旌阳区旌芯诚信息咨询服务工作室（个体工商户）||fact_partner_candidate,旌阳区旌芯诚信息咨询服务工作室（个体工商户）,,skipped,noop,,
813,partner,231,胡莎（劳务）||duplicate_across_carriers,胡莎（劳务）,,skipped,noop,,
814,partner,490,四川正益工程项目管理有限公司||duplicate_across_carriers,四川正益工程项目管理有限公司,,skipped,noop,,
815,partner,349,李宗军（劳务）||duplicate_across_carriers,李宗军（劳务）,,skipped,noop,,
816,partner,908,刘汶衔负责人||fact_partner_candidate,刘汶衔负责人,,skipped,noop,,
817,business_entity,39,b641ea246c6942d2a4fac9014e827873,四川楷楠建设工程有限公司,,skipped,noop,,
818,partner,909,德阳苏城亿商贸有限公司||fact_partner_candidate,德阳苏城亿商贸有限公司,,skipped,noop,,
819,partner,305,旌阳区瑞丰建材经营部|92510603ma63unpd2n|tax_code_conflict,旌阳区瑞丰建材经营部,,skipped,noop,,
820,partner,910,中国人民财产保险股份有限公司成都市分公司||fact_partner_candidate,中国人民财产保险股份有限公司成都市分公司,,skipped,noop,,
821,partner,411,四川鸿泰装配式钢构有限公司||duplicate_across_carriers,四川鸿泰装配式钢构有限公司,,skipped,noop,,
822,partner,911,旌阳区汇龙建筑机械经营部||fact_partner_candidate,旌阳区汇龙建筑机械经营部,,skipped,noop,,
823,partner,912,旌阳区汇龙机械经营部||fact_partner_candidate,旌阳区汇龙机械经营部,,skipped,noop,,
824,partner,913,沭阳县超能园艺苗木场||fact_partner_candidate,沭阳县超能园艺苗木场,,skipped,noop,,
825,business_entity,40,c264505c4bba4062be8330148257caf7,四川宏川建筑劳务有限公司,,skipped,noop,,
826,business_entity,41,19d4645e51d94fdf967935666b96fba1,四川鑫垚建筑劳务有限公司,,skipped,noop,,
827,partner,183,德阳市区三鑫装饰广告部||duplicate_across_carriers,德阳市区三鑫装饰广告部,,skipped,noop,,
