legacy_partner_source,legacy_partner_id,name,reason,matched_ids
xlsx_supplier_cooperat_company,credit:91510600740032542C,中国太平洋财产保险股份有限公司德阳中心支公司,multiple_vat_matches,7362;894;633
xlsx_supplier_cooperat_company,credit:92510600MA62GJ949K,德阳市区永沁建材经营部,multiple_vat_matches,7392;6459
xlsx_supplier_cooperat_company,name:中国农业发展银行四川省分行,中国农业发展银行四川省分行,multiple_name_matches,6316;6051
xlsx_supplier_cooperat_company,name:中国太平洋财产保险股份有限公司德阳中心支公司,中国太平洋财产保险股份有限公司德阳中心支公司,multiple_name_matches,7362;894;633
xlsx_supplier_cooperat_company,name:中国石油天然气股份有限公司四川德阳销售分公司,中国石油天然气股份有限公司四川德阳销售分公司,multiple_name_matches,7264;6486;5645
xlsx_supplier_cooperat_company,name:中江县乐中机砖制造有限责任公司,中江县乐中机砖制造有限责任公司,multiple_name_matches,760;469
xlsx_supplier_cooperat_company,name:中江县南华镇创新石材经营部,中江县南华镇创新石材经营部,multiple_name_matches,8438;6446;3305
xlsx_supplier_cooperat_company,name:中江县永太镇楷鑫装饰服务部,中江县永太镇楷鑫装饰服务部,multiple_name_matches,2500;669
xlsx_supplier_cooperat_company,name:农民工专户,农民工专户,multiple_name_matches,5655;5533;4187
xlsx_supplier_cooperat_company,name:凉山州宏泰建筑劳务有限公司,凉山州宏泰建筑劳务有限公司,multiple_name_matches,8447;2471;354
xlsx_supplier_cooperat_company,name:刘娟,刘娟,multiple_name_matches,6957;6851
xlsx_supplier_cooperat_company,name:剑阁县巧匠劳务有限公司,剑阁县巧匠劳务有限公司,multiple_name_matches,3595;902
xlsx_supplier_cooperat_company,name:劳务人工,劳务人工,multiple_name_matches,6360;4463
xlsx_supplier_cooperat_company,name:北川创建工程机械租赁有限公司,北川创建工程机械租赁有限公司,multiple_name_matches,8451;4538;3545
xlsx_supplier_cooperat_company,name:喀什亚昌商贸有限公司,喀什亚昌商贸有限公司,multiple_name_matches,4537;4204
xlsx_supplier_cooperat_company,name:喀什市羽环工程机械租赁部,喀什市羽环工程机械租赁部,multiple_name_matches,4858;4822
xlsx_supplier_cooperat_company,name:喀什新路美建材有限公司英吉沙县分公司,喀什新路美建材有限公司英吉沙县分公司,multiple_name_matches,8455;6183;2895
xlsx_supplier_cooperat_company,name:四川七星劳务有限公司成都分公司,四川七星劳务有限公司成都分公司,multiple_name_matches,6171;3488;2378
xlsx_supplier_cooperat_company,name:四川三元聚弘建筑工程有限公司,四川三元聚弘建筑工程有限公司,multiple_name_matches,4475;2537
xlsx_supplier_cooperat_company,name:四川中德立鑫建设工程有限公司,四川中德立鑫建设工程有限公司,multiple_name_matches,8456;5578;1194
xlsx_supplier_cooperat_company,name:四川中瑞盛达商贸有限公司,四川中瑞盛达商贸有限公司,multiple_name_matches,2304;1422
xlsx_supplier_cooperat_company,name:四川中诚慧燃科技有限公司,四川中诚慧燃科技有限公司,multiple_name_matches,548;362
xlsx_supplier_cooperat_company,name:四川丰达瑞建设工程有限公司,四川丰达瑞建设工程有限公司,multiple_name_matches,3693;3402
xlsx_supplier_cooperat_company,name:四川乔森建设工程有限公司,四川乔森建设工程有限公司,multiple_name_matches,8457;3990
xlsx_supplier_cooperat_company,name:四川保盛建设集团有限公司,四川保盛建设集团有限公司,multiple_name_matches,7475;6068;4188
xlsx_supplier_cooperat_company,name:四川元鼎机械制造有限公司,四川元鼎机械制造有限公司,multiple_name_matches,1514;533
xlsx_supplier_cooperat_company,name:四川华亚智优科技有限公司,四川华亚智优科技有限公司,multiple_name_matches,5081;2655
xlsx_supplier_cooperat_company,name:四川华招项目管理有限公司,四川华招项目管理有限公司,multiple_name_matches,4890;3060
xlsx_supplier_cooperat_company,name:四川博懿祥机械设备租赁有限公司,四川博懿祥机械设备租赁有限公司,multiple_name_matches,6474;6230
xlsx_supplier_cooperat_company,name:四川博文门窗有限公司,四川博文门窗有限公司,multiple_name_matches,5945;1663
xlsx_supplier_cooperat_company,name:四川友鑫建筑工程有限公司,四川友鑫建筑工程有限公司,multiple_name_matches,2949;1501
xlsx_supplier_cooperat_company,name:四川可为景观园林工程有限公司,四川可为景观园林工程有限公司,multiple_name_matches,7483;2542
xlsx_supplier_cooperat_company,name:四川名云百卓建筑工程有限公司,四川名云百卓建筑工程有限公司,multiple_name_matches,8466;6291;3147
xlsx_supplier_cooperat_company,name:四川安高消防工程有限公司中江分公司,四川安高消防工程有限公司中江分公司,multiple_name_matches,4918;1285
xlsx_supplier_cooperat_company,name:四川宏娇建筑劳务有限公司,四川宏娇建筑劳务有限公司,multiple_name_matches,3616;1403
xlsx_supplier_cooperat_company,name:四川宏旭建材有限公司,四川宏旭建材有限公司,multiple_name_matches,1786;830;494
xlsx_supplier_cooperat_company,name:四川宏跃科技保温工程有限公司,四川宏跃科技保温工程有限公司,multiple_name_matches,2875;2539
xlsx_supplier_cooperat_company,name:四川宝烨金属制品有限公司,四川宝烨金属制品有限公司,multiple_name_matches,6340;4237
xlsx_supplier_cooperat_company,name:四川川投水务集团中江供排水有限公司,四川川投水务集团中江供排水有限公司,multiple_name_matches,5922;1965
xlsx_supplier_cooperat_company,name:四川巨腾建筑工程有限公司,四川巨腾建筑工程有限公司,multiple_name_matches,5888;4377;3593
xlsx_supplier_cooperat_company,name:四川新驰峰商贸有限公司,四川新驰峰商贸有限公司,multiple_name_matches,5500;3726
xlsx_supplier_cooperat_company,name:四川昆程建材有限公司,四川昆程建材有限公司,multiple_name_matches,7503;1620;643
xlsx_supplier_cooperat_company,name:四川汇德贷非融资性担保有限公司,四川汇德贷非融资性担保有限公司,multiple_name_matches,6478;6122
xlsx_supplier_cooperat_company,name:四川涛聚信商贸有限责任公司,四川涛聚信商贸有限责任公司,multiple_name_matches,5628;3066
xlsx_supplier_cooperat_company,name:四川狮力威新材料科技有限公司,四川狮力威新材料科技有限公司,multiple_name_matches,5704;4541
xlsx_supplier_cooperat_company,name:四川瑞欣恒达建材销售有限公司,四川瑞欣恒达建材销售有限公司,multiple_name_matches,8479;4654;1923
xlsx_supplier_cooperat_company,name:四川省德阳市坤鑫建筑劳务有限责任公司,四川省德阳市坤鑫建筑劳务有限责任公司,multiple_name_matches,6471;6250
xlsx_supplier_cooperat_company,name:四川省鑫顺发机械租赁有限公司,四川省鑫顺发机械租赁有限公司,multiple_name_matches,8483;7313;5537
xlsx_supplier_cooperat_company,name:四川知诚博众商贸有限公司,四川知诚博众商贸有限公司,multiple_name_matches,8484;3914
xlsx_supplier_cooperat_company,name:四川科利建筑劳务发展有限公司,四川科利建筑劳务发展有限公司,multiple_name_matches,6057;5182;1643
xlsx_supplier_cooperat_company,name:四川美迅达通讯有限责任公司德阳分公司,四川美迅达通讯有限责任公司德阳分公司,multiple_name_matches,8486;4102
xlsx_supplier_cooperat_company,name:四川航兴建筑工程有限公司,四川航兴建筑工程有限公司,multiple_name_matches,8487;3415
xlsx_supplier_cooperat_company,name:四川荣岐耀建设有限公司,四川荣岐耀建设有限公司,multiple_name_matches,4588;2031
xlsx_supplier_cooperat_company,name:四川都江堰蜀龙防火材料有限公司,四川都江堰蜀龙防火材料有限公司,multiple_name_matches,2914;424
xlsx_supplier_cooperat_company,name:四川鑫垚建筑劳务有限公司,四川鑫垚建筑劳务有限公司,multiple_name_matches,7543;4371;1395
xlsx_supplier_cooperat_company,name:四川锦泰致远智能工程有限公司,四川锦泰致远智能工程有限公司,multiple_name_matches,5399;5012;3622
xlsx_supplier_cooperat_company,name:四川长腾建筑劳务有限公司,四川长腾建筑劳务有限公司,multiple_name_matches,8488;6359;4763
xlsx_supplier_cooperat_company,name:四川霖彬建材有限公司,四川霖彬建材有限公司,multiple_name_matches,6561;5211
xlsx_supplier_cooperat_company,name:四川鼎智盛工程项目管理有限公司,四川鼎智盛工程项目管理有限公司,multiple_name_matches,8492;4853
xlsx_supplier_cooperat_company,name:大通通利水泥制品有限公司,大通通利水泥制品有限公司,multiple_name_matches,8493;646;555
xlsx_supplier_cooperat_company,name:安平县创景丝网制品有限公司,安平县创景丝网制品有限公司,multiple_name_matches,2193;1042
xlsx_supplier_cooperat_company,name:宏安吊装,宏安吊装,multiple_name_matches,8495;3275
xlsx_supplier_cooperat_company,name:屏山县黄桷坝加油站,屏山县黄桷坝加油站,multiple_name_matches,2921;1387
xlsx_supplier_cooperat_company,name:布拖县三丰机械设备租赁有限公司,布拖县三丰机械设备租赁有限公司,multiple_name_matches,6336;461
xlsx_supplier_cooperat_company,name:布拖县志诚商贸有限公司,布拖县志诚商贸有限公司,multiple_name_matches,4899;990
xlsx_supplier_cooperat_company,name:布拖县民主加油站,布拖县民主加油站,multiple_name_matches,5915;1566
xlsx_supplier_cooperat_company,name:广安市鼎卓建筑工程咨询有限公司,广安市鼎卓建筑工程咨询有限公司,multiple_name_matches,4679;1583
xlsx_supplier_cooperat_company,name:广州峰华石材有限公司,广州峰华石材有限公司,multiple_name_matches,4515;2526
xlsx_supplier_cooperat_company,name:广州市成际贸易有限公司,广州市成际贸易有限公司,multiple_name_matches,2707;1694
xlsx_supplier_cooperat_company,name:广州市飞隆工程运输有限公司,广州市飞隆工程运输有限公司,multiple_name_matches,6568;6429;4639
xlsx_supplier_cooperat_company,name:广汉市丰众建材经营部,广汉市丰众建材经营部,multiple_name_matches,5499;4561;4529
xlsx_supplier_cooperat_company,name:广汉顺宏涂料有限公司,广汉顺宏涂料有限公司,multiple_name_matches,3569;3133
xlsx_supplier_cooperat_company,name:库尔班江依明,库尔班江·依明,multiple_name_matches,8498;6487;3433
xlsx_supplier_cooperat_company,name:德阳佰盛旌鸿贸易有限公司,德阳佰盛旌鸿贸易有限公司,multiple_name_matches,5614;5440
xlsx_supplier_cooperat_company,name:德阳兴灏工程机械租赁有限公司,德阳兴灏工程机械租赁有限公司,multiple_name_matches,8504;7577;6215
xlsx_supplier_cooperat_company,name:德阳凯达门业有限公司,德阳凯达门业有限公司,multiple_name_matches,1479;189
xlsx_supplier_cooperat_company,name:德阳市东汽实业开发有限责任公司加油站,德阳市东汽实业开发有限责任公司加油站,multiple_name_matches,5413;3486
xlsx_supplier_cooperat_company,name:德阳市中达建筑设备租赁有限公司,德阳市中达建筑设备租赁有限公司,multiple_name_matches,2819;291
xlsx_supplier_cooperat_company,name:德阳市九鼎机械设备租赁有限公司,德阳市九鼎机械设备租赁有限公司,multiple_name_matches,7390;5099;4442
xlsx_supplier_cooperat_company,name:德阳市区大宝漆专卖店,德阳市区大宝漆专卖店,multiple_name_matches,3329;2533
xlsx_supplier_cooperat_company,name:德阳市区天义光电检测行,德阳市区天义光电检测行,multiple_name_matches,4489;2439;1314
xlsx_supplier_cooperat_company,name:德阳市区永沁建材经营部,德阳市区永沁建材经营部,multiple_name_matches,7392;6459;4333
xlsx_supplier_cooperat_company,name:德阳市区汪哥木材经营部,德阳市区汪哥木材经营部,multiple_name_matches,3228;2472;638
xlsx_supplier_cooperat_company,name:德阳市区海旺建材经营部,德阳市区海旺建材经营部,multiple_name_matches,7346;5244;4544
xlsx_supplier_cooperat_company,name:德阳市区瑞克防水材料经营部,德阳市区瑞克防水材料经营部,multiple_name_matches,6015;4465
xlsx_supplier_cooperat_company,name:德阳市华壹商贸有限公司,德阳市华壹商贸有限公司,multiple_name_matches,8509;7598;3230
xlsx_supplier_cooperat_company,name:德阳市吉瑞租赁有限公司,德阳市吉瑞租赁有限公司,multiple_name_matches,5568;2121
xlsx_supplier_cooperat_company,name:德阳市浙民电器设备有限公司,德阳市浙民电器设备有限公司,multiple_name_matches,218;179
xlsx_supplier_cooperat_company,name:德阳市罗江区社会保险服务中心,德阳市罗江区社会保险服务中心,multiple_name_matches,4965;3728;1151
xlsx_supplier_cooperat_company,name:德阳市金庆物资有限公司,德阳市金庆物资有限公司,multiple_name_matches,5143;302
xlsx_supplier_cooperat_company,name:德阳开发区兰兰五金维修店,德阳开发区兰兰五金维修店,multiple_name_matches,5204;2042
xlsx_supplier_cooperat_company,name:德阳彤宁土石方工程有限公司,德阳彤宁土石方工程有限公司,multiple_name_matches,4124;1000
xlsx_supplier_cooperat_company,name:德阳木盛旺建材有限公司,德阳木盛旺建材有限公司,multiple_name_matches,1418;733
xlsx_supplier_cooperat_company,name:德阳欣宇玉诚商贸有限公司,德阳欣宇玉诚商贸有限公司,multiple_name_matches,8527;7631;1847
xlsx_supplier_cooperat_company,name:德阳经开区旌鸿茂机械租赁经营部个体工商户,德阳经开区旌鸿茂机械租赁经营部（个体工商户）,multiple_name_matches,6377;5079;4170
xlsx_supplier_cooperat_company,name:忠县富民劳务有限责任公司,忠县富民劳务有限责任公司,multiple_name_matches,2870;2592
xlsx_supplier_cooperat_company,name:成华区转棉品商贸部,成华区转棉品商贸部,multiple_name_matches,5454;4145
xlsx_supplier_cooperat_company,name:成都众冠新五金交电有限公司,成都众冠新五金交电有限公司,multiple_name_matches,2112;1526
xlsx_supplier_cooperat_company,name:成都宁锋商贸有限公司,成都宁锋商贸有限公司,multiple_name_matches,8535;4995
xlsx_supplier_cooperat_company,name:成都市长峰钢铁集团有限公司,成都市长峰钢铁集团有限公司,multiple_name_matches,1689;1245
xlsx_supplier_cooperat_company,name:成都玲菲家具有限公司,成都玲菲家具有限公司,multiple_name_matches,3038;2468
xlsx_supplier_cooperat_company,name:成都磊数科技有限公司,成都磊数科技有限公司,multiple_name_matches,7671;2487;690
xlsx_supplier_cooperat_company,name:成都鑫蓉逸商贸有限公司,成都鑫蓉逸商贸有限公司,multiple_name_matches,2252;127
xlsx_supplier_cooperat_company,name:成都长红润晨建材有限公司,成都长红润晨建材有限公司,multiple_name_matches,8537;7675;213
xlsx_supplier_cooperat_company,name:成都阿城非融资性担保有限公司,成都阿城非融资性担保有限公司,multiple_name_matches,4528;641
xlsx_supplier_cooperat_company,name:新疆亿通强星线缆有限公司,新疆亿通强星线缆有限公司,multiple_name_matches,5457;5019;4816
xlsx_supplier_cooperat_company,name:新疆凌新建筑工程有限公司,新疆凌新建筑工程有限公司,multiple_name_matches,8538;6519;5941
xlsx_supplier_cooperat_company,name:新疆纵源劳务分包有限公司喀什分公司,新疆纵源劳务分包有限公司喀什分公司,multiple_name_matches,3585;3495
xlsx_supplier_cooperat_company,name:旌阳区富玉建材经营部,旌阳区富玉建材经营部,multiple_name_matches,7687;2685;2385
xlsx_supplier_cooperat_company,name:旌阳区忠明工程机械设备租赁服务部,旌阳区忠明工程机械设备租赁服务部.,multiple_name_matches,8539;6482
xlsx_supplier_cooperat_company,name:旌阳区旌南建筑设备租赁站,旌阳区旌南建筑设备租赁站,multiple_name_matches,4850;1613
xlsx_supplier_cooperat_company,name:旌阳区星龙机电经营部,旌阳区星龙机电经营部,multiple_name_matches,7413;2724
xlsx_supplier_cooperat_company,name:旌阳区益诚建材经营部,旌阳区益诚建材经营部,multiple_name_matches,1326;264
xlsx_supplier_cooperat_company,name:旌阳区睿行达建筑材料经营部,旌阳区睿行达建筑材料经营部,multiple_name_matches,5520;4041
xlsx_supplier_cooperat_company,name:旌阳区艳阳天木门经营部,旌阳区艳阳天木门经营部,multiple_name_matches,5866;1687
xlsx_supplier_cooperat_company,name:旌阳区裕鑫五金经营部,旌阳区裕鑫五金经营部,multiple_name_matches,5683;5486
xlsx_supplier_cooperat_company,name:旌阳区金益建材经营部,旌阳区金益建材经营部,multiple_name_matches,4661;1487
xlsx_supplier_cooperat_company,name:旌阳区鑫宇建材经营部,旌阳区鑫宇建材经营部,multiple_name_matches,8543;7705;3171
xlsx_supplier_cooperat_company,name:旌阳区雷盾电动门维修经营部,旌阳区雷盾电动门维修经营部,multiple_name_matches,2241;417
xlsx_supplier_cooperat_company,name:旌阳区黄许镇建创机械租赁部,旌阳区黄许镇建创机械租赁部,multiple_name_matches,6286;5077
xlsx_supplier_cooperat_company,name:普格县顺达经营部,普格县顺达经营部,multiple_name_matches,1052;276
xlsx_supplier_cooperat_company,name:曲木求汉,曲木求汉,multiple_name_matches,5451;379
xlsx_supplier_cooperat_company,name:李俭锋,李俭锋,multiple_name_matches,6926;6790;65
xlsx_supplier_cooperat_company,name:格尔木兴磊水泥制品厂,格尔木兴磊水泥制品厂,multiple_name_matches,1046;539
xlsx_supplier_cooperat_company,name:格尔木嘉实混凝土搅拌有限公司,格尔木嘉实混凝土搅拌有限公司,multiple_name_matches,2637;862
xlsx_supplier_cooperat_company,name:永川区启乘机械设备租赁经营部个体工商户,永川区启乘机械设备租赁经营部（个体工商户）,multiple_name_matches,5084;4466
xlsx_supplier_cooperat_company,name:永州市智博工程有限公司,永州市智博工程有限公司,multiple_name_matches,2943;2143
xlsx_supplier_cooperat_company,name:江津区恒峰铝合金加工经营部,江津区恒峰铝合金加工经营部,multiple_name_matches,4277;3719
xlsx_supplier_cooperat_company,name:沙坪坝区鑫之顺五金建材经营部个体工商户,沙坪坝区鑫之顺五金建材经营部（个体工商户）,multiple_name_matches,4389;4375
xlsx_supplier_cooperat_company,name:深圳市正泓融资担保有限公司,深圳市正泓融资担保有限公司,multiple_name_matches,2844;1028
xlsx_supplier_cooperat_company,name:清远市汝通运输有限公司,清远市汝通运输有限公司,multiple_name_matches,1780;1604
xlsx_supplier_cooperat_company,name:渝北区鸣谦机械设备租赁站,渝北区鸣谦机械设备租赁站,multiple_name_matches,8554;4045;3922
xlsx_supplier_cooperat_company,name:璧山区富有建筑机械设备租赁站,璧山区富有建筑机械设备租赁站,multiple_name_matches,2666;319
xlsx_supplier_cooperat_company,name:璧山区林建工程机械租赁经营部,璧山区林建工程机械租赁经营部,multiple_name_matches,5210;4315;4140
xlsx_supplier_cooperat_company,name:璧山区渝跃建筑设备租赁站,璧山区渝跃建筑设备租赁站,multiple_name_matches,1667;1213
xlsx_supplier_cooperat_company,name:疏勒县农村信用合作联社,疏勒县农村信用合作联社,multiple_name_matches,8555;5908
xlsx_supplier_cooperat_company,name:疏附县华拓机械租赁部,疏附县华拓机械租赁部,multiple_name_matches,5020;4347
xlsx_supplier_cooperat_company,name:税务局,税务局,multiple_name_matches,7743;6814;6778
xlsx_supplier_cooperat_company,name:简平凡,简平凡,multiple_name_matches,6923;6777
xlsx_supplier_cooperat_company,name:绵竹市辰之兴工程管理服务部,绵竹市辰之兴工程管理服务部,multiple_name_matches,4119;3055
xlsx_supplier_cooperat_company,name:绵阳市游仙区福贵工程机械租赁部,绵阳市游仙区福贵工程机械租赁部,multiple_name_matches,3970;3490
xlsx_supplier_cooperat_company,name:绵阳源来志承油脂销售有限公司,绵阳源来志承油脂销售有限公司,multiple_name_matches,8560;6516;4579
xlsx_supplier_cooperat_company,name:绵阳精运物流服务有限公司,绵阳精运物流服务有限公司,multiple_name_matches,8561;6413;4249
xlsx_supplier_cooperat_company,name:绵阳鑫泰水泥制品有限公司,绵阳鑫泰水泥制品有限公司,multiple_name_matches,8562;7272;2990
xlsx_supplier_cooperat_company,name:肖辉玖,肖辉玖,multiple_name_matches,6882;6766;67
xlsx_supplier_cooperat_company,name:荣昌区昌州街道如鸿挖掘机租赁站,荣昌区昌州街道如鸿挖掘机租赁站,multiple_name_matches,8567;5882;5174
xlsx_supplier_cooperat_company,name:西藏景胜工程技术有限公司,西藏景胜工程技术有限公司,multiple_name_matches,4355;3342
xlsx_supplier_cooperat_company,name:西藏纵驰水电工程管理有限公司,西藏纵驰水电工程管理有限公司,multiple_name_matches,4839;1605
xlsx_supplier_cooperat_company,name:遂宁市祥通建材有限公司,遂宁市祥通建材有限公司,multiple_name_matches,2560;1152
xlsx_supplier_cooperat_company,name:重庆中法供水有限公司,重庆中法供水有限公司,multiple_name_matches,2212;2035
xlsx_supplier_cooperat_company,name:重庆伟翰建筑设备租赁有限公司,重庆伟翰建筑设备租赁有限公司,multiple_name_matches,6442;4559;4328
xlsx_supplier_cooperat_company,name:重庆刚宏鑫茂科技有限公司,重庆刚宏鑫茂科技有限公司,multiple_name_matches,2290;1742
xlsx_supplier_cooperat_company,name:重庆启和国际物流有限公司,重庆启和国际物流有限公司,multiple_name_matches,2575;391
xlsx_supplier_cooperat_company,name:重庆图南供应链有限公司,重庆图南供应链有限公司,multiple_name_matches,8584;6246;2568
xlsx_supplier_cooperat_company,name:重庆坤蕴建筑劳务有限公司,重庆坤蕴建筑劳务有限公司,multiple_name_matches,5986;3489
xlsx_supplier_cooperat_company,name:重庆婷创机械设备租赁有限公司,重庆婷创机械设备租赁有限公司,multiple_name_matches,6178;6132;1337
xlsx_supplier_cooperat_company,name:重庆市南川区财政局,重庆市南川区财政局,multiple_name_matches,4526;3927;3589
xlsx_supplier_cooperat_company,name:重庆市夏禾装饰工程有限责任公司,重庆市夏禾装饰工程有限责任公司,multiple_name_matches,4808;3064
xlsx_supplier_cooperat_company,name:重庆建发建筑劳务有限公司,重庆建发建筑劳务有限公司,multiple_name_matches,8587;4933;4886
xlsx_supplier_cooperat_company,name:重庆意鼎机械租赁有限公司,重庆意鼎机械租赁有限公司,multiple_name_matches,1183;265
xlsx_supplier_cooperat_company,name:重庆戴杨合建材有限公司,重庆戴杨合建材有限公司,multiple_name_matches,2387;271
xlsx_supplier_cooperat_company,name:重庆映锦建筑劳务有限公司,重庆映锦建筑劳务有限公司,multiple_name_matches,191;133
xlsx_supplier_cooperat_company,name:重庆智辉建筑工程设备租赁有限公司,重庆智辉建筑工程设备租赁有限公司,multiple_name_matches,1272;917
xlsx_supplier_cooperat_company,name:重庆柯腾建筑劳务有限公司,重庆柯腾建筑劳务有限公司,multiple_name_matches,8590;3884;2766
xlsx_supplier_cooperat_company,name:重庆汇尔固机电设备有限公司,重庆汇尔固机电设备有限公司,multiple_name_matches,6534;3901;2674
xlsx_supplier_cooperat_company,name:重庆泸酒阁商贸有限公司,重庆泸酒阁商贸有限公司,multiple_name_matches,6177;6064
xlsx_supplier_cooperat_company,name:重庆腾晟建筑劳务有限公司,重庆腾晟建筑劳务有限公司,multiple_name_matches,2464;1807
xlsx_supplier_cooperat_company,name:重庆象征建筑设备租赁有限公司,重庆象征建筑设备租赁有限公司,multiple_name_matches,6477;6454
xlsx_supplier_cooperat_company,name:重庆鑫亚坤新型环保建材有限公司,重庆鑫亚坤新型环保建材有限公司,multiple_name_matches,2917;2842
xlsx_supplier_cooperat_company,name:重庆零零柒工程担保有限公司,重庆零零柒工程担保有限公司,multiple_name_matches,8595;5972;4086
xlsx_supplier_cooperat_company,name:金牛区浩辉建材经营部,金牛区浩辉建材经营部,multiple_name_matches,8596;4962;4592
xlsx_supplier_cooperat_company,name:铜梁区春林建筑设备租赁站,铜梁区春林建筑设备租赁站,multiple_name_matches,6338;2810;511
xlsx_supplier_cooperat_company,name:铜梁区渝铜电脑商行,铜梁区渝铜电脑商行,multiple_name_matches,3496;3186
xlsx_supplier_cooperat_company,name:陕西仝禾建设工程有限责任公司疏勒县分公司,陕西仝禾建设工程有限责任公司疏勒县分公司,multiple_name_matches,5829;3776
xlsx_supplier_cooperat_company,name:零星发票,零星发票,multiple_name_matches,6335;5418;3635
xlsx_supplier_cooperat_company,name:麦盖提县盛源水利电力工程有限公司,麦盖提县盛源水利电力工程有限公司,multiple_name_matches,8607;6272;4498
